id,code,name,utv,utch,plg,plgp,plgo,sumrg,obz,obzsumrg,plgpsumrg,plgsumrg,level,isLeaf,loaded,expanded,parentCode,parent_id
450,760.0,Управление культуры и спорта области,2878935.0,0.0,0.0,0.0,0.0,0.0,0.0,0.0,0.0,0.0,3,False,True,False,2.0,435.0
451,762.0,"Управление строительства, энергетики и жилищно-коммунального хозяйства области",2657635.0,0.0,0.0,0.0,0.0,0.0,0.0,0.0,0.0,0.0,3,False,True,False,2.0,435.0
452,768.0,"Управление физической культуры, спорта и туризма области",9264822.0,13914324.2,13914324.2,12123837.6,13655652.5,11931588.542,13155597.289,1224008.7470000014,98.4142887397304,85.75039916060027,3,False,True,False,2.0,435.0
453,802.0,"Отдел культуры, физической культуры и спорта района (города областного значения)",226500.0,376605.6,356605.6,221571.1,256022.3,220794.117,220984.002,189.8850000000093,99.6493301698642,61.91549347514454,3,False,True,False,2.0,435.0
454,804.0,"Отдел физической культуры, спорта и туризма района (города областного значения",171911.0,1726871.8,1927784.8,1554453.0,1722207.6,1553501.196,1609499.281,55998.08499999996,99.93876920048402,80.58478290730376,3,False,True,False,2.0,435.0
455,809.0,"Отдел жилищно-коммунального хозяйства, пассажирского транспорта, автомобильных дорог, строительства, архитектуры и градостроительства района (города областного значения)",483770.0,0.0,0.0,0.0,0.0,0.0,0.0,0.0,0.0,0.0,3,False,True,False,2.0,435.0
456,810.0,Отдел реального сектора экономики района (города областного значения),2682739.0,2773942.0,2873942.0,1825149.0,2873848.0,1671783.404,2859741.314,1187957.9099999997,91.59709174429047,58.170394670456126,3,False,True,False,2.0,435.0
457,819.0,"Отдел внутренней политики, культуры, развития языков и спорта района (города областного значения)",740023.0,977256.8,1001436.8,858255.1,935885.0,853145.276,868966.876,15821.600000000093,99.40462643332967,85.19212355687348,3,False,True,False,2.0,435.0
458,820.0,Отдел культуры и спорта района (города областного значения),1679905.0,203830.0,0.0,0.0,0.0,0.0,0.0,0.0,0.0,0.0,3,False,True,False,2.0,435.0
459,3.0,Информационное пространство,135347864.4,144667932.5,145281582.4,105670004.3,139819775.5,102627794.586,123700993.755,21073199.169,97.12102811563905,70.64060900950098,2,False,True,False,8.0,406.0
460,121.0,"Аппарат акима города республиканского значения, столицы",65000.0,55600.0,55600.0,31516.0,55600.0,7433.0,55599.48,48166.48,23.584845792613276,13.368705035971223,3,False,True,False,3.0,459.0
461,262.0,Управление культуры области,1752529.0,2192715.7,2190076.7,1829444.7,2117703.7,1824745.783,1844515.0,19769.216999999946,99.74315064019153,83.318807190634,3,False,True,False,3.0,459.0
462,263.0,Управление внутренней политики области,8151018.0,9886006.9,9964538.9,7529814.9,9948893.9,7521377.781,9605991.488,2084613.7069999995,99.88795051256838,75.48144331093935,3,False,True,False,3.0,459.0
463,264.0,Управление по развитию языков области,948530.0,761407.0,761407.0,616883.6,720936.0,608450.842,651104.396,42653.554000000004,98.63300661583482,79.91138011602204,3,False,True,False,3.0,459.0
464,271.0,Управление строительства области,4620.0,32109.0,32109.0,2868.0,32109.0,2867.941,26770.822,23902.881,99.99794281729427,8.931891370020866,3,False,True,False,3.0,459.0
465,273.0,"Управление культуры, архивов и документации области",5613549.0,5333892.9,5333627.9,4301615.1,5087494.1,4215471.905,4307250.491,91778.58600000013,97.99742206130904,79.03573297642305,3,False,True,False,3.0,459.0
466,288.0,"Управление строительства, архитектуры и градостроительства области",0.0,6000.0,6000.0,0.0,6000.0,0.0,0.0,0.0,0.0,0.0,3,False,True,False,3.0,459.0
467,305.0,"Управление внутренней политики и по делам молодежи города республиканского значения, столицы",1890620.0,1942639.0,1942639.0,1453124.0,1942639.0,1401746.261,1807507.581,405761.32000000007,96.46432520555712,72.15680633406413,3,False,True,False,3.0,459.0
468,310.0,"Управление цифровизации и государственных услуг города республиканского значения, столицы",2800227.0,2629218.0,2629218.0,1783609.0,2552600.0,1772504.144,2349227.89,576723.746,99.37739403647325,67.41564008766105,3,False,True,False,3.0,459.0
469,312.0,"Управление культуры, развития языков и  архивов  города республиканского значения, столицы",1558140.0,1770982.0,1770982.0,1381949.0,1770982.0,1365758.983,1375034.432,9275.449000000022,98.82846494335175,77.11873881270391,3,False,True,False,3.0,459.0
470,313.0,"Управление цифровизации города республиканского значения, столицы",12997986.0,11732349.0,12207229.0,6098634.0,12183813.0,5948565.054,9787271.193,3838706.1390000004,97.5393023093368,48.729855514302216,3,False,True,False,3.0,459.0
471,325.0,"Управление общественного развития города республиканского значения, столицы",4850216.0,4860710.0,4860710.0,4022547.0,4842196.0,4022177.688,4797419.081,775241.3930000002,99.9908189512764,82.74876896585067,3,False,True,False,3.0,459.0
472,346.0,"Управление по развитию языков и архивного дела города республиканского значения, столицы",864730.0,1609348.0,1609281.0,1286352.0,1506621.0,1232073.921,1269927.785,37853.86399999983,95.78046452292996,76.56052118927646,3,False,True,False,3.0,459.0
473,361.0,"Управление культуры города республиканского значения, столицы",3282517.0,4216228.0,4216228.0,3611482.0,3817111.0,3591450.255,3673593.424,82143.16900000023,99.44533172254492,85.18159489951682,3,False,True,False,3.0,459.0
474,362.0,"Управление внутренней политики города республиканского значения, столицы",1412767.0,1807217.0,1807217.0,1273702.0,1784969.0,1272499.135,1602761.339,330262.2039999999,99.90556150496741,70.4120830536676,3,False,True,False,3.0,459.0
475,455.0,Отдел культуры и развития языков района (города областного значения),10912136.4,13151219.1,13406337.6,10765007.4,12449723.7,10760272.301,10922375.408,162103.1069999989,99.95601397357144,80.26257895370323,3,False,True,False,3.0,459.0
476,456.0,Отдел внутренней политики района (города областного значения),4822799.0,5015638.7,5015584.7,3842355.6,5013081.7,3833347.562,4810205.393,976857.8310000002,99.76555949168265,76.42872748216175,3,False,True,False,3.0,459.0
477,457.0,"Отдел культуры, развития языков, физической культуры и спорта района (города областного значения)",14596430.0,15381524.0,15279135.0,12142558.3,13721593.5,12111264.762,12353946.27,242681.50799999945,99.74228216800078,79.26669122303063,3,False,True,False,3.0,459.0
478,458.0,"Отдел жилищно-коммунального хозяйства, пассажирского транспорта и автомобильных дорог района (города областного значения)",0.0,94388.8,94388.8,100.0,94388.8,100.0,28712.198,28612.198,100.0,0.10594477310867391,3,False,True,False,3.0,459.0
479,466.0,"Отдел архитектуры, градостроительства и строительства района (города областного значения)",72799.0,548584.1,578866.2,424969.2,578866.2,353672.601,558757.361,205084.76,83.22311381624833,61.09746967433926,3,False,True,False,3.0,459.0
480,467.0,Отдел строительства района (города областного значения),107900.0,357461.5,356037.8,136127.1,356037.8,130289.621,313110.186,182820.565,95.71174365721447,36.59432256912047,3,False,True,False,3.0,459.0
481,470.0,Отдел внутренней политики и развития языков района (города областного значения),315516.0,328820.2,308193.2,229904.5,301719.2,229832.283,287093.316,57261.032999999996,99.96858826164777,74.5740928093157,3,False,True,False,3.0,459.0
482,472.0,"Отдел строительства, архитектуры и градостроительства района (города областного значения)",38449.0,442465.0,452878.5,219140.9,452878.5,214343.377,399925.767,185582.38999999998,97.81075874015302,47.329112996090565,3,False,True,False,3.0,459.0
483,478.0,"Отдел внутренней политики, культуры и развития языков района (города областного значения)",2229440.0,2181215.4,2181215.4,1753793.4,2101481.0,1753649.855,1808314.931,54665.07600000012,99.99181517047562,80.39783026472305,3,False,True,False,3.0,459.0
484,487.0,Отдел жилищно-коммунального хозяйства и жилищной инспекции района (города областного значения),1000.0,0.0,0.0,0.0,0.0,0.0,0.0,0.0,0.0,0.0,3,False,True,False,3.0,459.0
485,490.0,"Отдел коммунального хозяйства, пассажирского транспорта и автомобильных дорог района (города областного значения)",0.0,21000.0,21000.0,0.0,21000.0,0.0,18444.086,18444.086,0.0,0.0,3,False,True,False,3.0,459.0
486,492.0,"Отдел жилищно-коммунального хозяйства, пассажирского транспорта, автомобильных дорог и жилищной инспекции района (города областного значения)",0.0,59797.0,59797.0,10747.0,59797.0,10746.399,56398.719,45652.32,99.99440774169535,17.97146846831781,3,False,True,False,3.0,459.0
487,495.0,"Отдел архитектуры, строительства, жилищно-коммунального хозяйства, пассажирского транспорта и автомобильных дорог района (города областного значения)",35920.0,124556.0,124556.0,97801.6,124556.0,91338.244,101349.552,10011.30799999999,93.39135965055787,73.33106715051865,3,False,True,False,3.0,459.0
488,739.0,"Управление информатизации, оказания государственных услуг и архивов области",6423430.0,6875403.0,6874061.0,4148134.1,6874061.0,4103255.745,5638644.318,1535388.5729999999,98.91810742087628,59.69187275178385,3,False,True,False,3.0,459.0
489,740.0,Управление культуры и развития языков области,427847.0,984896.0,984896.0,753518.1,904923.1,744622.052,800735.967,56113.91499999992,98.81939823343329,75.60412997920592,3,False,True,False,3.0,459.0
490,743.0,Управление цифровых технологий области,15110439.0,13990963.8,13990963.8,9197695.9,13764653.2,8548853.492,12585718.578,4036865.085999999,92.94559838622193,61.102677515326,3,False,True,False,3.0,459.0
491,747.0,Управление информации и общественного развития области,862318.0,2088774.0,2088774.0,1611124.0,2088774.0,1610818.003,2019935.002,409116.99900000007,99.98100723470074,77.11786928600222,3,False,True,False,3.0,459.0
492,748.0,"Управление культуры, развития языков и архивного дела  области",4167195.0,4939666.0,4938937.0,3908457.4,4520750.0,3887953.838,4020571.561,132617.72300000023,99.47540525835078,78.7204582281572,3,False,True,False,3.0,459.0
493,752.0,Управление общественного развития области,8289552.0,7693162.8,7693162.8,6036557.3,7578580.8,5975906.108,7322756.489,1346850.381,98.9952685117393,77.67814439075694,3,False,True,False,3.0,459.0
494,755.0,"Управление цифровизации, государственных услуг и архивов области",6067245.0,7115142.0,7115142.0,5189557.0,6895808.0,3801123.216,5485433.292,1684310.0760000004,73.24562031017291,53.423012724131155,3,False,True,False,3.0,459.0
495,759.0,Управление цифровизации и архивов области,5733965.0,8454002.8,8503227.4,5448256.1,8291181.4,5156197.908,6323922.12,1167724.2120000003,94.63941880411973,60.63812791834779,3,False,True,False,3.0,459.0
496,760.0,Управление культуры и спорта области,960905.0,0.0,0.0,0.0,0.0,0.0,0.0,0.0,0.0,0.0,3,False,True,False,3.0,459.0
497,766.0,Управление культуры и туризма области,488400.0,0.0,0.0,0.0,0.0,0.0,0.0,0.0,0.0,0.0,3,False,True,False,3.0,459.0
498,802.0,"Отдел культуры, физической культуры и спорта района (города областного значения)",1713052.0,1995189.0,1893091.0,1380911.3,1549263.4,1378768.585,1394804.636,16036.050999999978,99.84483326336745,72.83160635172847,3,False,True,False,3.0,459.0
499,803.0,Отдел внутренней политики и по делам религии района (города областного значения),9551.0,9551.0,9551.0,7959.0,9551.0,7959.0,9551.0,1592.0,100.0,83.33158831535965,3,False,True,False,3.0,459.0
500,810.0,Отдел реального сектора экономики района (города областного значения),0.0,14072.0,14072.0,0.0,14072.0,0.0,13550.453,13550.453,0.0,0.0,3,False,True,False,3.0,459.0
501,819.0,"Отдел внутренней политики, культуры, развития языков и спорта района (города областного значения)",3512259.0,3449351.8,3571937.7,2916627.4,3344949.5,2911198.341,2987097.866,75899.5249999999,99.81385832828698,81.5019349581601,3,False,True,False,3.0,459.0
502,820.0,Отдел культуры и спорта района (города областного значения),1997936.0,175753.0,0.0,0.0,0.0,0.0,0.0,0.0,0.0,0.0,3,False,True,False,3.0,459.0
503,821.0,Отдел общественного развития района (города областного значения),258932.0,338913.0,338913.0,225160.4,338417.0,225158.6,285664.884,60506.284000000014,99.99920056990483,66.43551589936061,3,False,True,False,3.0,459.0
504,4.0,Туризм,11470416.0,12221890.3,12221890.3,7291203.9,11285402.7,6930482.888,9754951.507,2824468.618999999,95.05265499432817,56.705490868298824,2,False,True,False,8.0,406.0
505,265.0,Управление предпринимательства и промышленности области,42300.0,16907.0,16907.0,15907.0,16907.0,6661.333,8260.131,1598.7979999999998,41.87673980008801,39.39985213225291,3,False,True,False,4.0,504.0
506,266.0,Управление предпринимательства и индустриально-инновационного развития области,681505.0,1872813.2,1872813.2,860082.4,1326480.2,839860.464,864558.11,24697.64599999995,97.64883736721039,44.84486034165073,3,False,True,False,4.0,504.0
507,275.0,Управление предпринимательства области,295739.0,251265.0,251265.0,180994.0,251265.0,136919.672,155379.748,18460.076,75.64873531719283,54.49213857879131,3,False,True,False,4.0,504.0
508,284.0,Управление туризма области,2196602.0,2033148.1,2033148.1,1575859.1,1778500.1,1384437.73,1693014.062,308576.33199999994,87.85288798979552,68.09330466383634,3,False,True,False,4.0,504.0
509,285.0,Управление физической культуры и спорта области,44872.0,40954.0,40954.0,21622.0,40954.0,18982.348,28196.548,9214.199999999997,87.791823143095,46.35041265810422,3,False,True,False,4.0,504.0
510,288.0,"Управление строительства, архитектуры и градостроительства области",984822.0,0.0,0.0,0.0,0.0,0.0,0.0,0.0,0.0,0.0,3,False,True,False,4.0,504.0
511,334.0,"Управление по инвестициям и развитию предпринимательства города республиканского значения, столицы",2045090.0,2669310.0,2669310.0,1933765.0,2627327.0,1843764.2,2323007.0,479242.80000000005,95.34582537174889,69.07268919683364,3,False,True,False,4.0,504.0
512,380.0,"Управление туризма города республиканского значения, столицы",4652170.0,4781387.0,4781387.0,2438051.0,4759269.0,2437290.288,4400685.54,1963395.2519999999,99.9687983557358,50.97454541956131,3,False,True,False,4.0,504.0
513,467.0,Отдел строительства района (города областного значения),0.0,100.0,100.0,0.0,100.0,0.0,0.0,0.0,0.0,0.0,3,False,True,False,4.0,504.0
514,514.0,"Управление туризма, внешних связей и креативной индустрии города республиканского значения, столицы",320856.0,366135.0,366135.0,200416.0,366135.0,200119.279,211340.494,11221.214999999997,99.85194744930544,54.657238177175095,3,False,True,False,4.0,504.0
515,766.0,Управление культуры и туризма области,44982.0,0.0,0.0,0.0,0.0,0.0,0.0,0.0,0.0,0.0,3,False,True,False,4.0,504.0
516,768.0,"Управление физической культуры, спорта и туризма области",109142.0,133535.0,133535.0,20254.4,69426.4,18441.932,25559.232,7117.299999999999,91.05148510940833,13.810560527202606,3,False,True,False,4.0,504.0
517,804.0,"Отдел физической культуры, спорта и туризма района (города областного значения",10345.0,14345.0,14345.0,10399.0,14345.0,10398.664,11343.664,945.0,99.99676892008847,72.48981526664343,3,False,True,False,4.0,504.0
518,815.0,Отдел поддержки бизнеса и туризма района (города областного значения),41991.0,41991.0,41991.0,33854.0,34694.0,33606.978,33606.978,0.0,99.27033142317009,80.03376437808103,3,False,True,False,4.0,504.0
519,9.0,"Прочие услуги по организации культуры, спорта, туризма  и информационного пространства",63976447.5,77590294.3,77829877.9,55687022.6,74519074.8,54506251.248,61363771.127,6857519.878999993,97.8796292262176,70.03255397372273,2,False,True,False,8.0,406.0
520,263.0,Управление внутренней политики области,3950983.0,4620449.0,4620449.0,3270664.2,4415887.6,3172292.464,3674013.518,501721.054,96.99230095220415,68.65766647353969,3,False,True,False,9.0,519.0
521,273.0,"Управление культуры, архивов и документации области",2698958.0,2963322.0,2963293.0,2075070.1,2903460.5,1929143.36,2119487.766,190344.40599999973,92.96762359980032,65.10133692483329,3,False,True,False,9.0,519.0
522,283.0,Управление по вопросам молодежной политики области,1766099.0,2138018.0,2138018.0,1629779.4,2060823.4,1587487.044,1725936.814,138449.77000000002,97.40502573538481,74.25040593671335,3,False,True,False,9.0,519.0
523,302.0,"Управление молодежной политики города республиканского значения, столицы",2559689.0,2559689.0,2559689.0,1773656.0,2545103.0,1769641.122,2314193.065,544551.943,99.77363829288205,69.13500515101639,3,False,True,False,9.0,519.0
524,325.0,"Управление общественного развития города республиканского значения, столицы",898568.0,1003059.0,1003059.0,691912.0,958371.0,685550.184,914821.177,229270.99300000002,99.08054550289633,68.3459481446256,3,False,True,False,9.0,519.0
525,343.0,"Управление топливно-энергетического комплекса и коммунального хозяйства города республиканского значения, столицы",53340.0,0.0,0.0,0.0,0.0,0.0,0.0,0.0,0.0,0.0,3,False,True,False,9.0,519.0
526,361.0,"Управление культуры города республиканского значения, столицы",604993.0,4418890.0,4418890.0,1416355.0,4317244.0,1406291.501,1584618.865,178327.36400000006,99.2894790500969,31.82454193247625,3,False,True,False,9.0,519.0
527,362.0,"Управление внутренней политики города республиканского значения, столицы",874350.0,1038681.0,1038681.0,881030.0,1014736.0,813292.279,934415.934,121123.65500000003,92.31153070837543,78.3004867712031,3,False,True,False,9.0,519.0
528,377.0,"Управление по вопросам молодежной политики города республиканского значения, столицы",1797719.0,2157240.0,2157227.0,1690246.0,2121825.0,1575035.721,1982178.478,407142.757,93.18381590608705,73.01205301991862,3,False,True,False,9.0,519.0
529,455.0,Отдел культуры и развития языков района (города областного значения),4240244.8,5316771.4,5301044.6,4282292.2,5151430.3,4278846.479,4486924.003,208077.52399999928,99.91953559357766,80.71704356156522,3,False,True,False,9.0,519.0
530,456.0,Отдел внутренней политики района (города областного значения),14671745.7,17158095.8,17158645.3,13069787.1,16291592.1,13040102.959,14301898.392,1261795.4330000002,99.7728796898306,75.99727560660048,3,False,True,False,9.0,519.0
531,457.0,"Отдел культуры, развития языков, физической культуры и спорта района (города областного значения)",8515034.0,10990077.4,10943219.2,7863618.0,10628429.2,7496538.68,8920008.081,1423469.4010000005,95.33192838207553,68.50396161305076,3,False,True,False,9.0,519.0
532,470.0,Отдел внутренней политики и развития языков района (города областного значения),1137749.0,1720484.7,1672766.7,1193847.1,1532247.2,1188684.209,1405205.753,216521.544,99.56754168938383,71.06096797598853,3,False,True,False,9.0,519.0
533,478.0,"Отдел внутренней политики, культуры и развития языков района (города областного значения)",1493340.0,3016520.9,3041520.9,2652844.0,2990569.0,2651876.092,2744193.501,92317.40899999999,99.96351432651149,87.18914579873511,3,False,True,False,9.0,519.0
534,517.0,"Управление коммунального хозяйства города республиканского значения, столицы",0.0,53340.0,53340.0,0.0,53340.0,0.0,0.0,0.0,0.0,0.0,3,False,True,False,9.0,519.0
535,740.0,Управление культуры и развития языков области,444907.0,716219.0,716219.0,411323.4,526826.0,391075.845,431945.57,40869.725000000035,95.07746094678784,54.60283027956533,3,False,True,False,9.0,519.0
536,747.0,Управление информации и общественного развития области,549503.0,1104593.0,1104593.0,790330.0,1050997.0,786820.479,894468.903,107648.424,99.55594232788836,71.23170968854592,3,False,True,False,9.0,519.0
537,748.0,"Управление культуры, развития языков и архивного дела  области",1475350.0,3436979.7,3436881.7,2068404.9,3050889.3,2053476.523,2144445.059,90968.53599999985,99.27826621373794,59.748245713549,3,False,True,False,9.0,519.0
538,752.0,Управление общественного развития области,6048903.0,4966701.0,4966701.0,3674604.4,4793868.2,3492314.376,4137071.92,644757.5439999998,95.03919322580684,70.31456848318432,3,False,True,False,9.0,519.0
539,760.0,Управление культуры и спорта области,545415.0,0.0,0.0,0.0,0.0,0.0,0.0,0.0,0.0,0.0,3,False,True,False,9.0,519.0
540,766.0,Управление культуры и туризма области,951896.0,0.0,0.0,0.0,0.0,0.0,0.0,0.0,0.0,0.0,3,False,True,False,9.0,519.0
541,802.0,"Отдел культуры, физической культуры и спорта района (города областного значения)",1995255.0,2093287.9,2024776.9,1795507.5,1924081.9,1792536.922,1797534.952,4998.030000000028,99.83455496565735,88.53009543915678,3,False,True,False,9.0,519.0
