id,code,name,utv,utch,plg,plgp,plgo,sumrg,obz,obzsumrg,plgpsumrg,plgsumrg,level,isLeaf,loaded,expanded,parentCode,parent_id
708,335.0,"Управление транспорта и развития дорожно-транспортной инфраструктуры города республиканского значения, столицы",16100000.0,43977050.0,43977050.0,43004447.0,43477050.0,43004446.992,43477047.17,472600.1780000031,99.99999998139727,97.78838505993467,3,False,True,False,9.0,704.0
709,348.0,"Управление пассажирского транспорта и автомобильных дорог города республиканского значения, столицы",24156396.0,34473512.0,34473512.0,27225013.0,34473512.0,27194425.236,27352587.424,158162.1879999973,99.88764830341863,78.88498635126007,3,False,True,False,9.0,704.0
710,373.0,"Управление строительства города республиканского значения, столицы",0.0,100000.0,100000.0,50000.0,100000.0,0.0,0.0,0.0,0.0,0.0,3,False,True,False,9.0,704.0
711,458.0,"Отдел жилищно-коммунального хозяйства, пассажирского транспорта и автомобильных дорог района (города областного значения)",47757142.0,71614682.1,71612682.1,61796469.8,69669531.6,61794363.354,62079097.048,284733.6939999983,99.99659131661272,86.28969274982651,3,False,True,False,9.0,704.0
712,485.0,Отдел пассажирского транспорта и автомобильных дорог района (города областного значения),16607489.0,31027563.8,34065831.8,30286945.8,32800996.6,30258852.31,30362610.755,103758.4450000003,99.9072422482428,88.82463956156796,3,False,True,False,9.0,704.0
713,490.0,"Отдел коммунального хозяйства, пассажирского транспорта и автомобильных дорог района (города областного значения)",29097.0,54097.0,54097.0,32700.0,54097.0,32699.641,32699.641,0.0,99.99890214067278,60.44631125570734,3,False,True,False,9.0,704.0
714,492.0,"Отдел жилищно-коммунального хозяйства, пассажирского транспорта, автомобильных дорог и жилищной инспекции района (города областного значения)",1958532.0,3035946.5,1507946.5,1116959.7,1443674.7,1114152.713,1120567.963,6415.25,99.74869397705217,73.88542716866945,3,False,True,False,9.0,704.0
715,495.0,"Отдел архитектуры, строительства, жилищно-коммунального хозяйства, пассажирского транспорта и автомобильных дорог района (города областного значения)",123962.0,127191.5,127191.5,93955.7,127191.5,93814.844,95459.34,1644.4959999999992,99.85008253889866,73.75873702252116,3,False,True,False,9.0,704.0
716,809.0,"Отдел жилищно-коммунального хозяйства, пассажирского транспорта, автомобильных дорог, строительства, архитектуры и градостроительства района (города областного значения)",12573.0,12794.0,12794.0,5400.0,12794.0,5400.0,10400.0,5000.0,100.0,42.207284664686576,3,False,True,False,9.0,704.0
717,810.0,Отдел реального сектора экономики района (города областного значения),180267.0,159956.0,159956.0,119839.8,129535.4,119838.047,120397.167,559.1199999999953,99.99853721384716,74.91938220510642,3,False,True,False,9.0,704.0
718,13.0,Прочие,581698752.4,742239004.3,599225176.1,449358331.0,580341295.7,411472039.734,512663802.645,101191762.91099995,91.56880185537275,68.66734846022769,1,False,True,False,2.0,58.0
719,1.0,Регулирование экономической деятельности,14883824.0,21545518.1,21545518.1,16338543.1,21540910.1,13177342.911,21277522.015,8100179.104,80.65188450615281,61.16048288947853,2,False,True,False,13.0,718.0
720,271.0,Управление строительства области,2799321.0,5001680.0,5001680.0,3866150.0,4997072.0,3829817.422,4986242.418,1156424.9959999998,99.06023879052805,76.57062071144095,3,False,True,False,1.0,719.0
721,279.0,Управление энергетики и жилищно-коммунального хозяйства области,936374.0,1278037.0,1278037.0,738967.0,1278037.0,663025.506,1156603.747,493578.2409999999,89.72329021458334,51.87842808932762,3,False,True,False,1.0,719.0
722,280.0,Управление индустриально-инновационного развития области,100000.0,77824.0,77824.0,77824.0,77824.0,0.0,75246.95,75246.95,0.0,0.0,3,False,True,False,1.0,719.0
723,288.0,"Управление строительства, архитектуры и градостроительства области",7659926.0,6862841.1,6862841.1,6422720.1,6862841.1,3770610.841,6801691.257,3031080.416,58.70738226627687,54.94241795864981,3,False,True,False,1.0,719.0
724,309.0,"Управление энергетики и развития инфраструктуры города республиканского значения, столицы",3388203.0,8325136.0,8325136.0,5232882.0,8325136.0,4913889.142,8257737.643,3343848.501,93.90406934457914,59.02473115153914,3,False,True,False,1.0,719.0
725,3.0,Поддержка предпринимательской деятельности и защита конкуренции,77863076.4,115800607.9,117124413.3,102116448.0,114797622.3,100854683.246,107920752.531,7066069.284999996,98.7643863660436,86.10901895207189,2,False,True,False,13.0,718.0
726,265.0,Управление предпринимательства и промышленности области,10327950.0,14947985.5,14947985.5,14357141.5,14741263.5,14183564.568,14195564.568,12000.0,98.79100632949812,94.88612741830663,3,False,True,False,3.0,725.0
727,266.0,Управление предпринимательства и индустриально-инновационного развития области,18155329.0,27330887.2,27330887.2,26177181.2,27028887.2,25936745.496,26253798.779,317053.2829999998,99.08150651453641,94.89902507079975,3,False,True,False,3.0,725.0
728,275.0,Управление предпринимательства области,4792775.0,7191047.0,7924584.7,7762806.7,7924584.7,7545201.697,7549031.854,3830.1570000005886,97.19682569192403,95.21258189088445,3,False,True,False,3.0,725.0
729,278.0,Управление предпринимательства и торговли области,1232822.0,3181150.0,3181150.0,2364328.0,2506150.0,2039328.0,2039328.0,0.0,86.25402228455611,64.10662810618801,3,False,True,False,3.0,725.0
730,279.0,Управление энергетики и жилищно-коммунального хозяйства области,7874187.0,8254294.3,8254294.3,6457961.2,8254294.3,6339510.836,7975843.063,1636332.227,98.16582416134678,76.80257821677137,3,False,True,False,3.0,725.0
731,288.0,"Управление строительства, архитектуры и градостроительства области",165668.0,1665668.0,1665668.0,498048.9,1665668.0,498048.813,665427.756,167378.94300000003,99.99998253183573,29.90084536654363,3,False,True,False,3.0,725.0
732,309.0,"Управление энергетики и развития инфраструктуры города республиканского значения, столицы",2000000.0,1131949.0,1131949.0,332949.0,1131949.0,319136.412,1096485.069,777348.6569999999,95.85144031067821,28.19353274750011,3,False,True,False,3.0,725.0
733,310.0,"Управление цифровизации и государственных услуг города республиканского значения, столицы",4513315.0,4220663.0,4220663.0,1509068.0,3804999.0,1509067.937,3190435.0,1681367.063,99.99999582523782,35.754286400027674,3,False,True,False,3.0,725.0
734,326.0,"Управление предпринимательства и инвестиций города республиканского значения, столицы",13424602.0,22324602.0,22324602.0,20579425.0,21824602.0,20579425.0,20824602.0,245177.0,100.0,92.18271841979534,3,False,True,False,3.0,725.0
735,334.0,"Управление по инвестициям и развитию предпринимательства города республиканского значения, столицы",9120701.0,14487045.0,14570553.0,12876927.0,14510788.0,12838973.383,13574910.529,735937.1459999997,99.70525873913861,88.11589637675385,3,False,True,False,3.0,725.0
736,343.0,"Управление топливно-энергетического комплекса и коммунального хозяйства города республиканского значения, столицы",284454.0,0.0,0.0,0.0,0.0,0.0,0.0,0.0,0.0,0.0,3,False,True,False,3.0,725.0
737,393.0,"Управление предпринимательства и индустриально-инновационного развития города республиканского значения, столицы",2370293.0,5236941.0,5236941.0,5056913.0,5236941.0,5056912.361,5056912.361,0.0,99.99998736383243,96.56233211334632,3,False,True,False,3.0,725.0
738,454.0,Отдел предпринимательства и сельского хозяйства района (города областного значения),81763.0,210744.4,210744.4,138487.2,205789.4,138480.562,177718.712,39238.149999999994,99.99520677723284,65.71019775614442,3,False,True,False,3.0,725.0
739,458.0,"Отдел жилищно-коммунального хозяйства, пассажирского транспорта и автомобильных дорог района (города областного значения)",575329.0,474188.0,474188.0,411530.0,474188.0,380285.743,444815.14,64529.397,92.40778144971206,80.19725151205851,3,False,True,False,3.0,725.0
740,466.0,"Отдел архитектуры, градостроительства и строительства района (города областного значения)",127504.0,130968.0,130968.0,95539.0,130968.0,91360.186,120931.18,29570.99399999999,95.62606474842734,69.75764003420683,3,False,True,False,3.0,725.0
741,467.0,Отдел строительства района (города областного значения),52665.0,795676.3,795676.3,414124.0,795676.3,393269.616,708916.764,315647.148,94.96421748075456,49.425830076879244,3,False,True,False,3.0,725.0
742,469.0,Отдел предпринимательства района (города областного значения),1415956.4,1880875.8,2382635.5,2046303.3,2231642.5,2030563.142,2061390.558,30827.41599999997,99.23080034127882,85.22340668557989,3,False,True,False,3.0,725.0
743,472.0,"Отдел строительства, архитектуры и градостроительства района (города областного значения)",152160.0,296829.8,296829.8,228960.7,296829.8,220799.706,221383.013,583.3070000000007,96.43563546058341,74.38596326918659,3,False,True,False,3.0,725.0
744,492.0,"Отдел жилищно-коммунального хозяйства, пассажирского транспорта, автомобильных дорог и жилищной инспекции района (города областного значения)",939700.0,939700.0,939700.0,248867.0,939700.0,203500.094,939700.0,736199.906,81.77062205917217,21.65585761413217,3,False,True,False,3.0,725.0
745,493.0,"Отдел предпринимательства, промышленности и туризма района (города областного значения)",9991.0,2475.0,900.0,484.0,900.0,483.928,483.928,0.0,99.98512396694214,53.76977777777778,3,False,True,False,3.0,725.0
746,494.0,Отдел предпринимательства и промышленности района (города областного значения),10444.0,13110.0,14685.0,11024.0,14128.0,11003.353,11976.575,973.2220000000016,99.8127086357039,74.92919986380659,3,False,True,False,3.0,725.0
747,495.0,"Отдел архитектуры, строительства, жилищно-коммунального хозяйства, пассажирского транспорта и автомобильных дорог района (города областного значения)",15300.0,338543.6,343543.6,204465.0,343543.6,195121.099,333515.859,138394.76,95.43007311764849,56.79660427380979,3,False,True,False,3.0,725.0
748,517.0,"Управление коммунального хозяйства города республиканского значения, столицы",0.0,285428.0,285428.0,149704.0,285428.0,149703.519,281463.755,131760.236,99.99967869929995,52.44878533290357,3,False,True,False,3.0,725.0
749,518.0,"Управление энергетики города республиканского значения, столицы",0.0,194454.0,194454.0,0.0,194454.0,0.0,0.0,0.0,0.0,0.0,3,False,True,False,3.0,725.0
750,806.0,"Отдел сельского хозяйства, земельных отношений и предпринимательства района (города областного значения)",7114.0,4239.0,4239.0,2862.3,3689.0,2862.11,3280.109,417.9989999999998,99.99336198162317,67.51851851851852,3,False,True,False,3.0,725.0
751,810.0,Отдел реального сектора экономики района (города областного значения),22394.0,22394.0,22394.0,21200.0,22394.0,21199.556,21199.83,0.27400000000125146,99.99790566037736,94.66623202643567,3,False,True,False,3.0,725.0
752,815.0,Отдел поддержки бизнеса и туризма района (города областного значения),190660.0,238750.0,238750.0,170148.0,228165.0,170136.129,171638.129,1502.0,99.99302313280202,71.26120586387434,3,False,True,False,3.0,725.0
753,9.0,Прочие,488951852.0,604892878.3,460555244.7,330903339.9,444002763.3,297440013.577,383465528.099,86025514.52199996,89.88728057773226,64.58291746753395,2,False,True,False,13.0,718.0
754,120.0,Аппарат акима области,1670641.0,1490757.8,1490757.8,966973.3,1458983.8,966970.463,1370631.521,403661.05799999996,99.9997066103066,64.86435710750598,3,False,True,False,9.0,753.0
755,123.0,"Аппарат акима района в городе, города районного значения, поселка, села, сельского округа",165870.0,157130.0,157130.0,87212.0,157130.0,87212.0,87212.0,0.0,100.0,55.50308661617769,3,False,True,False,9.0,753.0
756,124.0,"Аппарат акима города районного значения, села, поселка, сельского округа",34759990.0,41801209.0,43260202.1,36344849.2,43085217.3,34800800.973,41021634.294,6220833.321000002,95.75167249008697,80.4453037287128,3,False,True,False,9.0,753.0
757,252.0,"Исполнительный орган внутренних дел, финансируемый из областного бюджета",226723.0,226723.0,226723.0,226723.0,226723.0,226723.0,226723.0,0.0,100.0,100.0,3,False,True,False,9.0,753.0
758,253.0,Управление здравоохранения области,3155008.0,3934154.3,3934154.3,3817881.5,3934154.3,3794797.797,3823969.773,29171.976000000257,99.39537926989091,96.45777739322527,3,False,True,False,9.0,753.0
759,256.0,Управление координации занятости и социальных  программ области,1705745.0,1705745.0,1705745.0,1391349.9,1705745.0,1391256.363,1705744.402,314488.0390000001,99.99327724823209,81.56297471192939,3,False,True,False,9.0,753.0
760,257.0,Управление финансов области,17854776.0,85579251.3,13988051.0,2679356.8,7124359.2,0.0,0.0,0.0,0.0,0.0,3,False,True,False,9.0,753.0
761,258.0,Управление экономики и бюджетного планирования области,4943062.0,1817621.1,1147843.3,0.2,420467.3,0.0,0.0,0.0,0.0,0.0,3,False,True,False,9.0,753.0
762,261.0,Управление образования области,36201103.0,44204369.4,44204369.4,38185195.5,44204369.4,37525313.7,42046702.195,4521388.494999997,98.27189100026999,84.89050790531128,3,False,True,False,9.0,753.0
763,265.0,Управление предпринимательства и промышленности области,483096.0,479623.0,479623.0,477987.0,479329.0,465559.328,465559.328,0.0,97.39999790789288,97.06776530733514,3,False,True,False,9.0,753.0
764,266.0,Управление предпринимательства и индустриально-инновационного развития области,2432407.0,2792994.4,8322392.0,7130995.9,8194874.2,6077089.275,6200265.155,123175.87999999989,85.22076523701269,73.02094487978937,3,False,True,False,9.0,753.0
765,268.0,Управление пассажирского транспорта и автомобильных дорог области,11046222.0,10318226.5,10318226.5,9882331.0,10318226.5,9882326.792,10318225.065,435898.27300000004,99.99995741895307,95.77543962617993,3,False,True,False,9.0,753.0
766,271.0,Управление строительства области,18428702.0,19208936.0,19219627.0,15099788.1,19219627.0,12869610.731,18410659.552,5541048.821,85.23040618695835,66.96077260500425,3,False,True,False,9.0,753.0
767,278.0,Управление предпринимательства и торговли области,133948.0,241339.0,241339.0,158011.1,216544.0,157979.988,174588.41,16608.42199999999,99.98031024402717,65.45978395534911,3,False,True,False,9.0,753.0
768,279.0,Управление энергетики и жилищно-коммунального хозяйства области,4599660.0,6925275.0,6925275.0,5869747.0,6925275.0,5869742.531,6669899.127,800156.5959999999,99.99992386383946,84.75825914494371,3,False,True,False,9.0,753.0
769,280.0,Управление индустриально-инновационного развития области,735212.0,779874.0,779874.0,692155.6,763485.5,661392.05,717515.06,56123.01000000001,95.55539968180567,84.80755224561916,3,False,True,False,9.0,753.0
770,285.0,Управление физической культуры и спорта области,2918994.0,4333951.0,4333951.0,2429091.4,4333951.0,2362053.825,4308199.774,1946145.949,97.24022014980582,54.50116591073596,3,False,True,False,9.0,753.0
771,288.0,"Управление строительства, архитектуры и градостроительства области",10180314.0,10709752.8,11056210.8,7874458.4,10709752.8,6616059.912,9073967.505,2457907.5930000013,84.01923758972426,59.84021136789468,3,False,True,False,9.0,753.0
772,299.0,Управление экономики и финансов области,18532828.0,5059403.6,821840.6,0.0,0.0,0.0,0.0,0.0,0.0,0.0,3,False,True,False,9.0,753.0
773,303.0,"Управление развития комфортной городской среды города республиканского значения, столицы",14943522.0,14594220.0,14594220.0,12683210.0,14594220.0,12667084.27,14594219.462,1927135.1919999998,99.87285765985109,86.79521255675192,3,False,True,False,9.0,753.0
774,309.0,"Управление энергетики и развития инфраструктуры города республиканского значения, столицы",4380246.0,4380246.0,4380246.0,919800.0,4380246.0,919796.0,4380246.0,3460450.0,99.9995651228528,20.99872929511265,3,False,True,False,9.0,753.0
775,310.0,"Управление цифровизации и государственных услуг города республиканского значения, столицы",1348930.0,2953631.0,2953631.0,1876256.0,2953631.0,1872329.043,2953629.859,1081300.816,99.79070249475551,63.39075676684055,3,False,True,False,9.0,753.0
776,313.0,"Управление цифровизации города республиканского значения, столицы",4232534.0,4232534.0,4232534.0,3063855.0,4232534.0,3063853.635,4232533.68,1168680.045,99.99995544828329,72.3881635682076,3,False,True,False,9.0,753.0
777,317.0,"Управление городской мобильности города республиканского значения, столицы",567484.0,567484.0,567484.0,355073.0,567484.0,355072.704,567483.463,212410.75899999996,99.9999166368606,62.5696414348246,3,False,True,False,9.0,753.0
778,323.0,Управление Спорта города Алматы,687086.0,699524.0,699524.0,644021.0,699524.0,644020.736,699523.656,55502.919999999925,99.9999590075479,92.0655668711867,3,False,True,False,9.0,753.0
779,326.0,"Управление предпринимательства и инвестиций города республиканского значения, столицы",2591832.0,2532048.0,2532048.0,1877743.0,2488388.0,1823686.447,2386713.944,563027.4970000002,97.1211953392983,72.0241656951211,3,False,True,False,9.0,753.0
780,334.0,"Управление по инвестициям и развитию предпринимательства города республиканского значения, столицы",643926.0,643926.0,643926.0,555000.0,643926.0,555000.0,643925.546,88925.54599999997,100.0,86.19002804670102,3,False,True,False,9.0,753.0
781,348.0,"Управление пассажирского транспорта и автомобильных дорог города республиканского значения, столицы",37347.0,37347.0,37347.0,31130.0,37347.0,31130.0,37347.0,6217.0,100.0,83.35341526762524,3,False,True,False,9.0,753.0
782,353.0,"Управление здравоохранения города республиканского значения, столицы",1042861.0,1022240.0,1022240.0,139408.0,1022231.0,139407.78,139407.78,0.0,99.99984218983128,13.637480435122868,3,False,True,False,9.0,753.0
783,356.0,"Управление финансов города республиканского значения, столицы",48490766.0,56190766.0,27449857.4,168066.1,26060992.4,0.0,0.0,0.0,0.0,0.0,3,False,True,False,9.0,753.0
784,357.0,"Управление экономики и бюджетного планирования города республиканского значения, столицы",98051.0,617753.0,16788.0,0.0,16788.0,0.0,0.0,0.0,0.0,0.0,3,False,True,False,9.0,753.0
785,360.0,"Управление образования города республиканского значения, столицы",8833013.0,8833013.0,8833013.0,7702822.0,8833013.0,7702806.733,8833012.631,1130205.897999999,99.99980179991176,87.2047480627505,3,False,True,False,9.0,753.0
786,373.0,"Управление строительства города республиканского значения, столицы",8991490.0,16883210.0,16883210.0,11063307.0,16883210.0,9499797.491,14706056.962,5206259.470999999,85.86761165535766,56.26772095472366,3,False,True,False,9.0,753.0
787,381.0,"Управление физической культуры и спорта города республиканского значения, столицы",771628.0,771629.0,771629.0,570837.0,771629.0,570766.458,771627.664,200861.206,99.98764235674982,73.96902630668365,3,False,True,False,9.0,753.0
788,393.0,"Управление предпринимательства и индустриально-инновационного развития города республиканского значения, столицы",324517.0,340217.0,340217.0,205907.0,340217.0,205805.914,207005.556,1199.6420000000217,99.95090696285216,60.49254270068809,3,False,True,False,9.0,753.0
789,452.0,Отдел финансов района (города областного значения),5868062.0,21131737.0,2738263.4,45977.9,894613.6,0.0,0.0,0.0,0.0,0.0,3,False,True,False,9.0,753.0
790,453.0,Отдел экономики и бюджетного планирования района (города областного значения),3704383.0,123344.1,0.0,0.0,0.0,0.0,0.0,0.0,0.0,0.0,3,False,True,False,9.0,753.0
791,455.0,Отдел культуры и развития языков района (города областного значения),664627.0,1340253.2,1490053.2,1255823.6,1490053.2,1237963.841,1237963.841,0.0,98.57784492981338,83.08185513107854,3,False,True,False,9.0,753.0
792,457.0,"Отдел культуры, развития языков, физической культуры и спорта района (города областного значения)",2536843.0,2794198.9,2644198.9,2458653.9,2644198.9,2445826.032,2530877.996,85051.96399999969,99.47825645569716,92.49780839104048,3,False,True,False,9.0,753.0
793,458.0,"Отдел жилищно-коммунального хозяйства, пассажирского транспорта и автомобильных дорог района (города областного значения)",39328856.0,41896642.7,41476189.1,35155917.6,41475686.1,30231262.758,39643103.894,9411841.136,85.99196044878657,72.88823639296214,3,False,True,False,9.0,753.0
794,459.0,Отдел экономики и финансов района (города областного значения),18498705.0,34622444.4,6154515.3,789376.2,3507259.6,0.0,0.0,0.0,0.0,0.0,3,False,True,False,9.0,753.0
