id,code,name,utv,utch,plg,plgp,plgo,sumrg,obz,obzsumrg,plgpsumrg,plgsumrg,level,isLeaf,loaded,expanded,parentCode,parent_id
716,279.0,Управление энергетики и жилищно-коммунального хозяйства области,2377250.0,4704910.0,4704910.0,464378.0,3826300.0,464377.246,1883646.643,1419269.3969999999,99.9998376322737,9.87005587779575,3,False,True,False,3.0,710.0
717,288.0,"Управление строительства, архитектуры и градостроительства области",2343091.0,2656864.5,2656864.5,1549591.6,2656864.5,1549591.578,2168722.699,619131.121,99.99999858027108,58.32407252985615,3,False,True,False,3.0,710.0
718,289.0,Управление предпринимательства и туризма области,4531583.0,4531583.0,4531583.0,3199778.0,4408483.0,3199777.052,3199777.052,0.0,99.99997037294463,70.61058027625225,3,False,True,False,3.0,710.0
719,309.0,"Управление энергетики и развития инфраструктуры города республиканского значения, столицы",497030.0,1297030.0,1297030.0,387470.0,1297030.0,387470.0,602742.042,215272.04200000002,100.0,29.87363438008373,3,False,True,False,3.0,710.0
720,310.0,"Управление цифровизации и государственных услуг города республиканского значения, столицы",2443315.0,3358315.0,3358315.0,386878.0,2358315.0,386877.35,1178087.0,791209.65,99.99983198837876,11.51998398006143,3,False,True,False,3.0,710.0
721,326.0,"Управление предпринимательства и инвестиций города республиканского значения, столицы",7649060.0,8608260.0,8608260.0,5837125.0,8108260.0,5837124.738,7149060.0,1311935.262,99.99999551148896,67.80841584710498,3,False,True,False,3.0,710.0
722,334.0,"Управление по инвестициям и развитию предпринимательства города республиканского значения, столицы
",5472078.0,5850313.0,6055513.0,3361416.0,4451494.0,3354771.131,4230117.281,875346.1500000004,99.80231934994063,55.400279563432534,3,False,True,False,3.0,710.0
723,343.0,"Управление топливно-энергетического комплекса и коммунального хозяйства города республиканского значения, столицы",437629.0,591329.0,591329.0,387939.0,591329.0,352938.004,576134.648,223196.64400000003,90.97770628887531,59.68555643305166,3,False,True,False,3.0,710.0
724,393.0,Управление предпринимательства и индустриально-инновационного развития города Алматы,2418125.0,2418125.0,2418125.0,2174499.0,2335383.0,2174498.439,2289383.0,114884.56100000022,99.99997420095387,89.92498067717756,3,False,True,False,3.0,710.0
725,454.0,Отдел предпринимательства и сельского хозяйства района (города областного значения),67937.0,82610.0,82610.0,13409.2,69139.8,13407.167,37848.871,24441.703999999998,99.98483876741341,16.2294722188597,3,False,True,False,3.0,710.0
726,458.0,"Отдел жилищно-коммунального хозяйства, пассажирского транспорта и автомобильных дорог района (города областного значения)",279979.0,457594.0,486567.6,8643.0,459067.6,8213.065,198724.375,190511.31,95.02562767557562,1.6879596997416189,3,False,True,False,3.0,710.0
727,466.0,"Отдел архитектуры, градостроительства и строительства района (города областного значения)",535265.0,134974.0,370210.0,3409.5,292399.0,3409.5,11665.0,8255.5,100.0,0.9209637773155777,3,False,True,False,3.0,710.0
728,467.0,Отдел строительства района (города областного значения),1520428.0,1760765.9,1760765.9,930271.0,1760765.9,930270.364,1474556.867,544286.5030000001,99.99993163282527,52.83327919969373,3,False,True,False,3.0,710.0
729,469.0,Отдел предпринимательства района (города областного значения),1440325.1,1505631.0,1506663.0,689069.0,1163130.4,686196.04,732943.634,46747.593999999925,99.5830664273099,45.54409579315348,3,False,True,False,3.0,710.0
730,472.0,"Отдел строительства, архитектуры и градостроительства района (города областного значения)",0.0,832090.0,977489.4,430367.0,977489.4,430367.0,843626.826,413259.826,100.0,44.02779201493131,3,False,True,False,3.0,710.0
731,492.0,"Отдел жилищно-коммунального хозяйства, пассажирского транспорта, автомобильных дорог и жилищной инспекции района (города областного значения)",2338143.0,2338143.0,2338143.0,1364958.0,2338143.0,1364958.0,2338143.0,973185.0,100.0,58.377866537675416,3,False,True,False,3.0,710.0
732,493.0,"Отдел предпринимательства, промышленности и туризма района (города областного значения)",9490.0,9490.0,9490.0,900.0,8350.0,900.0,1899.6,999.5999999999999,100.0,9.483667017913593,3,False,True,False,3.0,710.0
733,494.0,Отдел предпринимательства и промышленности района (города областного значения),8400.0,8400.0,8400.0,0.0,8400.0,0.0,0.0,0.0,0.0,0.0,3,False,True,False,3.0,710.0
734,495.0,"Отдел архитектуры, строительства, жилищно-коммунального хозяйства, пассажирского транспорта и автомобильных дорог района (города областного значения)",113641.0,210719.1,642175.1,49729.0,592944.0,49729.0,112032.326,62303.326,100.0,7.743838090265412,3,False,True,False,3.0,710.0
735,512.0,"Управление энергетики и водоснабжения города республиканского значения, столицы",728744.0,734124.0,734124.0,619470.0,734124.0,619469.949,681072.936,61602.986999999965,99.99999176715579,84.3821955146542,3,False,True,False,3.0,710.0
736,762.0,"Управление строительства, энергетики и жилищно-коммунального хозяйства области",0.0,25655.0,25655.0,0.0,25655.0,0.0,0.0,0.0,0.0,0.0,3,False,True,False,3.0,710.0
737,806.0,"Отдел сельского хозяйства, земельных отношений и предпринимательства района (города областного значения)",9665.0,11485.0,11485.0,734.0,11135.0,733.5,733.5,0.0,99.93188010899182,6.386591205920766,3,False,True,False,3.0,710.0
738,809.0,"Отдел жилищно-коммунального хозяйства, пассажирского транспорта, автомобильных дорог, строительства, архитектуры и градостроительства района (города областного значения)",0.0,32400.0,32400.0,0.0,32400.0,0.0,0.0,0.0,0.0,0.0,3,False,True,False,3.0,710.0
739,810.0,Отдел реального сектора экономики района (города областного значения),866427.0,866427.0,884032.0,236662.0,884032.0,236615.178,838833.395,602218.217,99.98021566622441,26.765453965467316,3,False,True,False,3.0,710.0
740,815.0,Отдел поддержки бизнеса и туризма района (города областного значения),181356.0,225036.0,225036.0,61073.0,200217.0,61071.302,61432.909,361.60699999999633,99.99721972066217,27.138458735491213,3,False,True,False,3.0,710.0
741,9.0,Прочие,434078065.0,522659350.8,514011084.7,130135445.8,455172201.9,126780503.319,312651889.722,185871386.403,97.42196104960053,24.664935658536393,2,False,True,False,13.0,703.0
742,120.0,Аппарат акима области,1057971.0,1057951.3,1057951.3,209470.3,965088.3,209394.095,671757.267,462363.172,99.96362014089826,19.79241341260226,3,False,True,False,9.0,741.0
743,123.0,"Аппарат акима района в городе, города районного значения, поселка, села, сельского округа",240136.0,240136.0,240136.0,27687.0,83060.0,27687.0,83060.0,55373.0,100.0,11.529716493986742,3,False,True,False,9.0,741.0
744,124.0,"Аппарат акима города районного значения, села, поселка, сельского округа",36911011.0,39380717.7,40148508.7,4824335.2,39044278.7,4371259.062,27604307.697,23233048.635,90.60852699455874,10.887724609307842,3,False,True,False,9.0,741.0
745,252.0,"Исполнительный орган внутренних дел, финансируемый из областного бюджета",226723.0,226723.0,226723.0,226723.0,226723.0,226723.0,226723.0,0.0,100.0,100.0,3,False,True,False,9.0,741.0
746,253.0,Управление здравоохранения области,6025127.0,6794113.0,6794113.0,2516649.8,6220747.0,2482338.746,3534521.683,1052182.9370000004,98.63663772369124,36.53661259387355,3,False,True,False,9.0,741.0
747,256.0,Управление координации занятости и социальных  программ области,1167314.0,1164571.0,1164571.0,437180.0,1164571.0,437157.44,1164570.511,727413.071,99.99483965414704,37.538066807433815,3,False,True,False,9.0,741.0
748,257.0,Управление финансов области,21975794.0,23352654.8,15303736.3,10519.0,8280398.2,0.0,0.0,0.0,0.0,0.0,3,False,True,False,9.0,741.0
749,258.0,Управление экономики и бюджетного планирования области,25579802.0,24765313.0,24145981.9,0.0,2295651.9,0.0,0.0,0.0,0.0,0.0,3,False,True,False,9.0,741.0
750,261.0,Управление образования области,25471344.0,27103972.3,27103972.3,8133968.7,26779433.3,7970050.41,20990609.178,13020558.768,97.98476861608773,29.405469876457925,3,False,True,False,9.0,741.0
751,265.0,Управление предпринимательства и промышленности области,0.0,426601.0,426601.0,206185.0,426601.0,206185.0,412371.0,206186.0,100.0,48.33204797925931,3,False,True,False,9.0,741.0
752,266.0,Управление предпринимательства и индустриально-инновационного развития области,1991594.0,2327137.0,2506832.3,1144487.5,2069217.3,1089371.475,1354095.177,264723.7019999998,95.18421782675652,43.45609696348656,3,False,True,False,9.0,741.0
753,268.0,Управление пассажирского транспорта и автомобильных дорог области,43070670.0,42794429.0,42794429.0,36992469.0,42794429.0,36992467.342,41840305.852,4847838.509999998,99.99999551800666,86.44225009288007,3,False,True,False,9.0,741.0
754,271.0,Управление строительства области,16877163.0,27020365.0,27334433.0,10093567.0,27334433.0,10055066.57,17990337.17,7935270.6000000015,99.61856467589703,36.78534897724054,3,False,True,False,9.0,741.0
755,278.0,Управление предпринимательства и торговли области,180157.0,128398.0,128398.0,43632.0,65932.0,38831.565,53903.413,15071.847999999998,88.99790291529153,30.243122945840277,3,False,True,False,9.0,741.0
756,279.0,Управление энергетики и жилищно-коммунального хозяйства области,12911208.0,11352810.2,10500467.2,1803302.8,7541254.2,1752598.745,5750314.545,3997715.8,97.18826727269541,16.690673963535644,3,False,True,False,9.0,741.0
757,280.0,Управление индустриально-инновационного развития области,1503371.0,1510242.0,1510242.0,533839.2,1247883.5,529035.466,901234.839,372199.373,99.10015337951954,35.02984726951045,3,False,True,False,9.0,741.0
758,285.0,Управление физической культуры и спорта области,6479915.0,6614618.4,6614618.4,3326036.8,6614618.4,3326031.165,6479018.06,3152986.8949999996,99.99983057914453,50.28303923019958,3,False,True,False,9.0,741.0
759,288.0,"Управление строительства, архитектуры и градостроительства области",5406370.0,11547017.3,12373070.5,2613276.5,11726925.5,2239025.854,8464631.908,6225606.054,85.6788730163073,18.0959597215582,3,False,True,False,9.0,741.0
760,299.0,Управление экономики и финансов области,1028763.0,1060589.5,1011299.9,0.0,0.0,0.0,0.0,0.0,0.0,0.0,3,False,True,False,9.0,741.0
761,303.0,"Управление развития комфортной городской среды города республиканского значения, столицы",364463.0,11696942.0,11696942.0,2080677.0,11696942.0,2080676.999,11696942.0,9616265.001,99.99999995193872,17.788213355251315,3,False,True,False,9.0,741.0
762,309.0,"Управление энергетики и развития инфраструктуры города республиканского значения, столицы",3094182.0,3094182.0,3094182.0,1632847.0,3094182.0,1632847.0,3094182.0,1461335.0,100.0,52.77152410556328,3,False,True,False,9.0,741.0
763,310.0,"Управление цифровизации и государственных услуг города республиканского значения, столицы",5545255.0,5545255.0,5545255.0,260000.0,5545255.0,260000.0,5545252.921,5285252.921,100.0,4.688693306259135,3,False,True,False,9.0,741.0
764,313.0,"Управление цифровизации города республиканского значения, столицы",3362332.0,3362332.0,3362332.0,741894.0,3362332.0,741893.14,3362331.365,2620438.225,99.99988408047511,22.064838927268337,3,False,True,False,9.0,741.0
765,317.0,"Управление городской мобильности города республиканского значения, столицы",1392053.0,1392053.0,1392053.0,156854.0,1392053.0,156854.0,567483.463,410629.463,100.0,11.267818107500217,3,False,True,False,9.0,741.0
766,323.0,Управление Спорта города Алматы,1208489.0,1208489.0,1208489.0,506390.0,1208489.0,506389.758,1208488.317,702098.5590000001,99.99995221074666,41.90271967721675,3,False,True,False,9.0,741.0
767,326.0,"Управление предпринимательства и инвестиций города республиканского значения, столицы",3826342.0,3912459.0,3912459.0,631018.0,3733547.0,625977.149,898090.264,272113.115,99.20115575149995,15.999583612249992,3,False,True,False,9.0,741.0
768,334.0,"Управление по инвестициям и развитию предпринимательства города республиканского значения, столицы
",674972.0,674972.0,674972.0,155000.0,674972.0,155000.0,674971.752,519971.752,100.0,22.963915540200187,3,False,True,False,9.0,741.0
769,343.0,"Управление топливно-энергетического комплекса и коммунального хозяйства города республиканского значения, столицы",0.0,1946392.0,1946392.0,916000.0,1946392.0,916000.0,1823292.748,907292.7479999999,100.0,47.06143469558033,3,False,True,False,9.0,741.0
770,348.0,"Управление пассажирского транспорта и автомобильных дорог города республиканского значения, столицы",35911.0,35911.0,35911.0,14965.0,35911.0,11970.332,35911.0,23940.667999999998,79.98885399264952,33.333329620450556,3,False,True,False,9.0,741.0
771,353.0,"Управление здравоохранения города республиканского значения, столицы",1145213.0,1145213.0,1145213.0,121754.0,121754.0,121754.0,121754.0,0.0,100.0,10.6315593693051,3,False,True,False,9.0,741.0
772,356.0,"Управление финансов города республиканского значения, столицы",37728774.0,34422084.0,15345258.9,194442.9,10804029.9,0.0,0.0,0.0,0.0,0.0,3,False,True,False,9.0,741.0
773,357.0,"Управление экономики и бюджетного планирования города республиканского значения, столицы",330349.0,330349.0,77309.0,0.0,0.0,0.0,0.0,0.0,0.0,0.0,3,False,True,False,9.0,741.0
774,360.0,"Управление образования города республиканского значения, столицы",9102191.0,9102191.0,9102191.0,4331676.0,9102191.0,4331674.335,8820747.226,4489072.891,99.99996156222211,47.589358814817224,3,False,True,False,9.0,741.0
775,373.0,"Управление строительства города республиканского значения, столицы",8924021.0,13803404.0,13803404.0,5095344.0,13803404.0,5061951.668,12920009.644,7858057.976,99.34465009624472,36.67176348674573,3,False,True,False,9.0,741.0
776,381.0,"Управление физической культуры и спорта города республиканского значения, столицы",4303212.0,624348.0,624348.0,266143.0,551895.0,266141.154,551895.0,285753.846,99.99930638791928,42.62705318187933,3,False,True,False,9.0,741.0
777,393.0,Управление предпринимательства и индустриально-инновационного развития города Алматы,276063.0,300568.0,300568.0,142278.0,199108.0,142133.079,178475.661,36342.581999999995,99.89814236916459,47.28816074898193,3,False,True,False,9.0,741.0
778,452.0,Отдел финансов района (города областного значения),8286068.0,6692335.5,5100903.5,82.1,1414180.7,0.0,0.0,0.0,0.0,0.0,3,False,True,False,9.0,741.0
779,453.0,Отдел экономики и бюджетного планирования района (города областного значения),2635047.0,1494815.4,1464434.3,0.0,6715.0,0.0,0.0,0.0,0.0,0.0,3,False,True,False,9.0,741.0
780,455.0,Отдел культуры и развития языков района (города областного значения),1156289.0,1279648.0,1279648.0,299756.0,1279648.0,299276.897,878735.041,579458.144,99.84016900412335,23.387439123884068,3,False,True,False,9.0,741.0
781,457.0,"Отдел культуры, развития языков, физической культуры и спорта района (города областного значения)",1369799.0,1580820.0,1936645.0,655383.8,1927298.0,480293.044,893357.351,413064.30700000003,73.2842410813328,24.800262515845702,3,False,True,False,9.0,741.0
782,458.0,"Отдел жилищно-коммунального хозяйства, пассажирского транспорта и автомобильных дорог района (города областного значения)",37461789.0,49158676.1,50614929.1,11203938.8,49720470.1,10873061.678,32896279.206,22023217.528,97.04677856683757,21.481926126021182,3,False,True,False,9.0,741.0
783,459.0,Отдел экономики и финансов района (города областного значения),14414309.0,16442355.2,11915513.6,26344.4,6593534.6,0.0,0.0,0.0,0.0,0.0,3,False,True,False,9.0,741.0
784,465.0,Отдел физической культуры и спорта района (города областного значения),312552.0,0.0,0.0,0.0,0.0,0.0,0.0,0.0,0.0,0.0,3,False,True,False,9.0,741.0
785,466.0,"Отдел архитектуры, градостроительства и строительства района (города областного значения)",6940101.0,14449506.5,17393541.5,1672392.1,17021334.3,1670365.824,8663928.596,6993562.772000001,99.87883965727893,9.603368146734233,3,False,True,False,9.0,741.0
786,467.0,Отдел строительства района (города областного значения),11297595.0,27746721.3,31148267.3,8629500.1,30845768.3,8471593.331,26127012.845,17655419.514,98.17015160588504,27.197639115547208,3,False,True,False,9.0,741.0
787,472.0,"Отдел строительства, архитектуры и градостроительства района (города областного значения)",8921545.0,17076406.9,22183495.4,2434635.3,21368450.2,2301601.415,9566554.835,7264953.420000001,94.53577769943614,10.375287453572353,3,False,True,False,9.0,741.0
788,478.0,"Отдел внутренней политики, культуры и развития языков района (города областного значения)",241261.0,445702.0,592361.0,191065.8,569675.0,191065.8,370951.803,179886.00300000003,100.0,32.254959391317115,3,False,True,False,9.0,741.0
789,485.0,Отдел пассажирского транспорта и автомобильных дорог района (города областного значения),2298279.0,3757680.4,8015378.4,1161868.0,7178806.4,1161868.0,5800701.304,4638833.304,100.0,14.495485328552924,3,False,True,False,9.0,741.0
790,487.0,Отдел жилищно-коммунального хозяйства и жилищной инспекции района (города областного значения),0.0,79834.0,79834.0,0.0,0.0,0.0,0.0,0.0,0.0,0.0,3,False,True,False,9.0,741.0
791,490.0,"Отдел коммунального хозяйства, пассажирского транспорта и автомобильных дорог района (города областного значения)",1074963.0,1123591.0,1123591.0,61401.0,1123591.0,61400.084,1113875.511,1052475.427,99.99850816761942,5.464629389163851,3,False,True,False,9.0,741.0
792,492.0,"Отдел жилищно-коммунального хозяйства, пассажирского транспорта, автомобильных дорог и жилищной инспекции района (города областного значения)",21792295.0,27957164.8,32636186.0,5848828.0,32544443.0,4990769.139,12743448.831,7752679.692,85.32938802440422,15.292133520136208,3,False,True,False,9.0,741.0
793,495.0,"Отдел архитектуры, строительства, жилищно-коммунального хозяйства, пассажирского транспорта и автомобильных дорог района (города областного значения)",2655953.0,4670310.9,5855608.6,626121.3,5855608.6,626120.314,3640118.187,3013997.8729999997,99.99984252252719,10.692659922659448,3,False,True,False,9.0,741.0
794,496.0,Отдел жилищной инспекции и  коммунального хозяйства района (города областного значения),1386199.0,1864713.8,2185755.8,463527.0,2185755.8,287833.348,1337075.744,1049242.396,62.09634994293752,13.168595869675837,3,False,True,False,9.0,741.0
795,497.0,Отдел жилищно-коммунального хозяйства района (города областного значения),1157379.0,1157379.0,1157379.0,419241.0,1157379.0,409240.668,1138234.0,728993.3319999999,97.61465791752238,35.35926157291605,3,False,True,False,9.0,741.0
796,512.0,"Управление энергетики и водоснабжения города республиканского значения, столицы",5530863.0,6657438.0,6657438.0,2044059.0,6657438.0,2044048.273,6657419.473,4613371.2,99.99947521084275,30.703226571542984,3,False,True,False,9.0,741.0
797,513.0,"Управление экологии и окружающей среды города республиканского значения, столицы",2232671.0,2232671.0,2232671.0,537614.0,2232671.0,537613.868,2232669.387,1695055.519,99.99997544706798,24.07940390680042,3,False,True,False,9.0,741.0
798,719.0,Управление ветеринарии области,17952.0,17952.0,17952.0,9284.0,17952.0,9284.0,17952.0,8668.0,100.0,51.71568627450981,3,False,True,False,9.0,741.0
799,727.0,Управление экономики области,1600.0,1530.0,0.0,0.0,0.0,0.0,0.0,0.0,0.0,0.0,3,False,True,False,9.0,741.0
800,743.0,Управление цифровых технологий области,898006.0,898006.0,898006.0,0.0,898006.0,0.0,0.0,0.0,0.0,0.0,3,False,True,False,9.0,741.0
801,750.0,Управление стратегии и экономического развития области,500000.0,0.0,0.0,0.0,0.0,0.0,0.0,0.0,0.0,0.0,3,False,True,False,9.0,741.0
802,751.0,Управление финансов и государственных активов области,1240000.0,1000000.0,1000000.0,0.0,0.0,0.0,0.0,0.0,0.0,0.0,3,False,True,False,9.0,741.0
803,753.0,Управление развития человеческого потенциала области,5233831.0,5233831.0,5233831.0,1528547.0,5233831.0,1528545.715,4200348.783,2671803.068,99.99991593323595,29.205102629412377,3,False,True,False,9.0,741.0
804,754.0,Управление общественного здоровья области,768986.0,0.0,0.0,0.0,0.0,0.0,0.0,0.0,0.0,0.0,3,False,True,False,9.0,741.0
