id,code,name,utv,utch,plg,plgp,plgo,sumrg,obz,obzsumrg,plgpsumrg,plgsumrg,level,isLeaf,loaded,expanded,parentCode,parent_id
706,485.0,Отдел пассажирского транспорта и автомобильных дорог района (города областного значения),6246043.0,17127946.8,17471690.9,15619335.4,16120929.6,15589913.566,15671036.605,81123.0390000008,99.81163197251017,89.22956372814494,3,False,True,False,9.0,696.0
707,490.0,"Отдел коммунального хозяйства, пассажирского транспорта и автомобильных дорог района (города областного значения)",5258800.0,22694.0,22694.0,15221.0,22694.0,15220.773,15220.773,0.0,99.9985086393798,67.06959108134308,3,False,True,False,9.0,696.0
708,492.0,"Отдел жилищно-коммунального хозяйства, пассажирского транспорта, автомобильных дорог и жилищной инспекции района (города областного значения)",4549165.0,3955172.1,3351593.1,2925856.9,3253459.1,2922089.682,2932144.543,10054.861000000034,99.87124394224476,87.18509660376135,3,False,True,False,9.0,696.0
709,495.0,"Отдел архитектуры, строительства, жилищно-коммунального хозяйства, пассажирского транспорта и автомобильных дорог района (города областного значения)",91826.0,105985.0,105985.0,71848.0,105985.0,71096.454,74164.976,3068.521999999997,98.95397784211112,67.08161909704204,3,False,True,False,9.0,696.0
710,809.0,"Отдел жилищно-коммунального хозяйства, пассажирского транспорта, автомобильных дорог, строительства, архитектуры и градостроительства района (города областного значения)",20848.0,10348.0,10348.0,4228.0,10348.0,4227.277,5632.277,1405.0,99.98289971617787,40.851149980672595,3,False,True,False,9.0,696.0
711,810.0,Отдел реального сектора экономики района (города областного значения),120422.0,136990.0,136990.0,100468.7,118315.4,100166.38,100166.38,0.0,99.69909036346644,73.11948317395431,3,False,True,False,9.0,696.0
712,13.0,Прочие,514942116.1,670339968.8,610388070.2,440246887.8,577452898.2,415026196.437,523760607.186,108734410.74900001,94.2712391474173,67.993825026923,1,False,True,False,2.0,55.0
713,1.0,Регулирование экономической деятельности,15970224.0,25807570.6,25649362.6,15382054.1,25149362.6,12293862.457,23507941.534,11214079.077000001,79.92341189984504,47.930479399125495,2,False,True,False,13.0,712.0
714,271.0,Управление строительства области,5458009.0,5752160.0,5752160.0,4186889.0,5752160.0,3498689.755,5607799.143,2109109.3880000003,83.56299283310352,60.82392970640594,3,False,True,False,1.0,713.0
715,279.0,Управление энергетики и жилищно-коммунального хозяйства области,0.0,2266715.0,2266715.0,63581.0,2266715.0,63581.0,891988.553,828407.553,100.0,2.8049843054817214,3,False,True,False,1.0,713.0
716,288.0,"Управление строительства, архитектуры и градостроительства области",4554721.0,7486324.6,7486324.6,5665857.1,7486324.6,3265865.81,7403417.397,4137551.587,57.64116094632885,43.62442165545427,3,False,True,False,1.0,713.0
717,309.0,"Управление энергетики и развития инфраструктуры города республиканского значения, столицы",5884454.0,10229331.0,10071123.0,5465727.0,9571123.0,5465725.892,9533215.77,4067489.8779999996,99.9999797282228,54.271265399101964,3,False,True,False,1.0,713.0
718,512.0,"Управление энергетики и водоснабжения города республиканского значения, столицы",73040.0,73040.0,73040.0,0.0,73040.0,0.0,71520.671,71520.671,0.0,0.0,3,False,True,False,1.0,713.0
719,3.0,Поддержка предпринимательской деятельности и защита конкуренции,64893827.1,88321645.3,87807542.2,73556915.2,83693014.4,72194796.766,79058054.661,6863257.894999996,98.1482115851427,82.21935719549157,2,False,True,False,13.0,712.0
720,265.0,Управление предпринимательства и промышленности области,2262465.0,6296208.0,9016297.0,7936621.5,8260260.0,7935279.362,7942898.361,7618.998999999836,99.98308930317515,88.01040340618769,3,False,True,False,3.0,719.0
721,266.0,Управление предпринимательства и индустриально-инновационного развития области,17651882.0,20808245.0,20808245.0,19609051.5,20170559.0,19604132.661,19841481.415,237348.75400000066,99.97491546697196,94.21329218778422,3,False,True,False,3.0,719.0
722,271.0,Управление строительства области,0.0,118166.0,118166.0,0.0,118166.0,0.0,118165.996,118165.996,0.0,0.0,3,False,True,False,3.0,719.0
723,275.0,Управление предпринимательства области,4665476.0,5154952.0,5154952.0,5097173.0,5154952.0,5071840.629,5092756.942,20916.313000000082,99.5030113555102,98.38773724760192,3,False,True,False,3.0,719.0
724,278.0,Управление предпринимательства и торговли области,4045043.0,2327298.0,2327298.0,1822876.6,1822876.6,1822876.596,1822876.596,0.0,99.9999997805666,78.32587816429181,3,False,True,False,3.0,719.0
725,279.0,Управление энергетики и жилищно-коммунального хозяйства области,2377250.0,4726586.0,4451153.0,2010908.6,4451153.0,1489987.829,3111273.667,1621285.838,74.09525370770207,33.47419935913234,3,False,True,False,3.0,719.0
726,288.0,"Управление строительства, архитектуры и градостроительства области",2343091.0,2619426.1,2595546.1,2277601.6,2595546.1,2178289.47,2291530.814,113241.34399999958,95.63961800869828,83.92412949244093,3,False,True,False,3.0,719.0
727,289.0,Управление предпринимательства и туризма области,4531583.0,5031583.0,2311494.0,2311494.0,2311494.0,2311494.0,2311494.0,0.0,100.0,100.0,3,False,True,False,3.0,719.0
728,309.0,"Управление энергетики и развития инфраструктуры города республиканского значения, столицы",497030.0,1581013.0,1036729.0,803572.0,1036729.0,803572.0,886724.78,83152.78000000003,100.0,77.5103233342561,3,False,True,False,3.0,719.0
729,310.0,"Управление цифровизации и государственных услуг города республиканского значения, столицы",2443315.0,3708315.0,3708315.0,910417.0,3708315.0,910417.0,2866225.92,1955808.92,100.0,24.550692160725287,3,False,True,False,3.0,719.0
730,326.0,"Управление предпринимательства и инвестиций города республиканского значения, столицы",7649060.0,11342638.0,11342638.0,10278495.0,11342638.0,10275132.867,10842638.0,567505.1329999994,99.96728963724748,90.58856385084317,3,False,True,False,3.0,719.0
731,334.0,"Управление по инвестициям и развитию предпринимательства города республиканского значения, столицы
",5472078.0,8455778.0,8660978.0,8073277.0,8584224.0,7968337.277,8583822.821,615485.5440000007,98.70015951391238,92.00274238082581,3,False,True,False,3.0,719.0
732,343.0,"Управление топливно-энергетического комплекса и коммунального хозяйства города республиканского значения, столицы",437629.0,591329.0,591329.0,591329.0,591329.0,404491.53,588899.034,184407.50399999996,68.4038039737608,68.4038039737608,3,False,True,False,3.0,719.0
733,393.0,Управление предпринимательства и индустриально-инновационного развития города Алматы,2418125.0,4950383.0,4950383.0,2879056.0,2909383.0,2759052.021,2789383.0,30330.978999999817,95.8318289397636,55.73411231009803,3,False,True,False,3.0,719.0
734,454.0,Отдел предпринимательства и сельского хозяйства района (города областного значения),67937.0,90775.0,90775.0,46464.1,85840.9,46462.318,57692.661,11230.343,99.99616478098145,51.184046268245666,3,False,True,False,3.0,719.0
735,458.0,"Отдел жилищно-коммунального хозяйства, пассажирского транспорта и автомобильных дорог района (города областного значения)",279979.0,496567.6,496567.6,356900.6,496567.6,351132.686,476724.029,125591.343,98.38388783879881,70.71196066759087,3,False,True,False,3.0,719.0
736,466.0,"Отдел архитектуры, градостроительства и строительства района (города областного значения)",535265.0,482841.0,479721.6,427227.6,479721.6,258057.909,452963.095,194905.18599999996,60.402911469202834,53.793264468391676,3,False,True,False,3.0,719.0
737,467.0,Отдел строительства района (города областного значения),1520428.0,1970809.9,1970809.9,1622356.5,1970809.9,1619603.29,1912086.772,292483.4820000001,99.83029562244796,82.17957957284466,3,False,True,False,3.0,719.0
738,469.0,Отдел предпринимательства района (города областного значения),1440325.1,1609105.4,1548089.4,1291223.5,1462227.1,1288036.556,1303536.718,15500.162000000011,99.75318416989778,83.2016908067454,3,False,True,False,3.0,719.0
739,472.0,"Отдел строительства, архитектуры и градостроительства района (города областного значения)",0.0,991046.4,1067949.7,785713.0,1067949.7,785712.311,945643.919,159931.608,99.99991230894742,73.57203349558505,3,False,True,False,3.0,719.0
740,492.0,"Отдел жилищно-коммунального хозяйства, пассажирского транспорта, автомобильных дорог и жилищной инспекции района (города областного значения)",2338143.0,2338143.0,2338143.0,2163510.0,2338143.0,2163510.0,2338143.0,174633.0,100.0,92.53112405870813,3,False,True,False,3.0,719.0
741,493.0,"Отдел предпринимательства, промышленности и туризма района (города областного значения)",9490.0,9560.0,9560.0,3741.0,8872.0,3740.509,4734.953,994.4440000000004,99.98687516706764,39.126663179916314,3,False,True,False,3.0,719.0
742,494.0,Отдел предпринимательства и промышленности района (города областного значения),8400.0,8400.0,8400.0,0.0,8400.0,0.0,0.0,0.0,0.0,0.0,3,False,True,False,3.0,719.0
743,495.0,"Отдел архитектуры, строительства, жилищно-коммунального хозяйства, пассажирского транспорта и автомобильных дорог района (города областного значения)",113641.0,850667.9,850667.9,639918.1,850667.9,525653.716,775306.259,249652.54299999995,82.14390497784014,61.79305884235199,3,False,True,False,3.0,719.0
744,512.0,"Управление энергетики и водоснабжения города республиканского значения, столицы",728744.0,686453.0,686453.0,681073.0,686453.0,681072.936,681072.936,0.0,99.99999060306311,99.21625165888997,3,False,True,False,3.0,719.0
745,806.0,"Отдел сельского хозяйства, земельных отношений и предпринимательства района (города областного значения)",9665.0,11485.0,11485.0,1189.0,11135.0,1188.5,1188.5,0.0,99.95794785534062,10.348280365694384,3,False,True,False,3.0,719.0
746,810.0,Отдел реального сектора экономики района (города областного значения),866427.0,838835.0,950361.0,768497.0,950361.0,768496.381,838833.395,70337.01399999997,99.99991945316638,80.86362771620469,3,False,True,False,3.0,719.0
747,815.0,Отдел поддержки бизнеса и туризма района (города областного значения),181356.0,225036.0,225036.0,167229.0,218241.0,167226.412,179957.078,12730.665999999997,99.99845242152976,74.31096002417391,3,False,True,False,3.0,719.0
748,9.0,Прочие,434078065.0,556210752.9,496931165.4,351307918.5,468610521.2,330537537.214,421194610.991,90657073.77700001,94.08769908327585,66.51575916916723,2,False,True,False,13.0,712.0
749,120.0,Аппарат акима области,1057971.0,1026215.3,1026215.3,667635.3,992221.3,667308.668,851069.026,183760.358,99.95107628371356,65.02618583059518,3,False,True,False,9.0,748.0
750,123.0,"Аппарат акима района в городе, города районного значения, поселка, села, сельского округа",240136.0,240136.0,240136.0,150289.0,158693.0,83060.0,158693.0,75633.0,55.26685253079068,34.58873305127095,3,False,True,False,9.0,748.0
751,124.0,"Аппарат акима города районного значения, села, поселка, сельского округа",36911011.0,42814388.2,43482894.0,36227938.6,43427698.3,34419937.514,40894444.04,6474506.526000001,95.00937355016936,79.15742110909177,3,False,True,False,9.0,748.0
752,252.0,"Исполнительный орган внутренних дел, финансируемый из областного бюджета",226723.0,226723.0,226723.0,226723.0,226723.0,226723.0,226723.0,0.0,100.0,100.0,3,False,True,False,9.0,748.0
753,253.0,Управление здравоохранения области,6025127.0,6787043.9,6787043.9,5844235.1,6702110.9,5523492.635,5915830.15,392337.5150000006,94.51181447166628,81.38289241064139,3,False,True,False,9.0,748.0
754,256.0,Управление координации занятости и социальных  программ области,1167314.0,1149852.0,1149852.0,937337.7,1149852.0,937337.7,1149851.511,212513.811,100.0,81.51811711420251,3,False,True,False,9.0,748.0
755,257.0,Управление финансов области,21975794.0,26170961.0,5231478.6,1378.5,3333155.3,0.0,0.0,0.0,0.0,0.0,3,False,True,False,9.0,748.0
756,258.0,Управление экономики и бюджетного планирования области,25579802.0,5076572.4,3406950.3,300779.0,2330428.3,0.0,0.0,0.0,0.0,0.0,3,False,True,False,9.0,748.0
757,261.0,Управление образования области,25471344.0,30354461.1,35619629.1,27315560.7,35585371.5,26176808.376,32805302.69,6628494.314000003,95.83112228042238,73.48983983665343,3,False,True,False,9.0,748.0
758,265.0,Управление предпринимательства и промышленности области,0.0,426601.0,447518.0,446839.0,446839.0,446432.894,446432.894,0.0,99.90911581128773,99.75752796535558,3,False,True,False,9.0,748.0
759,266.0,Управление предпринимательства и индустриально-инновационного развития области,1991594.0,2452678.8,2632524.1,2096642.5,2466620.7,2082749.002,2216245.792,133496.7899999998,99.33734539865523,79.11604691482216,3,False,True,False,9.0,748.0
760,268.0,Управление пассажирского транспорта и автомобильных дорог области,43070670.0,42794429.2,42794429.2,40629898.2,42794429.2,40629896.94,42794429.052,2164532.1120000035,99.99999689883545,94.94202329493856,3,False,True,False,9.0,748.0
761,271.0,Управление строительства области,16877163.0,27127512.0,29814081.0,22573446.0,29814081.0,20758650.716,25167357.224,4408706.508000001,91.96048629881321,69.6270018049525,3,False,True,False,9.0,748.0
762,278.0,Управление предпринимательства и торговли области,180157.0,130398.0,130398.0,110909.0,118329.0,94937.051,103404.668,8467.616999999998,85.59905057299227,72.80560361355236,3,False,True,False,9.0,748.0
763,279.0,Управление энергетики и жилищно-коммунального хозяйства области,12911208.0,14224724.2,14224724.2,7115014.3,11765511.2,6287454.775,11086749.905,4799295.129999999,88.36882836623393,44.200890552240025,3,False,True,False,9.0,748.0
764,280.0,Управление индустриально-инновационного развития области,1503371.0,1717668.0,610148.0,550681.6,586109.8,549985.381,572015.853,22030.47199999995,99.87357140678027,90.13966791663663,3,False,True,False,9.0,748.0
765,285.0,Управление физической культуры и спорта области,6479915.0,6696635.4,6696635.4,5628313.4,6696635.4,5571491.143,6444676.467,873185.324,98.99042123347289,83.19836470416173,3,False,True,False,9.0,748.0
766,288.0,"Управление строительства, архитектуры и градостроительства области",5406370.0,12997534.8,13727004.8,9217354.9,13727004.8,7784918.585,12475220.653,4690302.068000001,84.45935595905067,56.71243434693051,3,False,True,False,9.0,748.0
767,299.0,Управление экономики и финансов области,1028763.0,1060589.5,4009505.6,0.0,0.0,0.0,0.0,0.0,0.0,0.0,3,False,True,False,9.0,748.0
768,303.0,"Управление развития комфортной городской среды города республиканского значения, столицы",364463.0,11696942.0,11696942.0,9130890.0,11696942.0,9067887.344,11696942.0,2629054.6559999995,99.31000531163996,77.52357277654279,3,False,True,False,9.0,748.0
769,309.0,"Управление энергетики и развития инфраструктуры города республиканского значения, столицы",3094182.0,3094182.0,3094182.0,1876207.0,3094182.0,1876207.0,3094182.0,1217975.0,100.0,60.63660767207617,3,False,True,False,9.0,748.0
770,310.0,"Управление цифровизации и государственных услуг города республиканского значения, столицы",5545255.0,5545255.0,5545255.0,2854013.0,5545255.0,2853587.989,5545252.921,2691664.932,99.9851083018893,51.45999578017603,3,False,True,False,9.0,748.0
771,313.0,"Управление цифровизации города республиканского значения, столицы",3362332.0,3362332.0,3362332.0,1998472.0,3362332.0,1980513.36,3362331.365,1381818.0050000001,99.10138145543196,58.9029685349335,3,False,True,False,9.0,748.0
772,317.0,"Управление городской мобильности города республиканского значения, столицы",1392053.0,1392053.0,1392053.0,379146.0,1392053.0,376115.953,567483.463,191367.51,99.20082316574617,27.01879547689635,3,False,True,False,9.0,748.0
773,323.0,Управление Спорта города Алматы,1208489.0,1208489.0,1208489.0,1004885.0,1208489.0,1004885.0,1208488.317,203603.31700000004,100.0,83.15218425653855,3,False,True,False,9.0,748.0
774,326.0,"Управление предпринимательства и инвестиций города республиканского значения, столицы",3826342.0,4348942.0,4348942.0,1422913.0,4276098.0,1382180.87,1969770.323,587589.453,97.13741247708047,31.782002841150792,3,False,True,False,9.0,748.0
775,334.0,"Управление по инвестициям и развитию предпринимательства города республиканского значения, столицы
",674972.0,674972.0,674972.0,341406.0,674972.0,341406.0,674971.752,333565.752,100.0,50.580764831726356,3,False,True,False,9.0,748.0
776,343.0,"Управление топливно-энергетического комплекса и коммунального хозяйства города республиканского значения, столицы",0.0,1943256.0,1943256.0,1628256.0,1943256.0,1600179.316,1841842.085,241662.76899999985,98.27565911011537,82.34526567781086,3,False,True,False,9.0,748.0
777,348.0,"Управление пассажирского транспорта и автомобильных дорог города республиканского значения, столицы",35911.0,35911.0,35911.0,23944.0,35911.0,11970.332,35911.0,23940.667999999998,49.993033745405945,33.333329620450556,3,False,True,False,9.0,748.0
778,353.0,"Управление здравоохранения города республиканского значения, столицы",1145213.0,1145213.0,1145213.0,143511.0,143511.0,143330.94,143330.94,0.0,99.87453226581935,12.515657785931525,3,False,True,False,9.0,748.0
779,356.0,"Управление финансов города республиканского значения, столицы",37728774.0,44672084.0,14663556.3,60788.5,3698785.2,0.0,0.0,0.0,0.0,0.0,3,False,True,False,9.0,748.0
780,357.0,"Управление экономики и бюджетного планирования города республиканского значения, столицы",330349.0,321649.0,29820.0,0.0,0.0,0.0,0.0,0.0,0.0,0.0,3,False,True,False,9.0,748.0
781,360.0,"Управление образования города республиканского значения, столицы",9102191.0,9044398.0,9044398.0,7960086.0,9044398.0,7960083.0,9010520.878,1050437.8780000005,99.99996231196498,88.01119764963904,3,False,True,False,9.0,748.0
782,373.0,"Управление строительства города республиканского значения, столицы",8924021.0,13766691.0,13766691.0,8460865.0,13766691.0,7702945.849,13566316.086,5863370.236999999,91.0420606994675,55.953502907852005,3,False,True,False,9.0,748.0
783,381.0,"Управление физической культуры и спорта города республиканского значения, столицы",4303212.0,624349.0,624349.0,488930.0,624349.0,482429.468,624348.416,141918.94799999997,98.67045752970772,77.26919847713378,3,False,True,False,9.0,748.0
784,393.0,Управление предпринимательства и индустриально-инновационного развития города Алматы,276063.0,336128.0,336128.0,244825.0,293784.0,228048.703,261937.789,33889.08599999998,93.14763729194323,67.84579178170222,3,False,True,False,9.0,748.0
785,452.0,Отдел финансов района (города областного значения),8286068.0,7717473.7,2622897.2,2.1,544855.9,0.0,0.0,0.0,0.0,0.0,3,False,True,False,9.0,748.0
786,453.0,Отдел экономики и бюджетного планирования района (города областного значения),2635047.0,334396.8,248275.7,0.0,0.0,0.0,0.0,0.0,0.0,0.0,3,False,True,False,9.0,748.0
787,455.0,Отдел культуры и развития языков района (города областного значения),1156289.0,1352968.9,1352968.9,1005609.7,1352968.9,1005578.19,1322683.144,317104.95400000014,99.99686657755986,74.3238214862145,3,False,True,False,9.0,748.0
788,457.0,"Отдел культуры, развития языков, физической культуры и спорта района (города областного значения)",1369799.0,1953897.9,1932064.9,1667127.8,1932064.9,1658212.688,1877091.137,218878.44900000002,99.46524123705454,85.82593100262834,3,False,True,False,9.0,748.0
789,458.0,"Отдел жилищно-коммунального хозяйства, пассажирского транспорта и автомобильных дорог района (города областного значения)",37461789.0,46659867.2,47672129.4,40175873.1,47467247.4,36685179.165,44178138.241,7492959.075999998,91.31146714270162,76.95309529219394,3,False,True,False,9.0,748.0
790,459.0,Отдел экономики и финансов района (города областного значения),14414309.0,15687172.5,7028504.4,29782.3,4259761.2,0.0,0.0,0.0,0.0,0.0,3,False,True,False,9.0,748.0
791,465.0,Отдел физической культуры и спорта района (города областного значения),312552.0,0.0,0.0,0.0,0.0,0.0,0.0,0.0,0.0,0.0,3,False,True,False,9.0,748.0
792,466.0,"Отдел архитектуры, градостроительства и строительства района (города областного значения)",6940101.0,17224872.0,17229038.6,12261618.7,17161497.6,11211185.292,16269475.616,5058290.324000001,91.43315875578483,65.07145031296173,3,False,True,False,9.0,748.0
793,467.0,Отдел строительства района (города областного значения),11297595.0,37877189.4,37847252.4,29636326.4,37847252.4,27528876.459,36667856.66,9138980.200999998,92.88896365711507,72.7367898944231,3,False,True,False,9.0,748.0
