id,code,name,utv,utch,plg,plgp,plgo,sumrg,obz,obzsumrg,plgpsumrg,plgsumrg,level,isLeaf,loaded,expanded,parentCode,parent_id
371,487.0,Отдел жилищно-коммунального хозяйства и жилищной инспекции района (города областного значения),27479822.0,31026211.0,31099464.0,4754679.7,31099464.0,4734641.938,14736098.998,10001457.059999999,99.57856757417329,15.224191445871865,3,False,True,False,3.0,361.0
372,490.0,"Отдел коммунального хозяйства, пассажирского транспорта и автомобильных дорог района (города областного значения)",2500.0,2500.0,2500.0,0.0,2500.0,0.0,0.0,0.0,0.0,0.0,3,False,True,False,3.0,361.0
373,492.0,"Отдел жилищно-коммунального хозяйства, пассажирского транспорта, автомобильных дорог и жилищной инспекции района (города областного значения)",10663372.0,11682748.6,12411901.5,1444548.8,12380423.5,1444467.458,4394836.566,2950369.1079999995,99.9943690375846,11.637761208465923,3,False,True,False,3.0,361.0
374,495.0,"Отдел архитектуры, строительства, жилищно-коммунального хозяйства, пассажирского транспорта и автомобильных дорог района (города областного значения)",418568.0,465398.3,465398.3,71450.0,282038.3,71449.963,151396.661,79946.69799999999,99.99994821553534,15.352433173907167,3,False,True,False,3.0,361.0
375,496.0,Отдел жилищной инспекции и  коммунального хозяйства района (города областного значения),137950.0,210950.0,210950.0,0.0,210950.0,0.0,0.0,0.0,0.0,0.0,3,False,True,False,3.0,361.0
376,497.0,Отдел жилищно-коммунального хозяйства района (города областного значения),34016032.0,38126092.6,38126092.6,4146736.4,30284105.0,4146730.426,17780046.158,13633315.732,99.99985593489859,10.876358271238107,3,False,True,False,3.0,361.0
377,511.0,"Управление развития коммунальной инфраструктуры города республиканского значения, столицы",124462.0,124462.0,124462.0,31116.0,124462.0,10000.0,124462.0,114462.0,32.13780691605605,8.03458083591779,3,False,True,False,3.0,361.0
378,520.0,"Управление развития общественных пространств города республиканского значения, столицы",20113602.0,20113602.0,20113602.0,2326286.0,20113602.0,2029118.0,15274001.992,13244883.992,87.2256463736617,10.088287518068618,3,False,True,False,3.0,361.0
379,700.0,"Управление недропользования, окружающей среды и водных ресурсов области",3655442.0,3655442.0,3655442.0,1074953.0,3655442.0,1074952.5,3655441.667,2580489.167,99.99995348633848,29.406908931943114,3,False,True,False,3.0,361.0
380,809.0,"Отдел жилищно-коммунального хозяйства, пассажирского транспорта, автомобильных дорог, строительства, архитектуры и градостроительства района (города областного значения)",140054.0,140054.0,140054.0,13146.2,140054.0,13146.071,49870.527,36724.456000000006,99.9990187278453,9.38643023405258,3,False,True,False,3.0,361.0
381,810.0,Отдел реального сектора экономики района (города областного значения),176346.0,176346.0,176346.0,13000.0,175782.0,13000.0,109355.828,96355.828,100.0,7.37187120773933,3,False,True,False,3.0,361.0
382,813.0,Отдел инфраструктуры и коммуникаций района (города областного значения),8289937.0,8289937.0,8289937.0,1920899.0,8023831.0,1920784.066,6751491.389,4830707.323000001,99.99401665574297,23.170068312943755,3,False,True,False,3.0,361.0
383,8.0,"Культура, спорт, туризм и информационное пространство",817675037.6,835453152.9,836248964.3,183217870.3,696778512.9,179058446.751,346440196.711,167381749.96000004,97.72979374654372,21.41209787935399,1,False,True,False,2.0,59.0
384,1.0,Деятельность в области культуры,296000223.5,301243654.0,301282216.1,75338841.8,222229147.9,74650492.466,86737831.475,12087339.008999988,99.08632875479114,24.777596710594562,2,False,True,False,8.0,383.0
385,123.0,"Аппарат акима района в городе, города районного значения, поселка, села, сельского округа",9924910.0,9924910.0,9924910.0,2343401.0,9924910.0,2169133.448,3135048.641,965915.193,92.5634771001634,21.855447031761496,3,False,True,False,1.0,384.0
386,124.0,"Аппарат акима города районного значения, села, поселка, сельского округа",14034190.0,14080611.0,14108652.8,4048806.1,8555972.6,4045937.424,4090897.976,44960.551999999676,99.92914760724155,28.67699334127777,3,False,True,False,1.0,384.0
387,262.0,Управление культуры области,28017652.0,28434244.4,28434244.4,6166613.9,19926327.4,6162497.981,6278787.636,116289.65500000026,99.93325479644508,21.672803730279536,3,False,True,False,1.0,384.0
388,271.0,Управление строительства области,153357.0,153357.0,153357.0,60000.0,153357.0,60000.0,150463.648,90463.64799999999,100.0,39.12439601713649,3,False,True,False,1.0,384.0
389,273.0,"Управление культуры, архивов и документации области",38082192.0,38564980.6,38564980.6,8317510.8,31363896.8,8303623.392,8551264.484,247641.09199999925,99.8330340851496,21.53151191264958,3,False,True,False,1.0,384.0
390,288.0,"Управление строительства, архитектуры и градостроительства области",5242043.0,5975819.0,5975819.0,1766812.5,5967819.0,1514490.91,5758336.786,4243845.876,85.71882471965758,25.343654317508612,3,False,True,False,1.0,384.0
391,303.0,"Управление развития комфортной городской среды города республиканского значения, столицы",680362.0,680362.0,680362.0,180043.0,680362.0,180043.0,680362.0,500319.0,100.0,26.462824202409895,3,False,True,False,1.0,384.0
392,312.0,"Управление культуры, развития языков и  архивов  города республиканского значения, столицы",14190693.0,14190693.0,14190693.0,3188100.0,14190693.0,3188042.262,3308649.905,120607.64299999969,99.99818895266773,22.46572638841528,3,False,True,False,1.0,384.0
393,361.0,"Управление культуры города республиканского значения, столицы",31706136.0,31706136.0,31706136.0,7767875.0,18294170.0,7759389.084,8173542.96,414153.87600000016,99.89075627504305,24.472831012899206,3,False,True,False,1.0,384.0
394,373.0,"Управление строительства города республиканского значения, столицы",1869023.0,1869023.0,1869023.0,726683.0,1869023.0,726682.4,1710745.093,984062.6930000001,99.99991743304852,38.88033480593872,3,False,True,False,1.0,384.0
395,455.0,Отдел культуры и развития языков района (города областного значения),33747453.5,34088334.6,34469301.8,10101200.2,27231662.4,10099781.521,10181307.921,81526.40000000037,99.98595534221766,29.300800984022253,3,False,True,False,1.0,384.0
396,457.0,"Отдел культуры, развития языков, физической культуры и спорта района (города областного значения)",43831401.0,44666653.1,44246161.0,12302672.8,36011144.0,12301744.95,12561950.338,260205.38800000027,99.9924581429167,27.80296566294192,3,False,True,False,1.0,384.0
397,466.0,"Отдел архитектуры, градостроительства и строительства района (города областного значения)",623754.0,1945146.0,1951146.0,21054.0,1638239.0,19116.713,43325.065,24208.352000000003,90.79848484848485,0.9797684540265054,3,False,True,False,1.0,384.0
398,467.0,Отдел строительства района (города областного значения),5465557.0,5907848.4,5907848.4,2134180.0,5723671.4,1954992.034,4828279.727,2873287.693,91.60389629740696,33.09143873766293,3,False,True,False,1.0,384.0
399,472.0,"Отдел строительства, архитектуры и градостроительства района (города областного значения)",1081579.0,1444810.0,1444810.0,148353.0,1444810.0,148350.901,651917.039,503566.138,99.99858513140956,10.267848436818683,3,False,True,False,1.0,384.0
400,478.0,"Отдел внутренней политики, культуры и развития языков района (города областного значения)",4129323.0,4084057.0,4062434.2,1100392.5,3127318.4,1100334.242,1104155.817,3821.5749999999534,99.99470570728172,27.085589275513684,3,False,True,False,1.0,384.0
401,495.0,"Отдел архитектуры, строительства, жилищно-коммунального хозяйства, пассажирского транспорта и автомобильных дорог района (города областного значения)",40347.0,40350.2,90350.2,1159.0,90350.2,1155.766,7375.75,6219.984,99.72096635030199,1.2792069082304192,3,False,True,False,1.0,384.0
402,740.0,Управление культуры и развития языков области,14527716.0,14527716.0,14527716.0,2828210.2,6107600.9,2782844.672,2794870.067,12025.395000000019,98.39596335519897,19.15541763068606,3,False,True,False,1.0,384.0
403,748.0,"Управление культуры, развития языков и архивного дела  области",31470943.0,31598538.0,31598538.0,7066716.7,16252514.0,7064678.011,7330339.471,265661.45999999996,99.97115083161604,22.35761037741683,3,False,True,False,1.0,384.0
404,802.0,"Отдел культуры, физической культуры и спорта района (города областного значения)",8277970.0,8428251.4,8428251.4,2636977.0,5879875.5,2636977.0,2636977.0,0.0,100.0,31.28735576159961,3,False,True,False,1.0,384.0
405,810.0,Отдел реального сектора экономики района (города областного значения),279460.0,279460.0,279460.0,79448.0,279460.0,79447.188,273063.592,193616.404,99.99897794784009,28.428822729549847,3,False,True,False,1.0,384.0
406,819.0,"Отдел внутренней политики, культуры, развития языков и спорта района (города областного значения)",8624162.0,8652353.3,8668021.3,2352633.1,7515971.3,2351229.567,2486170.559,134940.9920000001,99.94034203633366,27.125332133182457,3,False,True,False,1.0,384.0
407,2.0,Спорт,270491034.5,278250688.4,278868373.2,67151181.6,259203196.7,65066507.449,172535944.793,107469437.34400001,96.89555105162886,23.33233657957166,2,False,True,False,8.0,383.0
408,123.0,"Аппарат акима района в городе, города районного значения, поселка, села, сельского округа",7290900.0,7290900.0,7290900.0,2072617.0,7290900.0,1791033.186,1791033.186,0.0,86.41409319715123,24.5653237048924,3,False,True,False,2.0,407.0
409,124.0,"Аппарат акима города районного значения, села, поселка, сельского округа",511621.5,522847.5,540606.5,179930.0,404356.3,179702.687,243159.249,63456.562000000005,99.87366587006058,33.24094086919044,3,False,True,False,2.0,407.0
410,271.0,Управление строительства области,24503006.0,24503806.0,24503806.0,6581599.3,24503806.0,6581596.85,24365243.082,17783646.232,99.99996277500516,26.85948807299568,3,False,True,False,2.0,407.0
411,285.0,Управление физической культуры и спорта области,103144293.0,106453180.5,106453180.5,24897105.8,96497149.5,24574439.241,61330351.475,36755912.234,98.70399972755067,23.084739343227046,3,False,True,False,2.0,407.0
412,288.0,"Управление строительства, архитектуры и градостроительства области",26866366.0,29459625.4,29459625.4,5873357.1,29123422.4,5424846.322,18723023.999,13298177.677000001,92.36363853987356,18.414512229337443,3,False,True,False,2.0,407.0
413,323.0,Управление Спорта города Алматы,14257630.0,14257630.0,14257630.0,2652880.0,14205683.0,2648695.824,9529213.291,6880517.466999999,99.84227797714182,18.577392063056763,3,False,True,False,2.0,407.0
414,373.0,"Управление строительства города республиканского значения, столицы",8953804.0,8953804.0,8953804.0,3255484.0,8953804.0,3255484.0,8678611.847,5423127.846999999,100.0,36.35866945490431,3,False,True,False,2.0,407.0
415,381.0,"Управление физической культуры и спорта города республиканского значения, столицы",18614081.0,18614081.0,18614081.0,5354352.0,16141546.0,5329172.092,11696753.135,6367581.043,99.52973005883811,28.62978887864515,3,False,True,False,2.0,407.0
416,457.0,"Отдел культуры, развития языков, физической культуры и спорта района (города областного значения)",11387473.0,11202458.0,11199906.0,2986738.6,9641051.4,2978461.69,4521517.502,1543055.8120000004,99.72287799139838,26.593631142975667,3,False,True,False,2.0,407.0
417,465.0,Отдел физической культуры и спорта района (города областного значения),14897238.0,14031022.1,14091398.8,3349482.9,12242636.7,3339259.259,5464213.84,2124954.581,99.69476957174494,23.697145374950285,3,False,True,False,2.0,407.0
418,466.0,"Отдел архитектуры, градостроительства и строительства района (города областного значения)",2149235.0,2252151.0,2683379.2,335404.1,2682584.2,335402.838,1284207.552,948804.7139999999,99.9996237374558,12.499270993827484,3,False,True,False,2.0,407.0
419,467.0,Отдел строительства района (города областного значения),16141325.0,17168204.5,17293672.9,3680890.7,17092273.9,2717643.167,9708481.045,6990837.8780000005,73.8311291612109,15.714667339405963,3,False,True,False,2.0,407.0
420,472.0,"Отдел строительства, архитектуры и градостроительства района (города областного значения)",2044990.0,2462578.0,2416590.0,225592.8,2416590.0,215591.864,785381.342,569789.4779999999,95.56681950842403,8.921325669641933,3,False,True,False,2.0,407.0
421,495.0,"Отдел архитектуры, строительства, жилищно-коммунального хозяйства, пассажирского транспорта и автомобильных дорог района (города областного значения)",1101388.0,1148377.1,1162295.6,277085.7,1162295.6,277084.692,1000327.492,723242.8,99.99963621363354,23.83943396154988,3,False,True,False,2.0,407.0
422,768.0,"Управление физической культуры, спорта и туризма области",13304671.0,14526254.0,14526254.0,4098584.0,12957963.0,4094362.974,10849072.923,6754709.949000001,99.89701257800255,28.185951959810147,3,False,True,False,2.0,407.0
423,802.0,"Отдел культуры, физической культуры и спорта района (города областного значения)",410755.0,454390.6,454390.6,87755.9,383489.4,87746.779,92157.986,4411.207000000009,99.98960639683486,19.31087020726221,3,False,True,False,2.0,407.0
424,804.0,"Отдел физической культуры, спорта и туризма района (города областного значения",2237602.0,2268722.7,2286196.7,512216.7,1076442.5,511117.486,569105.013,57987.52700000006,99.78540059314739,22.356671497251305,3,False,True,False,2.0,407.0
425,810.0,Отдел реального сектора экономики района (города областного значения),1549041.0,1549041.0,1549041.0,395880.0,1546758.8,395879.03,1347836.737,951957.7069999999,99.99975497625545,25.55639456928513,3,False,True,False,2.0,407.0
426,819.0,"Отдел внутренней политики, культуры, развития языков и спорта района (города областного значения)",1125615.0,1131615.0,1131615.0,334225.0,880444.0,328987.468,556254.097,227266.62899999996,98.43293230608123,29.072384865877527,3,False,True,False,2.0,407.0
427,3.0,Информационное пространство,170228832.6,169955317.0,169983233.6,25548514.1,143580892.2,24674666.301,56260483.302,31585817.001000002,96.57965314311566,14.515941236336147,2,False,True,False,8.0,383.0
428,121.0,"Аппарат акима города республиканского значения, столицы",56000.0,56000.0,56000.0,0.0,56000.0,0.0,0.0,0.0,0.0,0.0,3,False,True,False,3.0,427.0
429,262.0,Управление культуры области,2506285.0,2534166.0,2534166.0,576043.9,2163713.0,572846.272,635208.168,62361.89599999995,99.44489855721065,22.60492296084787,3,False,True,False,3.0,427.0
430,263.0,Управление внутренней политики области,11136729.0,10580805.0,10580805.0,1091323.8,10220059.0,914464.109,2852398.311,1937934.202,83.7940223607329,8.642670467889731,3,False,True,False,3.0,427.0
431,264.0,Управление по развитию языков области,877028.0,863985.0,863985.0,162472.0,659426.0,159541.366,281093.103,121551.737,98.19622211827269,18.46575646567938,3,False,True,False,3.0,427.0
432,273.0,"Управление культуры, архивов и документации области",5981943.0,5984143.0,5984143.0,1363328.0,4790042.0,1350890.01,1569432.505,218542.49499999988,99.08767442611023,22.57449412555816,3,False,True,False,3.0,427.0
433,288.0,"Управление строительства, архитектуры и градостроительства области",18586.0,0.0,0.0,0.0,0.0,0.0,0.0,0.0,0.0,0.0,3,False,True,False,3.0,427.0
434,305.0,"Управление внутренней политики и по делам молодежи города республиканского значения, столицы",1952951.0,1952951.0,1952951.0,158443.0,1952951.0,158346.407,298350.517,140004.11,99.93903612024513,8.108058369103988,3,False,True,False,3.0,427.0
435,310.0,"Управление цифровизации и государственных услуг города республиканского значения, столицы",2766745.0,2766745.0,2766745.0,404360.0,2263350.0,402109.498,2254791.147,1852681.6489999997,99.4434409931744,14.533666745580096,3,False,True,False,3.0,427.0
436,312.0,"Управление культуры, развития языков и  архивов  города республиканского значения, столицы",2195266.0,2195266.0,2195266.0,527183.0,2195266.0,527054.415,547925.478,20871.062999999966,99.97560903898646,24.00868118032166,3,False,True,False,3.0,427.0
437,313.0,"Управление цифровизации города республиканского значения, столицы",18081929.0,18081929.0,18081929.0,903302.0,18005711.0,900545.463,8308176.347,7407630.884,99.69483771761824,4.980361680437966,3,False,True,False,3.0,427.0
438,325.0,"Управление общественного развития города республиканского значения, столицы",5114900.0,5114900.0,5114900.0,731519.0,4998165.0,729689.05,794306.483,64617.43299999996,99.74984245111884,14.265949480928269,3,False,True,False,3.0,427.0
439,346.0,"Управление по развитию языков и архивного дела города республиканского значения, столицы",1055812.0,1055812.0,1055812.0,334575.0,437777.0,292283.481,342692.234,50408.75299999997,87.35962967944408,27.683288407405865,3,False,True,False,3.0,427.0
440,361.0,"Управление культуры города республиканского значения, столицы",5020337.0,5020337.0,5020337.0,1016475.0,2331714.0,984566.101,1300234.532,315668.43099999987,96.86082795936939,19.61155398532011,3,False,True,False,3.0,427.0
441,362.0,"Управление внутренней политики города республиканского значения, столицы",1593173.0,1593173.0,1593173.0,140831.0,1475912.0,136059.009,919568.351,783509.3420000001,96.61154788363356,8.540127719965126,3,False,True,False,3.0,427.0
442,455.0,Отдел культуры и развития языков района (города областного значения),15931609.6,16035480.7,16035998.9,3582561.8,11638302.9,3576684.313,3975460.126,398775.8130000001,99.83594178333504,22.304094277532034,3,False,True,False,3.0,427.0
443,456.0,Отдел внутренней политики района (города областного значения),5403568.0,5726506.8,5743332.2,283348.4,5711643.2,270299.884,544385.228,274085.344,95.39488629545816,4.706325084242907,3,False,True,False,3.0,427.0
444,457.0,"Отдел культуры, развития языков, физической культуры и спорта района (города областного значения)",18100627.0,18192528.4,18179580.4,4247546.1,12919395.6,4235388.191,5043081.666,807693.4750000006,99.71376628496157,23.297502460507836,3,False,True,False,3.0,427.0
445,458.0,"Отдел жилищно-коммунального хозяйства, пассажирского транспорта и автомобильных дорог района (города областного значения)",1000.0,19826.0,21743.0,1575.0,21743.0,1302.622,2644.16,1341.5379999999998,82.70615873015873,5.990994802925079,3,False,True,False,3.0,427.0
446,466.0,"Отдел архитектуры, градостроительства и строительства района (города областного значения)",285396.0,53237.6,69237.6,2155.0,69237.6,0.0,49378.649,49378.649,0.0,0.0,3,False,True,False,3.0,427.0
447,467.0,Отдел строительства района (города областного значения),45819.0,89036.8,89036.8,7480.0,89036.8,7478.236,26910.144,19431.908,99.97641711229946,8.39903949827487,3,False,True,False,3.0,427.0
448,470.0,Отдел внутренней политики и развития языков района (города областного значения),336647.0,337953.0,337953.0,40476.5,313121.2,38862.766,41111.783,2249.017,96.01315825231926,11.499458800484092,3,False,True,False,3.0,427.0
449,472.0,"Отдел строительства, архитектуры и градостроительства района (города областного значения)",600130.0,282209.8,287813.8,5177.0,287813.8,4659.08,32792.33,28133.25,89.99575043461464,1.6187826990922602,3,False,True,False,3.0,427.0
450,478.0,"Отдел внутренней политики, культуры и развития языков района (города областного значения)",2754860.0,2772250.0,2772250.0,609843.8,2308197.8,609759.265,800174.959,190415.69400000002,99.98613825376268,21.995103796555146,3,False,True,False,3.0,427.0
451,490.0,"Отдел коммунального хозяйства, пассажирского транспорта и автомобильных дорог района (города областного значения)",23484.0,23484.0,23484.0,0.0,23484.0,0.0,0.0,0.0,0.0,0.0,3,False,True,False,3.0,427.0
452,492.0,"Отдел жилищно-коммунального хозяйства, пассажирского транспорта, автомобильных дорог и жилищной инспекции района (города областного значения)",1163.0,5063.0,5063.0,2506.0,5063.0,2505.579,2505.579,0.0,99.98320031923384,49.48803081177168,3,False,True,False,3.0,427.0
453,495.0,"Отдел архитектуры, строительства, жилищно-коммунального хозяйства, пассажирского транспорта и автомобильных дорог района (города областного значения)",45321.0,59706.2,59706.2,0.0,59706.2,0.0,8328.42,8328.42,0.0,0.0,3,False,True,False,3.0,427.0
454,739.0,"Управление информатизации, оказания государственных услуг и архивов области",7228967.0,7228967.0,7228967.0,1123271.5,7228967.0,1122906.475,4721768.556,3598862.081,99.96750340411914,15.533429257596557,3,False,True,False,3.0,427.0
