id,code,name,utv,utch,plg,plgp,plgo,sumrg,obz,obzsumrg,plgpsumrg,plgsumrg,level,isLeaf,loaded,expanded,parentCode,parent_id
1,1.0,I. ДОХОДЫ,15378585236.0,15492062310.5,15526299517.3,3361311641.3,0.0,3758865779.639,0.0,0.0,111.82735136648157,24.209669377115436,0,False,True,False,,
6,1.0,НАЛОГОВЫЕ ПОСТУПЛЕНИЯ,7374869967.0,7435515450.6,7436221228.5,1646827746.2,0.0,2068974349.555,0.0,0.0,125.63392585102413,27.82292626832384,1,False,True,False,1.0,1.0
7,1.0,Налоговые поступления,7374869967.0,7435515450.6,7436221228.5,1646827746.2,0.0,2068974349.555,0.0,0.0,125.63392585102413,27.82292626832384,2,False,True,False,1.0,6.0
8,1.0,Подоходный налог,3915522387.0,3947652849.0,3947739396.5,826453000.4,0.0,1070679685.642,0.0,0.0,129.55118864881553,27.1213364942794,3,False,True,False,1.0,7.0
9,1.0,Корпоративный подоходный налог,1486104718.0,1487709724.0,1487709724.0,272674338.6,0.0,373078022.325,0.0,0.0,136.82183084792857,25.077339773104825,4,False,True,False,1.0,8.0
10,2.0,Индивидуальный подоходный налог,2429417669.0,2459943125.0,2460029672.5,553778661.8,0.0,697601663.317,0.0,0.0,125.97120680842384,28.357449144426937,4,False,True,False,1.0,8.0
11,3.0,Социальный налог,1606757875.0,1615185775.5,1615237766.7,393719243.7,0.0,477668782.355,0.0,0.0,121.32218325578381,29.572660583023502,3,False,True,False,1.0,7.0
12,1.0,Социальный налог,1606757875.0,1615185775.5,1615237766.7,393719243.7,0.0,477668782.355,0.0,0.0,121.32218325578381,29.572660583023502,4,False,True,False,3.0,11.0
13,4.0,Hалоги на собственность,718827770.0,741517277.1,742084520.1,182754039.4,0.0,242102545.476,0.0,0.0,132.4745249247826,32.62465917539627,3,False,True,False,1.0,7.0
14,1.0,Hалоги на имущество,580854211.0,603615304.3,604206021.8,140455644.8,0.0,160273842.617,0.0,0.0,114.10993331397957,26.526356380812892,4,False,True,False,4.0,13.0
15,3.0,Земельный налог,17338101.0,17326376.2,17326507.2,3935469.6,0.0,5009608.901,0.0,0.0,127.29380252359208,28.91297618829951,4,False,True,False,4.0,13.0
16,4.0,Hалог на транспортные средства,117147105.0,117063127.6,117038749.3,37769886.6,0.0,75236414.461,0.0,0.0,199.19682380248395,64.28333770736903,4,False,True,False,4.0,13.0
17,5.0,Единый земельный налог,3488353.0,3512469.0,3513241.8,593038.4,0.0,1582679.497,0.0,0.0,266.8763940075381,45.048977186825,4,False,True,False,4.0,13.0
18,5.0,"Внутренние налоги на товары, работы и услуги",1018478443.0,1015882581.0,1015882577.2,219962879.3,0.0,247107031.94,0.0,0.0,112.34033339006213,24.324369517300152,3,False,True,False,1.0,7.0
19,2.0,Акцизы,781322765.0,772317492.0,772317492.0,164238156.1,0.0,179365774.671,0.0,0.0,109.21078203154524,23.224357408572068,4,False,True,False,5.0,18.0
20,3.0,Поступления за использование природных и других ресурсов,148897322.0,155308660.0,155308660.3,41281763.3,0.0,47772743.504,0.0,0.0,115.72360210688966,30.75987096387309,4,False,True,False,5.0,18.0
21,4.0,Сборы за ведение предпринимательской и профессиональной деятельности,88257946.0,88256429.0,88256424.9,14442959.9,0.0,19968513.765,0.0,0.0,138.25776643608904,22.625563847193632,4,False,True,False,5.0,18.0
22,5.0,Налог на игорный бизнес,410.0,0.0,0.0,0.0,0.0,0.0,0.0,0.0,0.0,0.0,4,False,True,False,5.0,18.0
23,7.0,Прочие налоги,98283.0,98283.0,98283.0,14076.8,0.0,81366.838,0.0,0.0,578.0208428051831,82.78831334004863,3,False,True,False,1.0,7.0
24,1.0,Прочие налоги,98283.0,98283.0,98283.0,14076.8,0.0,81366.838,0.0,0.0,578.0208428051831,82.78831334004863,4,False,True,False,7.0,23.0
25,8.0,"Обязательные платежи, взимаемые за совершение юридически значимых действий и (или) выдачу документов уполномоченными на то государственными органами или должностными лицами",115185209.0,115178685.0,115178685.0,23924506.6,0.0,31334937.304,0.0,0.0,130.9742258341913,27.2055001357239,3,False,True,False,1.0,7.0
26,1.0,Государственная пошлина,115185209.0,115178685.0,115178685.0,23924506.6,0.0,31334937.304,0.0,0.0,130.9742258341913,27.2055001357239,4,False,True,False,8.0,25.0
27,2.0,НЕНАЛОГОВЫЕ ПОСТУПЛЕНИЯ,98549268.0,135748513.7,135748509.3,20461189.2,0.0,104809970.276,0.0,0.0,512.2379215182664,77.20892908250889,1,False,True,False,1.0,1.0
28,2.0,Неналоговые поступления,98549268.0,135748513.7,135748509.3,20461189.2,0.0,104809970.276,0.0,0.0,512.2379215182664,77.20892908250889,2,False,True,False,2.0,27.0
29,1.0,Доходы от государственной собственности,17438216.0,17471880.6,17471876.2,2984800.3,0.0,6250902.924,0.0,0.0,209.4244939602827,35.77694148267832,3,False,True,False,2.0,28.0
30,1.0,Поступления части чистого дохода государственных предприятий,2350390.0,2350390.0,2350390.0,220290.7,0.0,648563.883,0.0,0.0,294.4127387129824,27.593883695897276,4,False,True,False,1.0,29.0
31,3.0,"Дивиденды на государственные пакеты акций, находящиеся в государственной собственности",2226320.0,2226320.0,2226320.0,438.0,0.0,617.262,0.0,0.0,140.92739726027398,0.027725663875812996,4,False,True,False,1.0,29.0
32,4.0,"Доходы на доли участия в юридических лицах, находящиеся в государственной собственности",619527.0,619527.0,619527.0,5216.6,0.0,1252075.751,0.0,0.0,24001.75882758885,202.10188595493014,4,False,True,False,1.0,29.0
33,5.0,"Доходы от аренды  имущества, находящегося в государственной собственности",10913294.0,10911207.6,10911202.2,2569275.6,0.0,3681196.137,0.0,0.0,143.2775890994333,33.73776848347656,4,False,True,False,1.0,29.0
34,6.0,Вознаграждения за размещение бюджетных средств на банковских счетах,9033.0,45033.0,45033.0,25947.2,0.0,267470.933,0.0,0.0,1030.8277309305051,593.9442919636712,4,False,True,False,1.0,29.0
35,7.0,"Вознаграждения по кредитам, выданным из государственного бюджета",1262421.0,1262172.0,1262173.0,151668.2,0.0,430557.214,0.0,0.0,283.88100735684867,34.11237714639752,4,False,True,False,1.0,29.0
36,9.0,Прочие доходы от государственной собственности,57231.0,57231.0,57231.0,11964.0,0.0,-29578.256,0.0,0.0,-247.22714811099968,-51.68222816305848,4,False,True,False,1.0,29.0
37,2.0,"Поступления от реализации товаров (работ, услуг) государственными учреждениями, финансируемыми из государственного бюджета",20453.0,20453.0,20453.0,1489.4,0.0,10332.781,0.0,0.0,693.75459916745,50.51963526133086,3,False,True,False,2.0,28.0
38,1.0,"Поступления от реализации товаров (работ, услуг) государственными учреждениями, финансируемыми из государственного бюджета",20453.0,20453.0,20453.0,1489.4,0.0,10332.781,0.0,0.0,693.75459916745,50.51963526133086,4,False,True,False,2.0,37.0
39,3.0,"Поступления денег от проведения государственных закупок, организуемых государственными учреждениями, финансируемыми из государственного бюджета",204720.0,206610.0,206610.0,21853.1,0.0,167177.103,0.0,0.0,765.0040634967122,80.91433280092929,3,False,True,False,2.0,28.0
40,1.0,"Поступления денег от проведения государственных закупок, организуемых государственными учреждениями, финансируемыми из государственного бюджета",204720.0,206610.0,206610.0,21853.1,0.0,167177.103,0.0,0.0,765.0040634967122,80.91433280092929,4,False,True,False,3.0,39.0
41,4.0,"Штрафы, пени, санкции, взыскания, налагаемые государственными учреждениями, финансируемыми из государственного бюджета, а также содержащимися и финансируемыми из бюджета (сметы расходов) Национального Банка Республики Казахстан",30504287.0,65989057.7,65989057.7,6555285.6,0.0,72881341.802,0.0,0.0,1111.7950650693238,110.4445863332884,3,False,True,False,2.0,28.0
42,1.0,"Штрафы, пени, санкции, взыскания, налагаемые государственными учреждениями, финансируемыми из государственного бюджета, а также содержащимися и финансируемыми из бюджета (сметы расходов) Национального Банка Республики Казахстан, за исключением поступлений от организаций нефтяного сектора, в Фонд компенсации потерпевшим, Фонд поддержки инфраструктуры образования и Специальный государственный фонд",30504287.0,65989057.7,65989057.7,6555285.6,0.0,72881341.802,0.0,0.0,1111.7950650693238,110.4445863332884,4,False,True,False,4.0,41.0
43,5.0,Гранты,0.0,0.0,0.0,0.0,0.0,21.397,0.0,0.0,0.0,0.0,3,False,True,False,2.0,28.0
44,1.0,Техническая помощь,0.0,0.0,0.0,0.0,0.0,0.1,0.0,0.0,0.0,0.0,4,False,True,False,5.0,43.0
45,2.0,Финансовая помощь,0.0,0.0,0.0,0.0,0.0,21.297,0.0,0.0,0.0,0.0,4,False,True,False,5.0,43.0
46,6.0,Прочие неналоговые поступления,50381592.0,52060512.4,52060512.4,10897760.8,0.0,25500194.269,0.0,0.0,233.99480624496732,48.98183497133617,3,False,True,False,2.0,28.0
47,1.0,Прочие неналоговые поступления,50381592.0,52060512.4,52060512.4,10897760.8,0.0,25500194.269,0.0,0.0,233.99480624496732,48.98183497133617,4,False,True,False,6.0,46.0
48,3.0,ПОСТУПЛЕНИЯ ОТ ПРОДАЖИ ОСНОВНОГО КАПИТАЛА,256767317.0,270399663.2,270631096.5,25950725.4,0.0,42949554.704,0.0,0.0,165.5042548598661,15.870147687924696,1,False,True,False,1.0,1.0
49,3.0,Поступления от продажи основного капитала,256767317.0,270399663.2,270631096.5,25950725.4,0.0,42949554.704,0.0,0.0,165.5042548598661,15.870147687924696,2,False,True,False,3.0,48.0
50,1.0,"Продажа государственного имущества, закрепленного за государственными учреждениями",215430610.0,227729228.2,227960661.2,18446875.1,0.0,28778055.83,0.0,0.0,156.00504515802785,12.624132461500334,3,False,True,False,3.0,49.0
51,1.0,"Продажа государственного имущества, закрепленного за государственными учреждениями",215430610.0,227729228.2,227960661.2,18446875.1,0.0,28778055.83,0.0,0.0,156.00504515802785,12.624132461500334,4,False,True,False,1.0,50.0
52,3.0,Продажа земли и нематериальных активов,41336707.0,42670435.0,42670435.3,7503850.3,0.0,14171498.874,0.0,0.0,188.8563644986361,33.21151700085891,3,False,True,False,3.0,49.0
53,1.0,Продажа земли,36238100.0,37561226.0,37277726.3,6489398.3,0.0,11013715.767,0.0,0.0,169.71859728505186,29.545030934464485,4,False,True,False,3.0,52.0
54,2.0,Продажа нематериальных активов,5098607.0,5109209.0,5392709.0,1014452.0,0.0,3157783.107,0.0,0.0,311.27969652580896,58.556527099830525,4,False,True,False,3.0,52.0
55,4.0,ПОСТУПЛЕНИЯ ТРАНСФЕРТОВ,7648398684.0,7650398683.0,7683698683.0,1668071980.5,0.0,1542131905.1,0.0,0.0,92.44996158006023,20.070176730276135,1,False,True,False,1.0,1.0
56,4.0,Поступления трансфертов,7648398684.0,7650398683.0,7683698683.0,1668071980.5,0.0,1542131905.1,0.0,0.0,92.44996158006023,20.070176730276135,2,False,True,False,4.0,55.0
57,2.0,Трансферты из вышестоящих органов государственного управления,7648398684.0,7650398683.0,7683698683.0,1668071980.5,0.0,1542131905.1,0.0,0.0,92.44996158006023,20.070176730276135,3,False,True,False,4.0,56.0
58,1.0,Трансферты из республиканского бюджета,7648398684.0,7650398683.0,7683698683.0,1668071980.5,0.0,1542131905.1,0.0,0.0,92.44996158006023,20.070176730276135,4,False,True,False,2.0,57.0
59,2.0,II. ЗАТРАТЫ,15000758512.0,15291866722.4,15384011305.8,3087253727.2,12354160160.7,2975527579.454,6228768694.575,3253241115.121,96.38105068068602,19.34168872023763,0,False,True,False,,
64,1.0,Государственные услуги общего характера,445050753.4,470383360.8,484674239.2,127794006.5,390059989.2,125783057.479,187469672.918,61686615.43900001,98.42641366674737,25.95208230720425,1,False,True,False,2.0,59.0
65,1.0,"Представительные, исполнительные и другие органы, выполняющие общие функции государственного управления",296654343.6,307760612.6,312928368.4,82815798.2,243116987.9,81696346.588,109994845.473,28298498.885000005,98.64826321024339,26.10704392373012,2,False,True,False,1.0,64.0
66,110.0,Аппарат маслихата области,2922850.0,2937059.0,2937059.0,749623.1,2163190.3,741405.351,882397.176,140991.82499999995,98.90374923078011,25.243120788516677,3,False,True,False,1.0,65.0
67,111.0,"Аппарат маслихата города республиканского значения, столицы",835536.0,835536.0,835536.0,178334.0,605824.0,149916.316,340823.465,190907.14900000003,84.0649096638891,17.942532218839162,3,False,True,False,1.0,65.0
68,112.0,Аппарат маслихата района (города областного значения),12256456.4,12393703.3,12402096.3,3625883.2,9725598.9,3614073.356,4462928.498,848855.1419999995,99.67429055629812,29.14082642625505,3,False,True,False,1.0,65.0
69,120.0,Аппарат акима области,59729391.0,63435886.7,63165128.7,12206793.5,41906641.0,11913482.673,20666841.883,8753359.21,97.59715090617368,18.860853952475203,3,False,True,False,1.0,65.0
70,121.0,"Аппарат акима города республиканского значения, столицы",8727968.0,8727968.0,8727968.0,2244026.0,6560142.0,2167185.153,3926694.395,1759509.242,96.57575950546027,24.830351726770765,3,False,True,False,1.0,65.0
71,122.0,Аппарат акима района (города областного значения),67245333.6,70348632.6,72935767.7,19346325.9,61078535.4,19297884.603,26402955.169,7105070.566,99.7496098367701,26.458739259969427,3,False,True,False,1.0,65.0
72,123.0,"Аппарат акима района в городе, города районного значения, поселка, села, сельского округа",13443798.0,14103059.4,15776234.7,4449610.7,12729878.7,4145571.729,6909145.375,2763573.646,93.16706580645358,26.27732033550439,3,False,True,False,1.0,65.0
73,124.0,"Аппарат акима города районного значения, села, поселка, сельского округа",117690294.6,120908456.0,122078266.4,36618553.3,98182795.3,36346398.271,42315338.022,5968939.751000002,99.25678377632686,29.773029502162064,3,False,True,False,1.0,65.0
74,263.0,Управление внутренней политики области,2359189.0,2388543.0,2388543.0,519865.5,1912195.0,508986.613,659346.485,150359.87199999997,97.90736507808269,21.309501775768744,3,False,True,False,1.0,65.0
75,282.0,Ревизионная комиссия области,6590926.0,6721621.6,6721621.6,1836466.6,4955620.3,1822900.122,2090697.983,267797.86100000003,99.26127281596082,27.119945609553504,3,False,True,False,1.0,65.0
76,305.0,"Управление внутренней политики и по делам молодежи города республиканского значения, столицы",251937.0,251937.0,251937.0,49265.0,251937.0,48769.722,56684.735,7915.012999999999,98.99466558408608,19.3579037616547,3,False,True,False,1.0,65.0
77,325.0,"Управление общественного развития города республиканского значения, столицы",272276.0,272276.0,272276.0,37674.0,181562.0,34990.31,44137.803,9147.493000000002,92.87654615915486,12.851044528346236,3,False,True,False,1.0,65.0
78,362.0,"Управление внутренней политики города республиканского значения, столицы",329973.0,329973.0,329973.0,69746.0,115385.0,68516.719,107087.098,38570.379,98.23748888825166,20.76434102184118,3,False,True,False,1.0,65.0
79,379.0,"Ревизионная комиссия города републиканского значения, столицы",1616581.0,1616581.0,1616581.0,432395.0,1209910.0,391839.406,597555.282,205715.876,90.62070699244904,24.238773436035686,3,False,True,False,1.0,65.0
80,747.0,Управление информации и общественного развития области,630165.0,694565.0,694565.0,123109.0,358137.0,120959.973,128049.985,7090.012000000002,98.25437051718396,17.41521283105253,3,False,True,False,1.0,65.0
81,752.0,Управление общественного развития области,1751669.0,1794815.0,1794815.0,328127.4,1179636.0,323466.271,404162.119,80695.848,98.57947583773863,18.022262517306796,3,False,True,False,1.0,65.0
82,2.0,Финансовая деятельность,41199044.0,43540077.7,43783100.7,7996405.8,35106070.1,7882417.452,11866505.556,3984088.1040000003,98.57450521082859,18.003333080518892,2,False,True,False,1.0,64.0
83,124.0,"Аппарат акима города районного значения, села, поселка, сельского округа",431964.0,445729.0,445729.0,71183.8,205572.8,69838.352,80275.808,10437.456000000006,98.10989579089625,15.668343769420431,3,False,True,False,2.0,82.0
84,257.0,Управление финансов области,6394056.0,6573433.8,6573433.8,1326804.1,5990853.8,1302000.721,1571937.31,269936.58900000015,98.13059222533302,19.807010469931257,3,False,True,False,2.0,82.0
85,299.0,Управление экономики и финансов области,1717.0,2874.2,2874.2,0.2,2874.2,0.0,1923.999,1923.999,0.0,0.0,3,False,True,False,2.0,82.0
86,318.0,"Управление государственных активов города республиканского значения, столицы",13741169.0,13741169.0,13741169.0,870314.0,13570891.0,864242.098,3119779.439,2255537.341,99.30233203188735,6.289436495541246,3,False,True,False,2.0,82.0
87,332.0,"Управление активов и государственных закупок города республиканского значения, столицы
",4504801.0,4504801.0,4504801.0,879197.0,1300001.0,863520.982,958447.761,94926.7790000001,98.21700733737717,19.168904064796646,3,False,True,False,2.0,82.0
88,356.0,"Управление финансов города республиканского значения, столицы",1216172.0,1216172.0,1216172.0,367400.0,822251.0,327110.05,470973.125,143863.075,89.03376428960262,26.89669306644126,3,False,True,False,2.0,82.0
89,366.0,"Управление государственного архитектурно-строительного контроля города республиканского значения, столицы",230452.0,230452.0,230452.0,44514.0,230452.0,43973.927,44759.213,785.2860000000001,98.78673451049109,19.08159920504053,3,False,True,False,2.0,82.0
90,452.0,Отдел финансов района (города областного значения),4633814.0,5194764.6,5603680.5,1621729.2,4622969.1,1619599.523,2064909.712,445310.189,99.868678630193,28.90242445121559,3,False,True,False,2.0,82.0
91,459.0,Отдел экономики и финансов района (города областного значения),2076575.0,2179300.8,2008407.9,804475.9,1707993.8,803756.609,898928.125,95171.51599999995,99.91058886910099,40.019590094223396,3,False,True,False,2.0,82.0
92,489.0,Отдел государственных активов и закупок района (города областного значения),3195853.0,4494181.9,4494181.9,800757.3,3349481.9,800625.594,1033832.356,233206.762,99.98355231978529,17.814712706666366,3,False,True,False,2.0,82.0
93,718.0,Управление государственных закупок области,1963645.0,2134208.0,2134208.0,683238.6,1580633.5,672098.993,748186.398,76087.40500000003,98.36958757892192,31.491728688112875,3,False,True,False,2.0,82.0
94,727.0,Управление экономики области,1894.0,1894.0,1894.0,0.0,1894.0,0.0,0.0,0.0,0.0,0.0,3,False,True,False,2.0,82.0
95,733.0,Управление по государственным закупкам и коммунальной собственности области,2296991.0,2281826.0,2281826.0,395909.6,1383990.6,385084.397,715684.205,330599.80799999996,97.26573869388366,16.87615081079802,3,False,True,False,2.0,82.0
96,751.0,Управление финансов и государственных активов области,273695.0,273695.0,273695.0,82301.0,100643.0,82055.796,100338.139,18282.342999999993,99.70206437345841,29.98074352838013,3,False,True,False,2.0,82.0
97,805.0,Отдел государственных закупок района (города областного значения),236246.0,265576.4,270576.4,48581.1,235568.4,48510.41,56529.966,8019.555999999997,99.85449073816774,17.92854439633316,3,False,True,False,2.0,82.0
98,5.0,Планирование и статистическая деятельность,12762451.0,12853663.0,12855504.3,2936804.3,9671055.4,2876444.084,5460543.579,2584099.495,97.9446973705398,22.375194444919593,2,False,True,False,1.0,64.0
99,257.0,Управление финансов области,6857.0,6857.0,6857.0,0.0,0.0,0.0,0.0,0.0,0.0,0.0,3,False,True,False,5.0,98.0
100,258.0,Управление экономики и бюджетного планирования области,4744743.0,4775284.9,4776064.9,1236341.8,3646577.0,1224880.899,1551630.773,326749.87400000007,99.07299898782036,25.64623648644305,3,False,True,False,5.0,98.0
101,299.0,Управление экономики и финансов области,1104359.0,1113359.0,1113359.0,303937.0,323627.0,286689.52,302167.824,15478.304000000004,94.32531083744328,25.74996205177306,3,False,True,False,5.0,98.0
102,357.0,"Управление экономики и бюджетного планирования города республиканского значения, столицы",1061815.0,1061815.0,1061815.0,274008.0,716236.0,267407.985,346101.553,78693.56800000003,97.59130572829989,25.184046655961723,3,False,True,False,5.0,98.0
103,453.0,Отдел экономики и бюджетного планирования района (города областного значения),2726308.0,2748730.4,2749791.7,782769.5,2028807.7,781431.928,897723.271,116291.343,99.82912313267187,28.417858996374157,3,False,True,False,5.0,98.0
104,459.0,Отдел экономики и финансов района (города областного значения),4362.0,4362.0,4362.0,0.0,3000.0,0.0,1050.0,1050.0,0.0,0.0,3,False,True,False,5.0,98.0
105,510.0,"Управление экономики города республиканского значения, столицы",2330325.0,2330325.0,2330325.0,70620.0,2230779.0,60652.83,2061996.504,2001343.6739999999,85.88619371282923,2.6027627047729394,3,False,True,False,5.0,98.0
106,727.0,Управление экономики области,652103.0,681350.7,681350.7,232502.0,681350.7,218789.576,261609.678,42820.10200000001,94.10223395927777,32.111154505308356,3,False,True,False,5.0,98.0
107,750.0,Управление стратегии и экономического развития области,131579.0,131579.0,131579.0,36626.0,40678.0,36591.346,38263.976,1672.6300000000047,99.90538415333369,27.809411836235263,3,False,True,False,5.0,98.0
108,9.0,Прочие государственные услуги общего характера,94434914.8,106229007.5,115107265.8,34044998.2,102165875.8,33327849.355,60147778.31,26819928.955000002,97.89352655921127,28.953732089256178,2,False,True,False,1.0,64.0
109,265.0,Управление предпринимательства и промышленности области,1381427.0,1415721.0,1415721.0,354845.1,853420.0,342128.705,509177.304,167048.599,96.41635322003884,24.16639330772094,3,False,True,False,9.0,108.0
110,269.0,Управление по делам религий области,6205132.0,6229098.0,6229098.0,1413623.3,4939976.0,1395328.908,3058426.027,1663097.1189999997,98.70585098590267,22.40017588421309,3,False,True,False,9.0,108.0
