id,code,name,utv,utch,plg,plgp,plgo,sumrg,obz,obzsumrg,plgpsumrg,plgsumrg,level,isLeaf,loaded,expanded,parentCode,parent_id
709,490.0,"Отдел коммунального хозяйства, пассажирского транспорта и автомобильных дорог района (города областного значения)",29097.0,54097.0,54097.0,14549.0,54097.0,14548.254,14548.254,0.0,99.99487249982818,26.892903488178643,3,False,True,False,9.0,701.0
710,492.0,"Отдел жилищно-коммунального хозяйства, пассажирского транспорта, автомобильных дорог и жилищной инспекции района (города областного значения)",1958532.0,2671511.0,2861564.0,1914165.8,2743426.8,1888798.514,1903216.906,14418.391999999993,98.67476025326542,66.0058105986796,3,False,True,False,9.0,701.0
711,495.0,"Отдел архитектуры, строительства, жилищно-коммунального хозяйства, пассажирского транспорта и автомобильных дорог района (города областного значения)",123962.0,139235.5,139235.5,64569.3,139235.5,64566.732,71221.728,6654.995999999999,99.9960228777453,46.372320277515435,3,False,True,False,9.0,701.0
712,809.0,"Отдел жилищно-коммунального хозяйства, пассажирского транспорта, автомобильных дорог, строительства, архитектуры и градостроительства района (города областного значения)",12573.0,15188.0,15188.0,3106.0,15188.0,3106.0,6933.0,3827.0,100.0,20.450355543850407,3,False,True,False,9.0,701.0
713,810.0,Отдел реального сектора экономики района (города областного значения),180267.0,168846.0,168846.0,78400.7,104589.7,78398.979,79593.459,1194.479999999996,99.9978048665382,46.432239437120224,3,False,True,False,9.0,701.0
714,13.0,Прочие,581698752.4,701199581.9,592838891.6,298687153.7,559174533.1,281209372.628,454346129.591,173136756.963,94.14846575907494,47.43436650538398,1,False,True,False,2.0,57.0
715,1.0,Регулирование экономической деятельности,14883824.0,19361693.1,19361693.1,11781274.3,19279261.1,9420752.101,17746581.942,8325829.841000002,79.96377862961734,48.65665441727304,2,False,True,False,13.0,714.0
716,271.0,Управление строительства области,2799321.0,4741047.0,4741047.0,2177116.0,4736439.0,2067863.713,4731608.644,2663744.9310000003,94.98178843019848,43.61618252255251,3,False,True,False,1.0,715.0
717,279.0,Управление энергетики и жилищно-коммунального хозяйства области,936374.0,1943806.0,1943806.0,431640.0,1943806.0,431639.799,848523.012,416883.213,99.99995343341674,22.205909386018973,3,False,True,False,1.0,715.0
718,280.0,Управление индустриально-инновационного развития области,100000.0,77824.0,77824.0,0.0,0.0,0.0,0.0,0.0,0.0,0.0,3,False,True,False,1.0,715.0
719,288.0,"Управление строительства, архитектуры и градостроительства области",7659926.0,6574880.1,6574880.1,5373605.3,6574880.1,3122335.59,6421218.643,3298883.0530000003,58.10504150723538,47.48885975882663,3,False,True,False,1.0,715.0
720,309.0,"Управление энергетики и развития инфраструктуры города республиканского значения, столицы",3388203.0,6024136.0,6024136.0,3798913.0,6024136.0,3798912.999,5745231.643,1946318.6440000003,99.99999997367668,63.06154109070579,3,False,True,False,1.0,715.0
721,3.0,Поддержка предпринимательской деятельности и защита конкуренции,77863076.4,100386227.3,101557915.8,79185913.8,94162980.7,78094487.474,87816312.212,9721824.73799999,98.62169131651798,76.89650467797411,2,False,True,False,13.0,714.0
722,265.0,Управление предпринимательства и промышленности области,10327950.0,14258602.5,14258602.5,12765007.2,13731774.5,12760244.425,12767226.425,6982.0,99.96268881853824,89.49155027640332,3,False,True,False,3.0,721.0
723,266.0,Управление предпринимательства и индустриально-инновационного развития области,18155329.0,26105657.2,26105657.2,21567353.2,22947620.2,21556486.081,22005137.029,448650.9479999989,99.94961310783374,82.57400269930764,3,False,True,False,3.0,721.0
724,275.0,Управление предпринимательства области,4792775.0,6887757.0,7621294.7,6177813.8,7040570.7,6175414.237,6188033.95,12619.713000000454,99.96115837936067,81.02841420106743,3,False,True,False,3.0,721.0
725,278.0,Управление предпринимательства и торговли области,1232822.0,2181150.0,2181150.0,1565164.0,2139328.0,1565164.0,1565164.0,0.0,100.0,71.75865942278156,3,False,True,False,3.0,721.0
726,279.0,Управление энергетики и жилищно-коммунального хозяйства области,7874187.0,8040183.9,8040183.9,4186530.0,7976474.9,4165746.677,7834641.423,3668894.7460000003,99.50356684414061,51.81158452109534,3,False,True,False,3.0,721.0
727,288.0,"Управление строительства, архитектуры и градостроительства области",165668.0,165668.0,165668.0,116206.7,165668.0,116206.613,165666.844,49460.231000000014,99.99992513340453,70.14427227949875,3,False,True,False,3.0,721.0
728,309.0,"Управление энергетики и развития инфраструктуры города республиканского значения, столицы",2000000.0,32949.0,32949.0,0.0,32949.0,0.0,32697.029,32697.029,0.0,0.0,3,False,True,False,3.0,721.0
729,310.0,"Управление цифровизации и государственных услуг города республиканского значения, столицы",4513315.0,5200315.0,5200315.0,1201954.0,3804999.0,1201953.636,3804999.0,2603045.364,99.99996971597915,23.11309287995054,3,False,True,False,3.0,721.0
730,326.0,"Управление предпринимательства и инвестиций города республиканского значения, столицы",13424602.0,17324602.0,17324602.0,16214395.0,16824602.0,15241395.0,15799602.0,558207.0,93.9991593889257,87.97544093653637,3,False,True,False,3.0,721.0
731,334.0,"Управление по инвестициям и развитию предпринимательства города республиканского значения, столицы
",9120701.0,11256305.0,11354040.0,10061865.0,10972048.0,9988854.394,10751711.899,762857.5050000008,99.2743829697576,87.97621281940172,3,False,True,False,3.0,721.0
732,343.0,"Управление топливно-энергетического комплекса и коммунального хозяйства города республиканского значения, столицы",284454.0,0.0,0.0,0.0,0.0,0.0,0.0,0.0,0.0,0.0,3,False,True,False,3.0,721.0
733,393.0,"Управление предпринимательства и индустриально-инновационного развития города республиканского значения, столицы",2370293.0,3396871.0,3396871.0,3110521.0,3396871.0,3110520.7,3110520.7,0.0,99.99999035531347,91.57017443406006,3,False,True,False,3.0,721.0
734,454.0,Отдел предпринимательства и сельского хозяйства района (города областного значения),81763.0,307377.4,267377.4,30663.3,263400.4,30536.937,62509.712,31972.774999999998,99.58790149788183,11.420911789852097,3,False,True,False,3.0,721.0
735,458.0,"Отдел жилищно-коммунального хозяйства, пассажирского транспорта и автомобильных дорог района (города областного значения)",575329.0,478175.0,518175.0,244966.0,466676.0,244701.773,333379.41,88677.63699999999,99.89213727619342,47.22377054084045,3,False,True,False,3.0,721.0
736,466.0,"Отдел архитектуры, градостроительства и строительства района (города областного значения)",127504.0,50650.0,93186.0,32461.0,93186.0,30371.436,50538.904,20167.468,93.56284772496227,32.59227351748117,3,False,True,False,3.0,721.0
737,467.0,Отдел строительства района (города областного значения),52665.0,824898.3,755501.3,216100.0,755501.3,216099.471,661371.34,445271.86899999995,99.99975520592318,28.603454553949803,3,False,True,False,3.0,721.0
738,469.0,Отдел предпринимательства района (города областного значения),1415956.4,1654655.7,1929676.4,1257405.0,1646831.3,1253338.277,1314562.618,61224.341000000015,99.67657811126884,64.95069727753317,3,False,True,False,3.0,721.0
739,472.0,"Отдел строительства, архитектуры и градостроительства района (города областного значения)",152160.0,277099.8,272107.8,30142.7,81449.8,30142.636,30725.943,583.3070000000007,99.99978767661821,11.077461212063747,3,False,True,False,3.0,721.0
740,492.0,"Отдел жилищно-коммунального хозяйства, пассажирского транспорта, автомобильных дорог и жилищной инспекции района (города областного значения)",939700.0,939700.0,939700.0,134748.0,939700.0,134748.0,939700.0,804952.0,100.0,14.339470043630945,3,False,True,False,3.0,721.0
741,493.0,"Отдел предпринимательства, промышленности и туризма района (города областного значения)",9991.0,2075.0,500.0,250.0,500.0,200.0,200.0,0.0,80.0,40.0,3,False,True,False,3.0,721.0
742,494.0,Отдел предпринимательства и промышленности района (города областного значения),10444.0,13110.0,14685.0,10624.0,14128.0,10623.333,10623.333,0.0,99.9937217620482,72.34138917262514,3,False,True,False,3.0,721.0
743,495.0,"Отдел архитектуры, строительства, жилищно-коммунального хозяйства, пассажирского транспорта и автомобильных дорог района (города областного значения)",15300.0,241285.5,338533.6,22582.6,338533.6,22582.068,65414.205,42832.137,99.99764420394463,6.670554414687347,3,False,True,False,3.0,721.0
744,517.0,"Управление коммунального хозяйства города республиканского значения, столицы",0.0,285428.0,285428.0,110000.0,285428.0,110000.0,192728.394,82728.394,100.0,38.53861569292431,3,False,True,False,3.0,721.0
745,518.0,"Управление энергетики города республиканского значения, столицы",0.0,194454.0,194454.0,0.0,0.0,0.0,0.0,0.0,0.0,0.0,3,False,True,False,3.0,721.0
746,806.0,"Отдел сельского хозяйства, земельных отношений и предпринимательства района (города областного значения)",7114.0,6114.0,6114.0,973.3,5564.0,973.222,973.222,0.0,99.99198602691874,15.917926071311744,3,False,True,False,3.0,721.0
747,810.0,Отдел реального сектора экономики района (города областного значения),22394.0,22394.0,22394.0,21200.0,22394.0,21199.556,21199.83,0.27400000000125146,99.99790566037736,94.66623202643567,3,False,True,False,3.0,721.0
748,815.0,Отдел поддержки бизнеса и туризма района (города областного значения),190660.0,238750.0,238750.0,106988.0,216783.0,106985.002,106985.002,0.0,99.99719781657755,44.810472041884815,3,False,True,False,3.0,721.0
749,9.0,Прочие,488951852.0,581451661.5,471919282.7,207719965.6,445732291.3,193694133.053,348783235.437,155089102.38399997,93.24772055180814,41.043911565726745,2,False,True,False,13.0,714.0
750,120.0,Аппарат акима области,1670641.0,1490757.8,1490757.8,630187.0,1414446.8,630034.295,1153170.981,523136.68599999987,99.975768303694,42.26268646724505,3,False,True,False,9.0,749.0
751,123.0,"Аппарат акима района в городе, города районного значения, поселка, села, сельского округа",165870.0,165870.0,165870.0,66880.0,165870.0,58140.0,87212.0,29072.0,86.93181818181817,35.051546391752574,3,False,True,False,9.0,749.0
752,124.0,"Аппарат акима города районного значения, села, поселка, сельского округа",34759990.0,40865828.2,40737019.9,21387593.4,40553145.0,20213120.989,35422422.599,15209301.61,94.5086275532057,49.61855589490482,3,False,True,False,9.0,749.0
753,252.0,"Исполнительный орган внутренних дел, финансируемый из областного бюджета",226723.0,226723.0,226723.0,226723.0,226723.0,226723.0,226723.0,0.0,100.0,100.0,3,False,True,False,9.0,749.0
754,253.0,Управление здравоохранения области,3155008.0,3940647.4,3940647.4,3043278.7,3868013.2,3041661.382,3129932.333,88270.95099999988,99.94685606678088,77.18684452712009,3,False,True,False,9.0,749.0
755,256.0,Управление координации занятости и социальных  программ области,1705745.0,1705745.0,1705745.0,980062.5,1705745.0,978920.906,1705744.402,726823.496,99.88351824500988,57.38963948304113,3,False,True,False,9.0,749.0
756,257.0,Управление финансов области,17854776.0,81924289.7,23650045.8,2292069.4,12199408.0,0.0,0.0,0.0,0.0,0.0,3,False,True,False,9.0,749.0
757,258.0,Управление экономики и бюджетного планирования области,4943062.0,2859043.0,2212842.0,0.0,1349722.0,0.0,0.0,0.0,0.0,0.0,3,False,True,False,9.0,749.0
758,261.0,Управление образования области,36201103.0,45242248.8,45262248.8,23222512.7,45262248.8,22669651.701,41046863.873,18377212.172000002,97.61928863537666,50.085120165306506,3,False,True,False,9.0,749.0
759,265.0,Управление предпринимательства и промышленности области,483096.0,494981.0,494981.0,437603.0,479329.0,437547.481,442677.081,5129.599999999977,99.98731292975597,88.39682351443794,3,False,True,False,9.0,749.0
760,266.0,Управление предпринимательства и индустриально-инновационного развития области,2432407.0,2685218.0,8154920.5,1829688.2,7903935.5,1781520.086,1978664.896,197144.81000000006,97.36741407634372,21.84595283301658,3,False,True,False,9.0,749.0
761,268.0,Управление пассажирского транспорта и автомобильных дорог области,11046222.0,10318226.5,10318226.5,9262536.5,10318226.5,9262532.251,10318225.065,1055692.8139999993,99.99995412703637,89.7686462978885,3,False,True,False,9.0,749.0
762,271.0,Управление строительства области,18428702.0,18483587.0,18459277.0,10031386.5,18459277.0,9012759.825,17052426.002,8039666.177000001,89.84560434392593,48.825096589644325,3,False,True,False,9.0,749.0
763,278.0,Управление предпринимательства и торговли области,133948.0,188173.0,188173.0,80736.2,149366.2,80660.688,133669.663,53008.975000000006,99.9064707033524,42.86517619424678,3,False,True,False,9.0,749.0
764,279.0,Управление энергетики и жилищно-коммунального хозяйства области,4599660.0,6925275.0,6925275.0,4389545.0,6925275.0,3488222.394,4542524.861,1054302.4669999997,79.46660517206226,50.36944228207544,3,False,True,False,9.0,749.0
765,280.0,Управление индустриально-инновационного развития области,735212.0,793815.0,793815.0,487796.1,734758.4,487551.674,644724.507,157172.83299999998,99.94989176830238,61.41880337358201,3,False,True,False,9.0,749.0
766,285.0,Управление физической культуры и спорта области,2918994.0,4333951.0,4333951.0,1712235.5,4333951.0,1711255.277,4308199.774,2596944.4970000004,99.94275185860823,39.48487827850384,3,False,True,False,9.0,749.0
767,288.0,"Управление строительства, архитектуры и градостроительства области",10180314.0,16884597.9,16697124.9,5085595.0,16697124.9,4916884.223,8642859.995,3725975.771999999,96.68257545085679,29.447490226296384,3,False,True,False,9.0,749.0
768,299.0,Управление экономики и финансов области,18532828.0,5771574.6,1930156.7,0.0,0.0,0.0,0.0,0.0,0.0,0.0,3,False,True,False,9.0,749.0
769,303.0,"Управление развития комфортной городской среды города республиканского значения, столицы",14943522.0,14594220.0,14594220.0,9200828.0,14594220.0,9200827.7,14594219.462,5393391.762,99.99999673942388,63.04432645252709,3,False,True,False,9.0,749.0
770,309.0,"Управление энергетики и развития инфраструктуры города республиканского значения, столицы",4380246.0,4380246.0,4380246.0,793860.0,4380246.0,793857.2,4380246.0,3586388.8,99.99964729297358,18.12357570784837,3,False,True,False,9.0,749.0
771,310.0,"Управление цифровизации и государственных услуг города республиканского значения, столицы",1348930.0,2953631.0,2953631.0,1143175.0,2953631.0,1143175.0,2953629.859,1810454.8590000002,100.0,38.70405612617148,3,False,True,False,9.0,749.0
772,313.0,"Управление цифровизации города республиканского значения, столицы",4232534.0,4232534.0,4232534.0,1958344.0,4232534.0,1958343.09,4232533.68,2274190.59,99.99995353216799,46.268809417715254,3,False,True,False,9.0,749.0
773,317.0,"Управление городской мобильности города республиканского значения, столицы",567484.0,567484.0,567484.0,269767.0,567484.0,243817.037,567483.463,323666.426,90.38060140788163,42.96456587322286,3,False,True,False,9.0,749.0
774,323.0,Управление Спорта города Алматы,687086.0,687086.0,687086.0,570478.0,687086.0,570477.92,687085.92,116608.0,99.9999859766722,83.02860486169126,3,False,True,False,9.0,749.0
775,326.0,"Управление предпринимательства и инвестиций города республиканского значения, столицы",2591832.0,2459533.0,2459533.0,1313279.0,2362104.0,1072131.435,2003773.079,931641.6439999999,81.63775062267806,43.59085383282111,3,False,True,False,9.0,749.0
776,334.0,"Управление по инвестициям и развитию предпринимательства города республиканского значения, столицы
",643926.0,643926.0,643926.0,391000.0,643926.0,384991.628,643925.546,258933.91799999995,98.46333196930946,59.78817876588304,3,False,True,False,9.0,749.0
777,348.0,"Управление пассажирского транспорта и автомобильных дорог города республиканского значения, столицы",37347.0,37347.0,37347.0,21791.0,37347.0,21785.75,37347.0,15561.25,99.97590748474141,58.333333333333336,3,False,True,False,9.0,749.0
778,353.0,"Управление здравоохранения города республиканского значения, столицы",1042861.0,1035015.0,1035015.0,79254.0,538284.0,79254.0,79254.0,0.0,100.0,7.6572803292705895,3,False,True,False,9.0,749.0
779,356.0,"Управление финансов города республиканского значения, столицы",48490766.0,47190766.0,26331079.6,48034.8,22432214.6,0.0,0.0,0.0,0.0,0.0,3,False,True,False,9.0,749.0
780,357.0,"Управление экономики и бюджетного планирования города республиканского значения, столицы",98051.0,663395.0,16788.0,16788.0,16788.0,0.0,0.0,0.0,0.0,0.0,3,False,True,False,9.0,749.0
781,360.0,"Управление образования города республиканского значения, столицы",8833013.0,8833013.0,8833013.0,5634938.0,8833013.0,5634927.34,8833012.631,3198085.2909999993,99.9998108231182,63.79394369735446,3,False,True,False,9.0,749.0
782,373.0,"Управление строительства города республиканского значения, столицы",8991490.0,12755169.0,12755169.0,7484172.0,12755169.0,7428590.127,11321090.804,3892500.676999999,99.25734105255732,58.23984085981142,3,False,True,False,9.0,749.0
783,381.0,"Управление физической культуры и спорта города республиканского значения, столицы",771628.0,771629.0,771629.0,400173.0,771629.0,399973.794,771627.664,371653.87,99.95022002983708,51.83498728015665,3,False,True,False,9.0,749.0
784,393.0,"Управление предпринимательства и индустриально-инновационного развития города республиканского значения, столицы",324517.0,340698.0,340698.0,107613.0,340698.0,107543.092,145617.734,38074.64199999999,99.93503758839546,31.565519022712195,3,False,True,False,9.0,749.0
785,452.0,Отдел финансов района (города областного значения),5868062.0,20535244.5,3598686.3,37630.9,2173140.2,0.0,0.0,0.0,0.0,0.0,3,False,True,False,9.0,749.0
786,453.0,Отдел экономики и бюджетного планирования района (города областного значения),3704383.0,929476.6,806132.5,0.0,609842.0,0.0,0.0,0.0,0.0,0.0,3,False,True,False,9.0,749.0
787,455.0,Отдел культуры и развития языков района (города областного значения),664627.0,1340401.2,1340401.2,916790.8,1340401.2,916589.863,916589.863,0.0,99.97808256801879,68.38175488055369,3,False,True,False,9.0,749.0
788,457.0,"Отдел культуры, развития языков, физической культуры и спорта района (города областного значения)",2536843.0,2753002.9,2791845.9,1668964.0,2791845.9,1618960.448,1963514.788,344554.33999999985,97.00391668124657,57.98889000284723,3,False,True,False,9.0,749.0
789,458.0,"Отдел жилищно-коммунального хозяйства, пассажирского транспорта и автомобильных дорог района (города областного значения)",39328856.0,40632467.5,41669959.6,19513245.4,41669456.6,17613553.091,36826071.786,19212518.695,90.26460094126628,42.26918686765417,3,False,True,False,9.0,749.0
790,459.0,Отдел экономики и финансов района (города областного значения),18498705.0,31694548.4,9449958.0,81082.8,6024282.6,0.0,0.0,0.0,0.0,0.0,3,False,True,False,9.0,749.0
791,465.0,Отдел физической культуры и спорта района (города областного значения),0.0,34904.0,34904.0,11528.5,34904.0,11528.308,34904.0,23375.692,99.99833456217202,33.02861563144626,3,False,True,False,9.0,749.0
792,466.0,"Отдел архитектуры, градостроительства и строительства района (города областного значения)",13816361.0,13794025.3,14098543.4,6434084.6,14098543.4,5716428.126,12875144.104,7158715.978,88.84602055123739,40.546232073875096,3,False,True,False,9.0,749.0
793,467.0,Отдел строительства района (города областного значения),34448049.0,38078603.8,39031341.7,22416242.6,38852341.7,20252276.954,35329295.695,15077018.741,90.34643903256114,51.88721696953604,3,False,True,False,9.0,749.0
794,472.0,"Отдел строительства, архитектуры и градостроительства района (города областного значения)",16131659.0,16671350.2,17033686.1,7662296.4,17033686.1,7109360.528,15887933.835,8778573.307,92.78367942018009,41.737064345690854,3,False,True,False,9.0,749.0
795,478.0,"Отдел внутренней политики, культуры и развития языков района (города областного значения)",1113789.0,1099274.0,1214619.6,912552.9,1155652.6,909813.085,962457.041,52643.956000000006,99.69976370684921,74.90518718782407,3,False,True,False,9.0,749.0
796,485.0,Отдел пассажирского транспорта и автомобильных дорог района (города областного значения),16973308.0,23050643.0,25133257.1,10177238.0,25133257.1,9699452.782,20050910.142,10351457.360000001,95.305354773073,38.59210425217828,3,False,True,False,9.0,749.0
