id,code,name,utv,utch,plg,plgp,plgo,sumrg,obz,obzsumrg,plgpsumrg,plgsumrg,level,isLeaf,loaded,expanded,parentCode,parent_id
452,457.0,"Отдел культуры, развития языков, физической культуры и спорта района (города областного значения)",6699335.6,7559236.4,7773196.4,6502444.4,7319859.0,6494113.434,6758281.198,264167.7639999995,99.87187947350999,83.54495499431869,3,False,True,False,2.0,443.0
453,465.0,Отдел физической культуры и спорта района (города областного значения),11330415.0,9800061.3,9783035.1,7754841.9,9320381.5,7704678.634,8345735.554,641056.9199999999,99.35313618708331,78.75550435263183,3,False,True,False,2.0,443.0
454,466.0,"Отдел архитектуры, градостроительства и строительства района (города областного значения)",994623.4,1210784.4,1199608.4,640056.9,1199608.4,640010.108,1090777.967,450767.85899999994,99.99268939995804,53.35158606758673,3,False,True,False,2.0,443.0
455,467.0,Отдел строительства района (города областного значения),6900182.0,11717115.8,11780620.8,6914315.5,11777676.8,6625458.403,10507675.591,3882217.188,95.82233270957913,56.240316325265304,3,False,True,False,2.0,443.0
456,472.0,"Отдел строительства, архитектуры и градостроительства района (города областного значения)",3549809.0,4176887.8,3885634.7,3262889.8,3885634.7,3139689.315,3767665.214,627975.8990000002,96.22419105297396,80.80248292511902,3,False,True,False,2.0,443.0
457,495.0,"Отдел архитектуры, строительства, жилищно-коммунального хозяйства, пассажирского транспорта и автомобильных дорог района (города областного значения)",281640.0,1088552.7,1088552.7,558000.1,1088552.7,452827.783,962576.681,509748.898,81.15191789392154,41.599068469537585,3,False,True,False,2.0,443.0
458,760.0,Управление культуры и спорта области,2410851.0,2939493.6,2939493.6,2776136.0,2905585.4,2773636.966,2868974.502,95337.53599999985,99.90998157150803,94.35764602447169,3,False,True,False,2.0,443.0
459,762.0,"Управление строительства, энергетики и жилищно-коммунального хозяйства области",0.0,851349.7,851349.7,404828.5,851349.7,386185.154,850349.484,464164.3300000001,95.39475456891005,45.36151877424753,3,False,True,False,2.0,443.0
460,802.0,"Отдел культуры, физической культуры и спорта района (города областного значения)",149226.0,243958.0,243958.0,178109.0,198317.0,174641.839,176140.906,1499.066999999981,98.05334879203184,71.58684650636586,3,False,True,False,2.0,443.0
461,804.0,"Отдел физической культуры, спорта и туризма района (города областного значения",123280.0,127437.8,127437.8,101010.0,109529.5,101007.435,104089.35,3081.915000000008,99.99746064746064,79.26018418397052,3,False,True,False,2.0,443.0
462,809.0,"Отдел жилищно-коммунального хозяйства, пассажирского транспорта, автомобильных дорог, строительства, архитектуры и градостроительства района (города областного значения)",16888.0,51714.0,51714.0,15686.0,51436.0,15685.58,51435.58,35750.0,99.99732245314293,30.331399620992382,3,False,True,False,2.0,443.0
463,810.0,Отдел реального сектора экономики района (города областного значения),354802.0,675196.0,675196.0,464515.3,675196.0,397486.153,650901.628,253415.47500000003,85.57008843411616,58.86974345227164,3,False,True,False,2.0,443.0
464,819.0,"Отдел внутренней политики, культуры, развития языков и спорта района (города областного значения)",1366000.0,1460938.2,1262841.2,1131213.4,1224979.8,1129327.214,1147753.005,18425.79099999997,99.83325993132685,89.42749207105375,3,False,True,False,2.0,443.0
465,820.0,Отдел культуры и спорта района (города областного значения),0.0,1429411.1,1451154.1,1224797.7,1313615.0,1222600.077,1272741.816,50141.73900000006,99.82057257292368,84.25018934929102,3,False,True,False,2.0,443.0
466,3.0,Информационное пространство,102269462.5,115495530.9,116532488.5,84399799.4,111617558.7,81873705.012,97803494.491,15929789.479000002,97.00699005689816,70.25826536948964,2,False,True,False,8.0,417.0
467,121.0,"Аппарат акима города республиканского значения, столицы",64500.0,64500.0,64500.0,17440.0,64500.0,11499.999,33999.0,22499.001,65.9403612385321,17.829455813953487,3,False,True,False,3.0,466.0
468,262.0,Управление культуры области,1865310.0,1421813.1,1421813.1,1169276.4,1421813.1,1167806.828,1170475.94,2669.1119999999646,99.87431782596485,82.13504489443795,3,False,True,False,3.0,466.0
469,263.0,Управление внутренней политики области,7305132.0,8458779.6,8458779.6,6577352.3,8401590.6,6523185.947,8122444.791,1599258.8440000005,99.17647176965114,77.1173414543157,3,False,True,False,3.0,466.0
470,264.0,Управление по развитию языков области,1261747.0,1354874.0,1354874.0,1120842.0,1312925.0,985506.805,1071799.661,86292.85600000003,87.92557782452835,72.73789333915921,3,False,True,False,3.0,466.0
471,271.0,Управление строительства области,257239.0,266566.0,266566.0,226758.0,266566.0,226757.917,266564.709,39806.79199999999,99.99996339710175,85.0663314151092,3,False,True,False,3.0,466.0
472,273.0,"Управление культуры, архивов и документации области",4467421.0,4699539.0,4699539.0,3758623.0,4525502.0,3655910.795,3746657.226,90746.43099999987,97.26729163845376,77.7929663952145,3,False,True,False,3.0,466.0
473,288.0,"Управление строительства, архитектуры и градостроительства области",10000.0,10000.0,10000.0,5000.0,10000.0,0.0,10000.0,10000.0,0.0,0.0,3,False,True,False,3.0,466.0
474,305.0,"Управление внутренней политики и по делам молодежи города республиканского значения, столицы",1700822.0,1821748.0,1821748.0,1360943.0,1782129.0,1360937.707,1668279.21,307341.503,99.99961107849484,74.70504740501978,3,False,True,False,3.0,466.0
475,310.0,"Управление цифровизации и государственных услуг города республиканского значения, столицы",1643793.0,2842251.0,2842251.0,2142916.0,2827930.0,2140105.147,2734748.8,594643.6529999999,99.86883046278994,75.29613489449032,3,False,True,False,3.0,466.0
476,312.0,"Управление культуры, развития языков и  архивов  города республиканского значения, столицы",1145037.0,1254366.0,1254366.0,1018039.0,1129319.0,1015482.256,1018147.487,2665.2309999999125,99.74885598685316,80.95581799889347,3,False,True,False,3.0,466.0
477,313.0,"Управление цифровизации города республиканского значения, столицы",6850255.0,7830414.0,7830414.0,5206846.0,7775492.0,4577991.711,6891416.911,2313425.2,87.92254871759219,58.46423587565101,3,False,True,False,3.0,466.0
478,325.0,"Управление общественного развития города республиканского значения, столицы",4238451.0,4238451.0,4238451.0,3527548.0,4226054.0,3522783.934,4199438.963,676655.0290000006,99.86494681291367,83.11489112413946,3,False,True,False,3.0,466.0
479,346.0,"Управление по развитию языков и архивного дела города республиканского значения, столицы",667770.0,886567.0,886567.0,767306.0,794361.0,691039.448,724641.145,33601.697000000044,90.06047756696806,77.94554139732249,3,False,True,False,3.0,466.0
480,361.0,"Управление культуры города республиканского значения, столицы",2510637.0,4382124.0,4382124.0,2921670.0,4035482.0,2272709.455,2567670.936,294961.48100000015,77.78802722415605,51.863193624826685,3,False,True,False,3.0,466.0
481,362.0,"Управление внутренней политики города республиканского значения, столицы",1079373.0,1329373.0,1329373.0,952374.0,1211239.0,937414.427,1127904.832,190490.4049999999,98.42923336840359,70.51553078030018,3,False,True,False,3.0,466.0
482,455.0,Отдел культуры и развития языков района (города областного значения),10617051.0,9222794.2,9260426.8,7330523.4,8642025.2,7325434.512,7460506.432,135071.91999999993,99.93057947267448,79.10471806763809,3,False,True,False,3.0,466.0
483,456.0,Отдел внутренней политики района (города областного значения),4364813.0,4286963.8,4402205.8,3157910.9,4394430.4,3146787.903,4029980.206,883192.3029999998,99.64777356447897,71.48207162418441,3,False,True,False,3.0,466.0
484,457.0,"Отдел культуры, развития языков, физической культуры и спорта района (города областного значения)",10799259.5,11240866.4,11598642.4,9160749.6,10286452.1,9130261.392,9249154.682,118893.2899999991,99.66718653678736,78.71836269389597,3,False,True,False,3.0,466.0
485,470.0,Отдел внутренней политики и развития языков района (города областного значения),248089.0,267447.0,267447.0,189559.5,265059.0,189501.098,244893.781,55392.68299999999,99.96919067627842,70.85557063642516,3,False,True,False,3.0,466.0
486,478.0,"Отдел внутренней политики, культуры и развития языков района (города областного значения)",2269800.0,2091046.6,2013966.6,1652505.2,1916115.7,1652446.342,1700006.94,47560.598,99.99643825629111,82.04934193049675,3,False,True,False,3.0,466.0
487,739.0,"Управление информатизации, оказания государственных услуг и архивов области",3992860.0,5219152.3,5219152.3,3193963.9,5219152.3,3164062.134,4596352.322,1432290.1879999996,99.0638038833188,60.62406214894324,3,False,True,False,3.0,466.0
488,743.0,Управление цифровых технологий области,8468574.0,9828820.0,9902651.0,5098874.3,9737702.2,4690548.409,7742629.192,3052080.783,91.99184237587501,47.366593137534586,3,False,True,False,3.0,466.0
489,747.0,Управление информации и общественного развития области,726017.0,743460.0,743460.0,587443.0,743460.0,587443.0,743459.565,156016.56499999994,100.0,79.01474188254916,3,False,True,False,3.0,466.0
490,748.0,"Управление культуры, развития языков и архивного дела  области",4192358.0,4443638.0,4127904.0,3222879.9,3905134.6,3168729.003,3232122.752,63393.748999999836,98.31979786153371,76.76363120363264,3,False,True,False,3.0,466.0
491,752.0,Управление общественного развития области,7198005.0,8523145.1,8523145.1,6183351.4,8403930.1,6095682.446,7609286.66,1513604.2139999997,98.58217739331458,71.51916780109728,3,False,True,False,3.0,466.0
492,755.0,"Управление цифровизации, государственных услуг и архивов области",5171742.0,5651417.0,5651417.0,3724786.0,5471569.0,3638778.389,4880556.321,1241777.9320000005,97.6909381908115,64.38700929342146,3,False,True,False,3.0,466.0
493,759.0,Управление цифровизации и архивов области,2815921.0,3879048.6,5155829.6,2865605.1,4870520.0,2771110.843,3494184.204,723073.361,96.70246758703772,53.74713786118921,3,False,True,False,3.0,466.0
494,760.0,Управление культуры и спорта области,816228.0,841151.9,841151.9,663333.6,718092.9,659748.138,677366.746,17618.608000000007,99.45947830774742,78.43388786258463,3,False,True,False,3.0,466.0
495,766.0,Управление культуры и туризма области,0.0,441419.0,441419.0,374554.0,377554.0,374551.964,377327.964,2776.0,99.99945642016905,84.85179931085884,3,False,True,False,3.0,466.0
496,802.0,"Отдел культуры, физической культуры и спорта района (города областного значения)",1229585.0,1299121.0,1299121.0,1041573.1,1158283.5,1040191.896,1050264.988,10073.091999999946,99.86739250466434,80.06890012554642,3,False,True,False,3.0,466.0
497,803.0,Отдел внутренней политики и по делам религии района (города областного значения),9551.0,9551.0,9551.0,7959.0,9551.0,7959.0,9551.0,1592.0,100.0,83.33158831535965,3,False,True,False,3.0,466.0
498,819.0,"Отдел внутренней политики, культуры, развития языков и спорта района (города областного значения)",4282122.0,4659566.2,4228075.2,3555169.9,3995818.9,3525247.548,3666889.013,141641.46499999985,99.15834255909964,83.37712508046215,3,False,True,False,3.0,466.0
499,820.0,Отдел культуры и спорта района (города областного значения),0.0,1701430.1,1701430.1,1403576.3,1435678.1,1403542.102,1412521.826,8979.72399999993,99.99756350972868,82.49190501566888,3,False,True,False,3.0,466.0
500,821.0,Отдел общественного развития района (города областного значения),0.0,284127.0,284127.0,212547.6,282127.0,212546.517,272250.286,59703.76900000003,99.99949046707654,74.80687051916924,3,False,True,False,3.0,466.0
501,4.0,Туризм,8777993.0,10258564.8,10258564.8,5802106.8,9968086.4,5198459.721,7865201.246,2666741.5250000004,89.5960708789435,50.67433722307821,2,False,True,False,8.0,417.0
502,265.0,Управление предпринимательства и промышленности области,88043.0,89302.9,89302.9,17324.4,89302.9,17321.861,42591.591,25269.73,99.98534436979058,19.39675083339959,3,False,True,False,4.0,501.0
503,266.0,Управление предпринимательства и индустриально-инновационного развития области,453047.0,196965.1,196965.1,81273.1,106516.1,81253.179,85312.288,4059.1089999999967,99.97548881487232,41.25257672552143,3,False,True,False,4.0,501.0
504,271.0,Управление строительства области,960751.0,973650.0,973650.0,774130.0,973650.0,466906.015,882435.0,415528.985,60.313644349140326,47.95419452575361,3,False,True,False,4.0,501.0
505,275.0,Управление предпринимательства области,434261.0,464261.0,464261.0,137285.0,464261.0,88444.866,190648.855,102203.98900000002,64.42427504825727,19.050677528373047,3,False,True,False,4.0,501.0
506,284.0,Управление туризма области,2662440.0,2806351.0,2806351.0,1650511.5,2706163.5,1515121.651,2234992.946,719871.2949999999,91.7970975058338,53.989028849206676,3,False,True,False,4.0,501.0
507,289.0,Управление предпринимательства и туризма области,214306.0,219536.8,219536.8,90502.7,215530.8,85455.289,85722.289,267.0,94.42291666436472,38.925268565452356,3,False,True,False,4.0,501.0
508,334.0,"Управление по инвестициям и развитию предпринимательства города республиканского значения, столицы
",887638.0,2278730.0,2278730.0,1505283.0,2268730.0,1505282.879,1781614.947,276332.06799999997,99.99999196164441,66.05797435413585,3,False,True,False,4.0,501.0
509,380.0,"Управление туризма города республиканского значения, столицы",2509889.0,2607037.0,2607037.0,1170790.0,2593110.0,1083445.748,2166088.338,1082642.59,92.53971660161086,41.55851060034821,3,False,True,False,4.0,501.0
510,467.0,Отдел строительства района (города областного значения),0.0,6350.0,6350.0,4002.0,6350.0,4001.156,6216.356,2215.2,99.97891054472764,63.01033070866142,3,False,True,False,4.0,501.0
511,514.0,"Управление туризма, внешних связей и креативной индустрии города республиканского значения, столицы",511789.0,519315.0,519315.0,308220.0,473803.0,291691.101,324581.158,32890.05699999997,94.63730484718708,56.168433609658884,3,False,True,False,4.0,501.0
512,766.0,Управление культуры и туризма области,0.0,17984.0,17984.0,3249.0,3249.0,0.0,0.0,0.0,0.0,0.0,3,False,True,False,4.0,501.0
513,804.0,"Отдел физической культуры, спорта и туризма района (города областного значения",4054.0,10124.0,10124.0,8428.1,8428.1,8428.017,8428.017,0.0,99.99901519915521,83.24789608850257,3,False,True,False,4.0,501.0
514,815.0,Отдел поддержки бизнеса и туризма района (города областного значения),51775.0,68958.0,68958.0,51108.0,58992.0,51107.959,56569.461,5461.502,99.99991977772561,74.11461904347574,3,False,True,False,4.0,501.0
515,9.0,"Прочие услуги по организации культуры, спорта, туризма  и информационного пространства",55954034.8,70924053.7,71362639.0,51402384.2,67099320.8,47722046.614,52621175.488,4899128.873999998,92.84014225550261,66.87259227338832,2,False,True,False,8.0,417.0
516,263.0,Управление внутренней политики области,3924162.0,4405520.6,4182049.6,2899335.9,4068109.5,2820721.335,3283211.267,462489.93200000003,97.2885320048636,67.4482993936753,3,False,True,False,9.0,515.0
517,273.0,"Управление культуры, архивов и документации области",2138728.0,3549179.0,3549179.0,2397094.0,2757009.3,2022844.541,2192137.867,169293.32600000012,84.38736824671874,56.994717398023596,3,False,True,False,9.0,515.0
518,283.0,Управление по вопросам молодежной политики области,860976.0,1082107.0,1305578.0,731103.1,1098534.6,639536.715,863942.083,224405.36800000002,87.47558518080419,48.98494881194382,3,False,True,False,9.0,515.0
519,302.0,"Управление молодежной политики города республиканского значения, столицы",3073776.0,4666655.0,4666655.0,3489135.0,4643227.0,2303382.987,3034174.738,730791.7509999997,66.01587462222012,49.358330260111366,3,False,True,False,9.0,515.0
520,325.0,"Управление общественного развития города республиканского значения, столицы",787753.0,848074.0,848074.0,614997.0,814435.0,609908.574,769217.482,159308.90799999994,99.17260962248596,71.9169051285619,3,False,True,False,9.0,515.0
521,343.0,"Управление топливно-энергетического комплекса и коммунального хозяйства города республиканского значения, столицы",0.0,2000.0,2000.0,2000.0,2000.0,0.0,2000.0,2000.0,0.0,0.0,3,False,True,False,9.0,515.0
522,361.0,"Управление культуры города республиканского значения, столицы",2302125.0,4852621.0,4852621.0,3779207.0,4324724.0,3141490.63,3242716.015,101225.38500000024,83.12565652000539,64.73801745489706,3,False,True,False,9.0,515.0
523,362.0,"Управление внутренней политики города республиканского значения, столицы",613117.0,725794.0,725794.0,489481.0,698811.0,480752.228,614514.199,133761.97100000002,98.21672914781166,66.23810998713134,3,False,True,False,9.0,515.0
524,377.0,"Управление по вопросам молодежной политики города республиканского значения, столицы",961103.0,1316786.0,1316786.0,1108508.0,1253081.0,1039953.114,1166926.164,126973.05000000016,93.81557138063053,78.9766229288586,3,False,True,False,9.0,515.0
525,455.0,Отдел культуры и развития языков района (города областного значения),4155981.0,4505263.5,4727713.5,3091986.8,4602229.3,3083550.712,3287882.393,204331.68100000033,99.72716287145857,65.22287596319025,3,False,True,False,9.0,515.0
526,456.0,Отдел внутренней политики района (города областного значения),11805934.9,12962336.7,13098396.7,9710574.1,12383490.7,9680978.925,10521323.169,840344.243999999,99.6952273398542,73.90964823198554,3,False,True,False,9.0,515.0
527,457.0,"Отдел культуры, развития языков, физической культуры и спорта района (города областного значения)",7017742.9,7228052.7,7452714.1,5530121.9,7062440.0,5438618.119,5717002.951,278384.8320000004,98.34535688987252,72.97500006071613,3,False,True,False,9.0,515.0
528,470.0,Отдел внутренней политики и развития языков района (города областного значения),917390.0,1022703.2,1022703.2,835704.0,934095.0,834837.578,859897.61,25060.032000000007,99.89632429664091,81.63048458242822,3,False,True,False,9.0,515.0
529,478.0,"Отдел внутренней политики, культуры и развития языков района (города областного значения)",1400850.0,1882933.2,1823523.2,1486534.8,1792164.7,1420725.548,1459901.74,39176.19200000004,95.57297602451015,77.91102125818854,3,False,True,False,9.0,515.0
530,747.0,Управление информации и общественного развития области,540630.0,521360.0,521360.0,403875.0,468519.0,402837.173,466594.236,63757.062999999966,99.74303262147941,77.26660522479669,3,False,True,False,9.0,515.0
531,748.0,"Управление культуры, развития языков и архивного дела  области",2550265.0,2671499.0,2574427.0,2024742.9,2292834.2,1512354.066,1543808.919,31454.852999999886,74.69363473258754,58.74526898606952,3,False,True,False,9.0,515.0
532,752.0,Управление общественного развития области,5738599.0,6052773.6,6068105.6,4525007.2,5892453.2,4111209.58,4853989.539,742779.9589999998,90.8553157661274,67.75112120659206,3,False,True,False,9.0,515.0
533,760.0,Управление культуры и спорта области,1131770.0,2265840.7,2395047.6,881486.8,2262435.2,842919.056,932024.319,89105.26300000004,95.62469409638351,35.19425066959003,3,False,True,False,9.0,515.0
534,766.0,Управление культуры и туризма области,0.0,1508578.0,1508578.0,1267480.0,1471055.0,1264771.688,1361774.184,97002.49599999981,99.78632309780036,83.83866714216965,3,False,True,False,9.0,515.0
535,802.0,"Отдел культуры, физической культуры и спорта района (города областного значения)",647846.0,779901.6,779901.6,586567.4,682330.8,583629.507,606415.259,22785.75199999998,99.49913803596995,74.83373633289122,3,False,True,False,9.0,515.0
536,803.0,Отдел внутренней политики и по делам религии района (города областного значения),38458.0,54595.7,54595.7,45456.2,54595.7,45455.318,48084.102,2628.7839999999997,99.998059670628,83.25805512155719,3,False,True,False,9.0,515.0
537,804.0,"Отдел физической культуры, спорта и туризма района (города областного значения",132481.0,133459.4,134779.4,108275.1,110390.0,108268.586,109285.481,1016.8950000000041,99.9939838430073,80.3302181193862,3,False,True,False,9.0,515.0
538,819.0,"Отдел внутренней политики, культуры, развития языков и спорта района (города областного значения)",5214347.0,5912367.5,5778404.5,3909493.8,5642489.6,3854463.625,4116905.086,262441.4610000001,98.59239641203678,66.7046349039774,3,False,True,False,9.0,515.0
539,820.0,Отдел культуры и спорта района (города областного значения),0.0,963540.7,963540.7,708887.5,872839.0,707082.497,721430.0,14347.503000000026,99.74537525347816,73.38377060771796,3,False,True,False,9.0,515.0
540,821.0,Отдел общественного развития района (города областного значения),0.0,1010111.6,1010111.6,775329.7,915028.0,771754.512,846016.685,74262.17300000007,99.53888158805215,76.4028956800417,3,False,True,False,9.0,515.0
