id,code,name,utv,utch,plg,plgp,plgo,sumrg,obz,obzsumrg,plgpsumrg,plgsumrg,level,isLeaf,loaded,expanded,parentCode,parent_id
1,1.0,I. ДОХОДЫ,13330085469.0,14471020282.8,14757089648.8,11800569655.4,0.0,12078931784.452,0.0,0.0,102.35888721630164,81.85172057577235,0,False,True,False,,
6,1.0,НАЛОГОВЫЕ ПОСТУПЛЕНИЯ,5945667779.0,6805140676.6,6849666773.5,5419068468.6,0.0,5903657236.157,0.0,0.0,108.94228907357193,86.18896993642197,1,False,True,False,1.0,1.0
7,1.0,Налоговые поступления,5945667779.0,6805140676.6,6849666773.5,5419068468.6,0.0,5903657236.157,0.0,0.0,108.94228907357193,86.18896993642197,2,False,True,False,1.0,6.0
8,1.0,Подоходный налог,3061110392.0,3639812970.1,3637880229.7,2912161044.0,0.0,3202397842.986,0.0,0.0,109.96637186614326,88.02922693389738,3,False,True,False,1.0,7.0
9,1.0,Корпоративный подоходный налог,1161215341.0,1408844223.2,1407946387.2,1121671364.1,0.0,1182682749.45,0.0,0.0,105.43932806905114,84.0005528763077,4,False,True,False,1.0,8.0
10,2.0,Индивидуальный подоходный налог,1899895051.0,2230968746.9,2229933842.5,1790489679.9,0.0,2019715093.536,0.0,0.0,112.80238675538203,90.57287059564413,4,False,True,False,1.0,8.0
11,3.0,Социальный налог,1299172830.0,1481076988.4,1481076988.4,1198600501.8,0.0,1295024930.195,0.0,0.0,108.04475121195047,87.4380562481096,3,False,True,False,1.0,7.0
12,1.0,Социальный налог,1299172830.0,1481076988.4,1481076988.4,1198600501.8,0.0,1295024930.195,0.0,0.0,108.04475121195047,87.4380562481096,4,False,True,False,3.0,11.0
13,4.0,Hалоги на собственность,540637353.0,638296075.5,678112537.6,499068281.7,0.0,532248111.756,0.0,0.0,106.64835479886199,78.48964327362998,3,False,True,False,1.0,7.0
14,1.0,Hалоги на имущество,426895264.0,512880584.3,552692179.2,396622623.4,0.0,407510144.781,0.0,0.0,102.7450580825844,73.73184570312804,4,False,True,False,4.0,13.0
15,3.0,Земельный налог,16443038.0,16125729.5,16125946.4,11679737.6,0.0,13319173.108,0.0,0.0,114.03657825326485,82.59467554722865,4,False,True,False,4.0,13.0
16,4.0,Hалог на транспортные средства,96011942.0,107055444.7,107052093.1,89206054.8,0.0,108185798.922,0.0,0.0,121.2762958350222,101.05902256478161,4,False,True,False,4.0,13.0
17,5.0,Единый земельный налог,1287109.0,2234317.0,2242318.9,1559865.9,0.0,3232994.945,0.0,0.0,207.2610821866162,144.18087208737347,4,False,True,False,4.0,13.0
18,5.0,"Внутренние налоги на товары, работы и услуги",945959697.0,939301278.4,945923653.6,722744276.7,0.0,774225714.287,0.0,0.0,107.12305019170275,81.84864722860546,3,False,True,False,1.0,7.0
19,2.0,Акцизы,755671050.0,721665690.8,728265690.8,559701293.1,0.0,583655473.807,0.0,0.0,104.27981514466865,80.14320613756422,4,False,True,False,5.0,18.0
20,3.0,Поступления за использование природных и других ресурсов,137899905.0,150079507.2,150079535.4,110913641.0,0.0,114942328.419,0.0,0.0,103.63227406717269,76.58760943832186,4,False,True,False,5.0,18.0
21,4.0,Сборы за ведение предпринимательской и профессиональной деятельности,52388742.0,67556080.4,67578427.4,52129342.6,0.0,75627912.061,0.0,0.0,145.07743295615626,111.9113228447219,4,False,True,False,5.0,18.0
22,7.0,Прочие налоги,105983.0,256316.4,256316.4,142706.2,0.0,516951.529,0.0,0.0,362.2488224057539,201.68492105850424,3,False,True,False,1.0,7.0
23,1.0,Прочие налоги,105983.0,256316.4,256316.4,142706.2,0.0,516951.529,0.0,0.0,362.2488224057539,201.68492105850424,4,False,True,False,7.0,22.0
24,8.0,"Обязательные платежи, взимаемые за совершение юридически значимых действий и (или) выдачу документов уполномоченными на то государственными органами или должностными лицами",98681524.0,106397047.8,106417047.8,86351658.2,0.0,99243685.404,0.0,0.0,114.92968111178668,93.25919808498954,3,False,True,False,1.0,7.0
25,1.0,Государственная пошлина,98681524.0,106397047.8,106417047.8,86351658.2,0.0,99243685.404,0.0,0.0,114.92968111178668,93.25919808498954,4,False,True,False,8.0,24.0
26,2.0,НЕНАЛОГОВЫЕ ПОСТУПЛЕНИЯ,75843474.0,362580981.9,362487109.1,292763066.0,0.0,353552999.524,0.0,0.0,120.76420853032054,97.53533040162944,1,False,True,False,1.0,1.0
27,2.0,Неналоговые поступления,75843474.0,362580981.9,362487109.1,292763066.0,0.0,353552999.524,0.0,0.0,120.76420853032054,97.53533040162944,2,False,True,False,2.0,26.0
28,1.0,Доходы от государственной собственности,13564808.0,18865817.4,18859765.6,15564858.5,0.0,21170003.664,0.0,0.0,136.0115394817113,112.24955873258573,3,False,True,False,2.0,27.0
29,1.0,Поступления части чистого дохода государственных предприятий,1247902.0,3544334.8,3544334.8,3173553.1,0.0,4732920.091,0.0,0.0,149.1363132067965,133.53479166245808,4,False,True,False,1.0,28.0
30,3.0,"Дивиденды на государственные пакеты акций, находящиеся в государственной собственности",2278043.0,2946797.9,2946797.9,2584434.4,0.0,2752568.513,0.0,0.0,106.50564444584083,93.40879851312503,4,False,True,False,1.0,28.0
31,4.0,"Доходы на доли участия в юридических лицах, находящиеся в государственной собственности",539494.0,734213.0,734213.0,360550.0,0.0,1056434.16,0.0,0.0,293.0062848426016,143.88660511323008,4,False,True,False,1.0,28.0
32,5.0,"Доходы от аренды  имущества, находящегося в государственной собственности",8708016.0,10258523.1,10252500.1,8477808.3,0.0,10360773.908,0.0,0.0,122.21052353825928,101.0560722452468,4,False,True,False,1.0,28.0
33,6.0,Вознаграждения за размещение бюджетных средств на банковских счетах,2000.0,394518.0,394518.0,359518.0,0.0,1064649.305,0.0,0.0,296.1324064441836,269.8607680764883,4,False,True,False,1.0,28.0
34,7.0,"Вознаграждения по кредитам, выданным из государственного бюджета",698252.0,790417.9,790389.1,441676.1,0.0,1008604.18,0.0,0.0,228.35833317673294,127.60856393389028,4,False,True,False,1.0,28.0
35,9.0,Прочие доходы от государственной собственности,91101.0,197012.7,197012.7,167318.6,0.0,194053.507,0.0,0.0,115.9784429226637,98.49796840508252,4,False,True,False,1.0,28.0
36,2.0,"Поступления от реализации товаров (работ, услуг) государственными учреждениями, финансируемыми из государственного бюджета",15262.0,39541.5,39541.5,29718.0,0.0,40955.658,0.0,0.0,137.81431455683426,103.57638936307426,3,False,True,False,2.0,27.0
37,1.0,"Поступления от реализации товаров (работ, услуг) государственными учреждениями, финансируемыми из государственного бюджета",15262.0,39541.5,39541.5,29718.0,0.0,40955.658,0.0,0.0,137.81431455683426,103.57638936307426,4,False,True,False,2.0,36.0
38,3.0,"Поступления денег от проведения государственных закупок, организуемых государственными учреждениями, финансируемыми из государственного бюджета",142946.0,268157.9,268157.9,183637.2,0.0,499071.062,0.0,0.0,271.7701326310791,186.11089287319146,3,False,True,False,2.0,27.0
39,1.0,"Поступления денег от проведения государственных закупок, организуемых государственными учреждениями, финансируемыми из государственного бюджета",142946.0,268157.9,268157.9,183637.2,0.0,499071.062,0.0,0.0,271.7701326310791,186.11089287319146,4,False,True,False,3.0,38.0
40,4.0,"Штрафы, пени, санкции, взыскания, налагаемые государственными учреждениями, финансируемыми из государственного бюджета, а также содержащимися и финансируемыми из бюджета (сметы расходов) Национального Банка Республики Казахстан",26919883.0,126885366.0,126885366.0,104937885.8,0.0,145363611.248,0.0,0.0,138.52347999944172,114.56294435719245,3,False,True,False,2.0,27.0
41,1.0,"Штрафы, пени, санкции, взыскания, налагаемые государственными учреждениями, финансируемыми из государственного бюджета, а также содержащимися и финансируемыми из бюджета (сметы расходов) Национального Банка Республики Казахстан, за исключением поступлений от организаций нефтяного сектора, в Фонд компенсации потерпевшим, Фонд поддержки инфраструктуры образования и Специальный государственный фонд",26919883.0,126885366.0,126885366.0,104937885.8,0.0,145363611.248,0.0,0.0,138.52347999944172,114.56294435719245,4,False,True,False,4.0,40.0
42,5.0,Гранты,0.0,0.0,0.0,0.0,0.0,36.664,0.0,0.0,0.0,0.0,3,False,True,False,2.0,27.0
43,1.0,Техническая помощь,0.0,0.0,0.0,0.0,0.0,30.0,0.0,0.0,0.0,0.0,4,False,True,False,5.0,42.0
44,2.0,Финансовая помощь,0.0,0.0,0.0,0.0,0.0,6.664,0.0,0.0,0.0,0.0,4,False,True,False,5.0,42.0
45,6.0,Прочие неналоговые поступления,35200575.0,216522099.1,216434278.1,172046966.5,0.0,186479321.228,0.0,0.0,108.38861330809921,86.1597907988679,3,False,True,False,2.0,27.0
46,1.0,Прочие неналоговые поступления,35200575.0,216522099.1,216434278.1,172046966.5,0.0,186479321.228,0.0,0.0,108.38861330809921,86.1597907988679,4,False,True,False,6.0,45.0
47,3.0,ПОСТУПЛЕНИЯ ОТ ПРОДАЖИ ОСНОВНОГО КАПИТАЛА,212660650.0,233110552.3,232939452.3,137762675.1,0.0,154109582.83,0.0,0.0,111.86599179939998,66.15864393444356,1,False,True,False,1.0,1.0
48,3.0,Поступления от продажи основного капитала,212660650.0,233110552.3,232939452.3,137762675.1,0.0,154109582.83,0.0,0.0,111.86599179939998,66.15864393444356,2,False,True,False,3.0,47.0
49,1.0,"Продажа государственного имущества, закрепленного за государственными учреждениями",181675681.0,183219391.9,183219722.9,103442064.0,0.0,108567857.477,0.0,0.0,104.9552312461592,59.255551617800194,3,False,True,False,3.0,48.0
50,1.0,"Продажа государственного имущества, закрепленного за государственными учреждениями",181675681.0,183219391.9,183219722.9,103442064.0,0.0,108567857.477,0.0,0.0,104.9552312461592,59.255551617800194,4,False,True,False,1.0,49.0
51,3.0,Продажа земли и нематериальных активов,30984969.0,49891160.4,49719729.4,34320611.1,0.0,45541725.353,0.0,0.0,132.69497218538746,91.59688900680139,3,False,True,False,3.0,48.0
52,1.0,Продажа земли,26343041.0,43194223.3,43022790.3,30212325.8,0.0,39298786.5,0.0,0.0,130.0753432891949,91.34411372662643,4,False,True,False,3.0,51.0
53,2.0,Продажа нематериальных активов,4641928.0,6696937.1,6696939.1,4108285.3,0.0,6242938.853,0.0,0.0,151.95972034853568,93.22077981864881,4,False,True,False,3.0,51.0
54,4.0,ПОСТУПЛЕНИЯ ТРАНСФЕРТОВ,7095913566.0,7070188072.0,7311996313.9,5950975445.7,0.0,5667611965.945,0.0,0.0,95.2383691994604,77.51114364172956,1,False,True,False,1.0,1.0
55,4.0,Поступления трансфертов,7095913566.0,7070188072.0,7311996313.9,5950975445.7,0.0,5667611965.945,0.0,0.0,95.2383691994604,77.51114364172956,2,False,True,False,4.0,54.0
56,2.0,Трансферты из вышестоящих органов государственного управления,7095913566.0,7070188072.0,7311996313.9,5950975445.7,0.0,5667611965.945,0.0,0.0,95.2383691994604,77.51114364172956,3,False,True,False,4.0,55.0
57,1.0,Трансферты из республиканского бюджета,7095913566.0,7070188072.0,7311996313.9,5950975445.7,0.0,5667611965.945,0.0,0.0,95.2383691994604,77.51114364172956,4,False,True,False,2.0,56.0
58,2.0,II. ЗАТРАТЫ,12974877962.0,15239216329.8,15478180694.3,11785964354.8,14927309905.0,11193338789.569,13349161560.015,2155822770.445999,94.97176855969666,72.31688924326271,0,False,True,False,,
63,1.0,Государственные услуги общего характера,393830080.8,492636170.0,628506369.7,499177374.3,602722371.5,473733074.894,527861182.996,54128108.102,94.9027538674643,75.37442701179357,1,False,True,False,2.0,58.0
64,1.0,"Представительные, исполнительные и другие органы, выполняющие общие функции государственного управления",257885407.9,306736631.0,347637199.9,275852346.8,329213948.2,271569027.943,288324507.365,16755479.421999991,98.44724219072695,78.11851781717219,2,False,True,False,1.0,63.0
65,110.0,Аппарат маслихата области,2983636.0,3175663.7,3175632.7,2531180.1,2989172.6,2503278.941,2629417.618,126138.67699999968,98.8977015503559,78.82772277159131,3,False,True,False,1.0,64.0
66,111.0,"Аппарат маслихата города республиканского значения, столицы",771891.0,981510.0,981510.0,818160.0,914309.0,743272.522,803899.776,60627.25399999996,90.84684193800724,75.7274528023148,3,False,True,False,1.0,64.0
67,112.0,Аппарат маслихата района (города областного значения),11053963.7,12299657.4,12308242.6,9999575.6,11512038.4,9953063.316,10226184.863,273121.54700000025,99.53485741934888,80.86502386620165,3,False,True,False,1.0,64.0
68,120.0,Аппарат акима области,49492910.0,58343050.2,57445189.3,42178333.8,52876504.0,41483228.166,45479879.368,3996651.2019999996,98.35198413172026,72.21358075670925,3,False,True,False,1.0,64.0
69,121.0,"Аппарат акима города республиканского значения, столицы",7276517.0,11435218.0,11435218.0,7890042.0,10663360.0,7376817.501,8481992.044,1105174.5429999996,93.49528812394155,64.50963594222691,3,False,True,False,1.0,64.0
70,122.0,Аппарат акима района (города областного значения),59120881.6,72676176.7,91040728.2,74072076.8,87575308.3,73208153.538,77150843.842,3942690.30399999,98.83367214836888,80.41253072709935,3,False,True,False,1.0,64.0
71,123.0,"Аппарат акима района в городе, города районного значения, поселка, села, сельского округа",9288997.0,12159236.3,29285899.5,24644721.3,28560378.5,24017954.916,26836002.098,2818047.182,97.4567925667717,82.01201030550556,3,False,True,False,1.0,64.0
72,124.0,"Аппарат акима города районного значения, села, поселка, сельского округа",105646717.6,122385275.5,128684306.4,103441419.3,121803561.0,102170700.289,106149215.429,3978515.1400000006,98.77155686803304,79.39639505956104,3,False,True,False,1.0,64.0
73,263.0,Управление внутренней политики области,1818479.0,2142133.2,2142133.2,1702355.7,2058527.6,1659048.135,1738056.216,79008.081,97.4560213826053,77.44841147133147,3,False,True,False,1.0,64.0
74,282.0,Ревизионная комиссия области,6450666.0,6969475.8,6969435.8,5487442.2,6468149.6,5439002.142,5588930.662,149928.51999999955,99.11725615989175,78.04078117772461,3,False,True,False,1.0,64.0
75,305.0,"Управление внутренней политики и по делам молодежи города республиканского значения, столицы",141769.0,162058.0,162058.0,119945.0,162058.0,119942.2,124808.622,4866.422000000006,99.99766559673184,74.01189697515704,3,False,True,False,1.0,64.0
76,325.0,"Управление общественного развития города республиканского значения, столицы",168818.0,195811.0,195811.0,130275.0,184882.0,130077.593,147342.22,17264.627000000008,99.84846900786796,66.43017654779354,3,False,True,False,1.0,64.0
77,362.0,"Управление внутренней политики города республиканского значения, столицы",287602.0,316673.0,316512.0,256797.0,279407.0,245464.272,259474.776,14010.504000000015,95.58689237023796,77.55291173794359,3,False,True,False,1.0,64.0
78,379.0,"Ревизионная комиссия города републиканского значения, столицы",1378373.0,1636923.0,1636923.0,1225018.0,1506845.0,1168130.739,1274031.247,105900.50799999991,95.35621019446245,71.36137368709463,3,False,True,False,1.0,64.0
79,747.0,Управление информации и общественного развития области,298206.0,544873.0,544873.0,383028.0,480957.0,383019.958,397592.03,14572.072000000044,99.9979004145911,70.2952721092805,3,False,True,False,1.0,64.0
80,752.0,Управление общественного развития области,1705981.0,1312896.2,1312727.2,971977.0,1178490.2,967873.715,1036836.554,68962.83900000004,99.57784134809773,73.72999622465353,3,False,True,False,1.0,64.0
81,2.0,Финансовая деятельность,46691668.0,55127505.1,55660087.7,38130283.3,53234585.1,37972602.024,42091809.919,4119207.8950000033,99.58646707458372,68.22231798962831,2,False,True,False,1.0,63.0
82,124.0,"Аппарат акима города районного значения, села, поселка, сельского округа",347157.0,426397.9,426437.9,268277.7,399306.3,266714.403,333962.9,67248.49700000003,99.41728403068909,62.54472292448677,3,False,True,False,2.0,81.0
83,257.0,Управление финансов области,4539315.0,6166669.6,6166642.6,4192495.1,5985306.6,4175556.49,4347632.527,172076.03699999955,99.59597782237122,67.71199112463565,3,False,True,False,2.0,81.0
84,299.0,Управление экономики и финансов области,1717.0,1717.0,1717.0,650.0,1333.0,650.0,1333.0,683.0,100.0,37.8567268491555,3,False,True,False,2.0,81.0
85,318.0,"Управление государственных активов города республиканского значения, столицы",6809315.0,7271867.0,7271867.0,3099233.0,7239324.0,3097864.834,3180791.038,82926.20400000038,99.95585469049922,42.60068059550594,3,False,True,False,2.0,81.0
86,332.0,"Управление активов и государственных закупок города республиканского значения, столицы
",21646993.0,19769637.0,19769637.0,16287853.0,18470025.0,16259901.426,17610446.375,1350544.948999999,99.82839006466968,82.24683855348482,3,False,True,False,2.0,81.0
87,356.0,"Управление финансов города республиканского значения, столицы",1155546.0,3067420.0,3067420.0,966739.0,2967277.0,942213.428,2721858.679,1779645.2510000002,97.46306169503868,30.71680526305494,3,False,True,False,2.0,81.0
88,366.0,"Управление государственного архитектурно-строительного контроля города республиканского значения, столицы",151614.0,174280.0,174280.0,108183.0,174280.0,108141.248,115947.553,7806.304999999993,99.96140613589937,62.05029148496672,3,False,True,False,2.0,81.0
89,452.0,Отдел финансов района (города областного значения),4380996.0,5185983.3,5344678.2,3470983.2,5121050.3,3458528.062,3822278.25,363750.1880000001,99.64116397912845,64.70975300252876,3,False,True,False,2.0,81.0
90,459.0,Отдел экономики и финансов района (города областного значения),1493979.0,1972537.1,1967153.9,1664578.0,1954446.9,1655220.497,1731296.334,76075.83700000006,99.43784532776475,84.14290803581764,3,False,True,False,2.0,81.0
91,489.0,Отдел государственных активов и закупок района (города областного значения),2930773.0,6587094.2,6626440.2,3870515.5,6380821.2,3848842.387,3993719.883,144877.4959999998,99.44004582852077,58.08310753336309,3,False,True,False,2.0,81.0
92,718.0,Управление государственных закупок области,1735786.0,1794998.6,1794998.6,1476511.8,1668176.5,1447206.575,1478313.919,31107.34400000004,98.01523936347816,80.62438460954789,3,False,True,False,2.0,81.0
93,727.0,Управление экономики области,3331.0,3331.0,3331.0,2366.0,3331.0,700.0,887.0,187.0,29.585798816568047,21.014710297208044,3,False,True,False,2.0,81.0
94,733.0,Управление по государственным закупкам и коммунальной собственности области,1046221.0,2219241.9,2557153.8,2325335.7,2429787.8,2314644.859,2344932.729,30287.869999999646,99.54024526437195,90.5164507117249,3,False,True,False,2.0,81.0
95,751.0,Управление финансов и государственных активов области,280533.0,293156.0,293156.0,229150.8,249412.8,229052.734,238667.638,9614.90400000001,99.95720460063853,78.13339450667904,3,False,True,False,2.0,81.0
96,805.0,Отдел государственных закупок района (города областного значения),168392.0,193174.5,195174.5,167411.5,190706.7,167365.081,169742.094,2377.0130000000063,99.97227251413435,85.75151005894726,3,False,True,False,2.0,81.0
97,5.0,Планирование и статистическая деятельность,11030132.0,12363274.0,12343371.0,9203765.3,11125925.8,8829964.186,9671210.862,841246.675999999,95.9386066265727,71.53608350587535,2,False,True,False,1.0,63.0
98,257.0,Управление финансов области,9847.0,9847.0,9847.0,1826.0,2991.0,1826.0,1826.0,0.0,100.0,18.543718899157106,3,False,True,False,5.0,97.0
99,258.0,Управление экономики и бюджетного планирования области,4223172.0,4840057.3,4840057.3,3439353.3,4245429.3,3429599.948,3515706.383,86106.43500000006,99.71641901400476,70.85866417325266,3,False,True,False,5.0,97.0
100,299.0,Управление экономики и финансов области,998308.0,1081229.0,1081229.0,861532.0,872679.0,818736.068,829480.281,10744.212999999989,95.03257778004763,75.72272552807962,3,False,True,False,5.0,97.0
101,357.0,"Управление экономики и бюджетного планирования города республиканского значения, столицы",912497.0,1238107.0,1238107.0,879211.0,1072315.0,836411.047,862345.136,25934.089000000036,95.13200437665134,67.55563509454353,3,False,True,False,5.0,97.0
102,453.0,Отдел экономики и бюджетного планирования района (города областного значения),2485624.0,2731944.2,2732053.2,2203014.1,2523297.0,2200339.014,2259615.505,59276.49099999992,99.87857154432193,80.53792707989726,3,False,True,False,5.0,97.0
103,459.0,Отдел экономики и финансов района (города областного значения),2862.0,3357.0,3357.0,647.0,3357.0,647.0,1797.0,1150.0,100.0,19.27316056002383,3,False,True,False,5.0,97.0
104,510.0,"Управление экономики города республиканского значения, столицы",1617966.0,1607082.0,1607082.0,1177207.0,1590493.0,914876.921,1555761.056,640884.1350000001,77.71589202238859,56.92783075163557,3,False,True,False,5.0,97.0
105,727.0,Управление экономики области,654251.0,722803.5,702791.5,530755.9,702791.5,521265.606,536677.569,15411.962999999989,98.21192868510741,74.17073285604621,3,False,True,False,5.0,97.0
106,750.0,Управление стратегии и экономического развития области,125605.0,128847.0,128847.0,110219.0,112573.0,106262.582,108001.932,1739.3500000000058,96.4104029250855,82.47191009491878,3,False,True,False,5.0,97.0
107,9.0,Прочие государственные услуги общего характера,78222872.9,118408759.9,212865711.1,175990978.9,209147912.4,155361480.741,187773654.85,32412174.108999997,88.27809340686609,72.98567718499966,2,False,True,False,1.0,63.0
108,265.0,Управление предпринимательства и промышленности области,1531290.0,1574804.2,5970864.2,5442101.9,5736270.2,4143174.857,4201948.962,58774.10500000045,76.1318867807308,69.38986917505174,3,False,True,False,9.0,107.0
