id,code,name,utv,utch,plg,plgp,plgo,sumrg,obz,obzsumrg,plgpsumrg,plgsumrg,level,isLeaf,loaded,expanded,parentCode,parent_id
1,1.0,I. ДОХОДЫ,11336443609.0,12434161705.2,12559029229.6,4618034386.4,0.0,5207917990.664,0.0,0.0,112.77347795419612,41.46752026334657,0,False,True,False,,
6,1.0,НАЛОГОВЫЕ ПОСТУПЛЕНИЯ,4936683052.7,5242388366.3,5242268439.5,1968680454.7,0.0,2516374455.156,0.0,0.0,127.82036054395944,48.00163296094025,1,False,True,False,1.0,1.0
7,1.0,Налоговые поступления,4936683052.7,5242388366.3,5242268439.5,1968680454.7,0.0,2516374455.156,0.0,0.0,127.82036054395944,48.00163296094025,2,False,True,False,1.0,6.0
8,1.0,Подоходный налог,2442004101.2,2652610879.2,2652490878.2,1013667219.1,0.0,1378192732.341,0.0,0.0,135.96106358896066,51.95843437833996,3,False,True,False,1.0,7.0
9,1.0,Корпоративный подоходный налог,860433764.0,946005543.1,946005543.1,408996713.6,0.0,577568420.445,0.0,0.0,141.21590742410308,61.05338648992955,4,False,True,False,1.0,8.0
10,2.0,Индивидуальный подоходный налог,1581570337.2,1706605336.1,1706485335.1,604670505.5,0.0,800624311.896,0.0,0.0,132.4067082177204,46.916565611686515,4,False,True,False,1.0,8.0
11,3.0,Социальный налог,1105115706.7,1156729730.2,1156729144.2,406941774.9,0.0,486448254.069,0.0,0.0,119.5375564940556,42.053773479134584,3,False,True,False,1.0,7.0
12,1.0,Социальный налог,1105115706.7,1156729730.2,1156729144.2,406941774.9,0.0,486448254.069,0.0,0.0,119.5375564940556,42.053773479134584,4,False,True,False,3.0,11.0
13,4.0,Hалоги на собственность,484042870.9,490102070.2,490102730.4,202439968.0,0.0,243125670.058,0.0,0.0,120.09766275896665,49.60708336792404,3,False,True,False,1.0,7.0
14,1.0,Hалоги на имущество,379016099.8,384214035.6,384214082.6,145160951.3,0.0,170122060.954,0.0,0.0,117.19547125480983,44.2779347916593,4,False,True,False,4.0,13.0
15,3.0,Земельный налог,16719974.2,16747812.6,16747810.6,7540424.7,0.0,8065547.374,0.0,0.0,106.96409943593761,48.15881649628878,4,False,True,False,4.0,13.0
16,4.0,Hалог на транспортные средства,87704866.1,88599269.0,88599884.2,49682578.4,0.0,64830370.07,0.0,0.0,130.48914158207216,73.17207088403846,4,False,True,False,4.0,13.0
17,5.0,Единый земельный налог,601930.8,540953.0,540953.0,56013.6,0.0,107691.66,0.0,0.0,192.25984403787652,19.90776647878836,4,False,True,False,4.0,13.0
18,5.0,"Внутренние налоги на товары, работы и услуги",860971549.4,889792967.1,889792967.1,325538039.1,0.0,373514375.64,0.0,0.0,114.73755161536204,41.977672273287624,3,False,True,False,1.0,7.0
19,2.0,Акцизы,701769042.5,709699172.5,709699172.5,246599591.3,0.0,256270950.073,0.0,0.0,103.92188759195238,36.10979975786854,4,False,True,False,5.0,18.0
20,3.0,Поступления за использование природных и других ресурсов,124512693.3,128293501.4,128293501.4,52646678.9,0.0,68266131.601,0.0,0.0,129.66844828078985,53.21090379173329,4,False,True,False,5.0,18.0
21,4.0,Сборы за ведение предпринимательской и профессиональной деятельности,34689813.6,51800293.2,51800293.2,26291768.9,0.0,48977293.966,0.0,0.0,186.28375349062193,94.55022537594438,4,False,True,False,5.0,18.0
22,7.0,Прочие налоги,99189.0,100283.0,100283.0,45114.0,0.0,69881.535,0.0,0.0,154.8998869530523,69.68432835076733,3,False,True,False,1.0,7.0
23,1.0,Прочие налоги,99189.0,100283.0,100283.0,45114.0,0.0,69881.535,0.0,0.0,154.8998869530523,69.68432835076733,4,False,True,False,7.0,22.0
24,8.0,"Обязательные платежи, взимаемые за совершение юридически значимых действий и (или) выдачу документов уполномоченными на то государственными органами или должностными лицами",44449635.5,53052436.6,53052436.6,20048339.6,0.0,35023541.513,0.0,0.0,174.69547210283685,66.01683873083408,3,False,True,False,1.0,7.0
25,1.0,Государственная пошлина,44449635.5,53052436.6,53052436.6,20048339.6,0.0,35023541.513,0.0,0.0,174.69547210283685,66.01683873083408,4,False,True,False,8.0,24.0
26,2.0,НЕНАЛОГОВЫЕ ПОСТУПЛЕНИЯ,60344648.3,98636462.4,98651710.3,33023135.4,0.0,62377237.492,0.0,0.0,188.8895065124555,63.22975780380363,1,False,True,False,1.0,1.0
27,2.0,Неналоговые поступления,60344648.3,98636462.4,98651710.3,33023135.4,0.0,62377237.492,0.0,0.0,188.8895065124555,63.22975780380363,2,False,True,False,2.0,26.0
28,1.0,Доходы от государственной собственности,11713800.3,18694181.8,18709423.7,4589710.5,0.0,6399838.415,0.0,0.0,139.43882549890674,34.20649677734328,3,False,True,False,2.0,27.0
29,1.0,Поступления части чистого дохода государственных предприятий,2144820.0,2554393.1,2554393.1,1115717.4,0.0,1552190.235,0.0,0.0,139.12037537462444,60.76551941046192,4,False,True,False,1.0,28.0
30,3.0,"Дивиденды на государственные пакеты акций, находящиеся в государственной собственности",91548.0,284305.0,284305.0,5421.0,0.0,92761.53,0.0,0.0,1711.151632540122,32.62747049823253,4,False,True,False,1.0,28.0
31,4.0,"Доходы на доли участия в юридических лицах, находящиеся в государственной собственности",774994.0,788757.0,788757.0,80189.0,0.0,127575.521,0.0,0.0,159.09354275524072,16.17424897655425,4,False,True,False,1.0,28.0
32,5.0,"Доходы от аренды  имущества, находящегося в государственной собственности",7449651.3,7808613.4,7808600.3,3165457.3,0.0,4403763.619,0.0,0.0,139.119349959325,56.39632520312251,4,False,True,False,1.0,28.0
33,6.0,Вознаграждения за размещение бюджетных средств на банковских счетах,2000.0,2000.0,2000.0,1560.5,0.0,99791.667,0.0,0.0,6394.852098686319,4989.58335,4,False,True,False,1.0,28.0
34,7.0,"Вознаграждения по кредитам, выданным из государственного бюджета",1126818.0,7132438.3,7147693.3,195954.8,0.0,89149.273,0.0,0.0,45.49481462051453,1.247245359562364,4,False,True,False,1.0,28.0
35,9.0,Прочие доходы от государственной собственности,123969.0,123675.0,123675.0,25410.5,0.0,34606.57,0.0,0.0,136.19003955057948,27.981863755811602,4,False,True,False,1.0,28.0
36,2.0,"Поступления от реализации товаров (работ, услуг) государственными учреждениями, финансируемыми из государственного бюджета",19613.0,19708.0,19708.0,3384.2,0.0,11831.153,0.0,0.0,349.5996985993736,60.0322356403491,3,False,True,False,2.0,27.0
37,1.0,"Поступления от реализации товаров (работ, услуг) государственными учреждениями, финансируемыми из государственного бюджета",19613.0,19708.0,19708.0,3384.2,0.0,11831.153,0.0,0.0,349.5996985993736,60.0322356403491,4,False,True,False,2.0,36.0
38,3.0,"Поступления денег от проведения государственных закупок, организуемых государственными учреждениями, финансируемыми из государственного бюджета",76881.0,86685.0,86685.0,27793.6,0.0,176825.955,0.0,0.0,636.2110521846755,203.98679702370652,3,False,True,False,2.0,27.0
39,1.0,"Поступления денег от проведения государственных закупок, организуемых государственными учреждениями, финансируемыми из государственного бюджета",76881.0,86685.0,86685.0,27793.6,0.0,176825.955,0.0,0.0,636.2110521846755,203.98679702370652,4,False,True,False,3.0,38.0
40,4.0,"Штрафы, пени, санкции, взыскания, налагаемые государственными учреждениями, финансируемыми из государственного бюджета, а также содержащимися и финансируемыми из бюджета (сметы расходов) Национального Банка Республики Казахстан",14144356.0,38028323.3,38028323.3,16928059.6,0.0,36961114.644,0.0,0.0,218.34229981090095,97.19364788297149,3,False,True,False,2.0,27.0
41,1.0,"Штрафы, пени, санкции, взыскания, налагаемые государственными учреждениями, финансируемыми из государственного бюджета, а также содержащимися и финансируемыми из бюджета (сметы расходов) Национального Банка Республики Казахстан, за исключением поступлений от организаций нефтяного сектора, в Фонд компенсации потерпевшим и  Фонд поддержки инфраструктуры образования",14144356.0,38028323.3,38028323.3,16928059.6,0.0,36961114.644,0.0,0.0,218.34229981090095,97.19364788297149,4,False,True,False,4.0,40.0
42,6.0,Прочие неналоговые поступления,34389998.0,41807564.3,41807570.3,11474187.5,0.0,18827627.325,0.0,0.0,164.08680200667803,45.03401462916394,3,False,True,False,2.0,27.0
43,1.0,Прочие неналоговые поступления,34389998.0,41807564.3,41807570.3,11474187.5,0.0,18827627.325,0.0,0.0,164.08680200667803,45.03401462916394,4,False,True,False,6.0,42.0
44,3.0,ПОСТУПЛЕНИЯ ОТ ПРОДАЖИ ОСНОВНОГО КАПИТАЛА,178188205.0,214880665.5,214880665.5,40681158.1,0.0,53533750.889,0.0,0.0,131.59347813404554,24.913246971026343,1,False,True,False,1.0,1.0
45,3.0,Поступления от продажи основного капитала,178188205.0,214880665.5,214880665.5,40681158.1,0.0,53533750.889,0.0,0.0,131.59347813404554,24.913246971026343,2,False,True,False,3.0,44.0
46,1.0,"Продажа государственного имущества, закрепленного за государственными учреждениями",149695017.0,185760508.3,185760508.3,32227734.4,0.0,40937967.357,0.0,0.0,127.02713398618553,22.038035819155862,3,False,True,False,3.0,45.0
47,1.0,"Продажа государственного имущества, закрепленного за государственными учреждениями",149695017.0,185760508.3,185760508.3,32227734.4,0.0,40937967.357,0.0,0.0,127.02713398618553,22.038035819155862,4,False,True,False,1.0,46.0
48,3.0,Продажа земли и нематериальных активов,28493188.0,29120157.2,29120157.2,8453423.7,0.0,12595783.532,0.0,0.0,149.00215556449632,43.25451763701331,3,False,True,False,3.0,45.0
49,1.0,Продажа земли,24916087.0,25322652.7,25322652.7,7168121.5,0.0,10265471.726,0.0,0.0,143.21006871884077,40.5386901902264,4,False,True,False,3.0,48.0
50,2.0,Продажа нематериальных активов,3577101.0,3797504.5,3797504.5,1285302.2,0.0,2330311.806,0.0,0.0,181.30458393364611,61.36429347219996,4,False,True,False,3.0,48.0
51,4.0,ПОСТУПЛЕНИЯ ТРАНСФЕРТОВ,6161227703.0,6878256211.0,7003228414.3,2575649638.2,0.0,2575632547.127,0.0,0.0,99.99933643641796,36.77778868197096,1,False,True,False,1.0,1.0
52,4.0,Поступления трансфертов,6161227703.0,6878256211.0,7003228414.3,2575649638.2,0.0,2575632547.127,0.0,0.0,99.99933643641796,36.77778868197096,2,False,True,False,4.0,51.0
53,2.0,Трансферты из вышестоящих органов государственного управления,6161227703.0,6878256211.0,7003228414.3,2575649638.2,0.0,2575632547.127,0.0,0.0,99.99933643641796,36.77778868197096,3,False,True,False,4.0,52.0
54,1.0,Трансферты из республиканского бюджета,6161227703.0,6878256211.0,7003228414.3,2575649638.2,0.0,2575632547.127,0.0,0.0,99.99933643641796,36.77778868197096,4,False,True,False,2.0,53.0
55,2.0,II. ЗАТРАТЫ,11062865384.0,12498253708.2,12662489483.1,4253465854.5,10753704930.2,4206275886.891,6953634813.814,2747358926.9230003,98.89055256999242,33.218395896832995,0,False,True,False,,
60,1.0,Государственные услуги общего характера,330733637.2,379449040.3,408448849.8,155746011.8,332342878.3,153827181.93,204144800.894,50317618.96399999,98.76797495626145,37.66130863272662,1,False,True,False,2.0,55.0
61,1.0,"Представительные, исполнительные и другие органы, выполняющие общие функции государственного управления",230640928.9,258531883.7,266680314.0,104213643.6,212313953.2,103022213.077,129049504.924,26027291.846999988,98.8567422826391,38.63135284781463,2,False,True,False,1.0,60.0
62,110.0,Аппарат маслихата области,2752587.0,2713649.4,2713649.4,953192.2,2021813.6,922918.65,1054663.222,131744.57200000004,96.8239826133701,34.01023912669043,3,False,True,False,1.0,61.0
63,111.0,"Аппарат маслихата города республиканского значения, столицы",770949.0,851825.0,851825.0,279688.0,567191.0,276456.781,393327.044,116870.26299999998,98.84470588655931,32.45464514424911,3,False,True,False,1.0,61.0
64,112.0,Аппарат маслихата района (города областного значения),9944257.4,10301879.9,10304821.9,4309178.4,7727895.5,4298029.294,4685547.651,387518.35699999984,99.74127072576061,41.708913901753114,3,False,True,False,1.0,61.0
65,120.0,Аппарат акима области,41847651.0,49218192.7,49221292.6,16373135.9,40929198.7,16087853.93,23456758.883,7368904.953000002,98.25762168137871,32.68474491464289,3,False,True,False,1.0,61.0
66,121.0,"Аппарат акима города республиканского значения, столицы",6667436.0,7577966.0,7609478.0,2857778.0,5864843.0,2674464.06,3798885.519,1124421.4589999998,93.5854380571199,35.14648521225766,3,False,True,False,1.0,61.0
67,122.0,Аппарат акима района (города областного значения),53632724.2,59099343.7,63531662.8,24296384.3,52412992.7,24227275.334,30506734.05,6279458.716000002,99.7155586397273,38.13417478190103,3,False,True,False,1.0,61.0
68,123.0,"Аппарат акима района в городе, города районного значения, поселка, села, сельского округа",8081097.0,15229361.4,17950904.9,6165134.8,14818940.9,5998565.912,12220212.575,6221646.663,97.29821174388596,33.41650989416138,3,False,True,False,1.0,61.0
69,124.0,"Аппарат акима города районного значения, села, поселка, сельского округа",96259869.3,101998185.4,102955199.2,44490063.1,79364855.8,44228659.555,48009865.633,3781206.0780000016,99.41244510170182,42.95913164043492,3,False,True,False,1.0,61.0
70,263.0,Управление внутренней политики области,1375630.0,1522850.6,1522850.6,507685.5,1335941.6,469906.51,571434.548,101528.03799999994,92.55858400525523,30.857032856670248,3,False,True,False,1.0,61.0
71,282.0,Ревизионная комиссия области,6095509.0,6383254.6,6383254.6,2694547.5,4962944.4,2615665.25,2811257.518,195592.26800000016,97.07252330864459,40.97698453074393,3,False,True,False,1.0,61.0
72,305.0,"Управление внутренней политики и по делам молодежи города республиканского значения, столицы",103109.0,111380.0,111380.0,44089.0,65443.0,44088.204,49946.411,5858.207000000002,99.99819456100161,39.58359130903214,3,False,True,False,1.0,61.0
73,325.0,"Управление общественного развития города республиканского значения, столицы",165123.0,165123.0,165123.0,34151.0,125742.0,33939.583,67115.083,33175.5,99.38093467248396,20.554122078692853,3,False,True,False,1.0,61.0
74,362.0,"Управление внутренней политики города республиканского значения, столицы",242245.0,250545.0,250545.0,105792.0,153426.0,91788.51,135351.412,43562.90200000002,86.7631862522686,36.63553852601329,3,False,True,False,1.0,61.0
75,379.0,"Ревизионная комиссия города републиканского значения, столицы",1234832.0,1503678.0,1503678.0,591191.0,877094.0,545363.547,695108.914,149745.36699999997,92.24828304219787,36.26863909693432,3,False,True,False,1.0,61.0
76,747.0,Управление информации и общественного развития области,219772.0,224053.0,224053.0,79583.0,86189.0,79582.658,80437.258,854.6000000000058,99.99957025998015,35.51956813789594,3,False,True,False,1.0,61.0
77,752.0,Управление общественного развития области,1248138.0,1380596.0,1380596.0,432049.9,999442.0,427655.299,512859.203,85203.90399999998,98.98284874038855,30.97613632083535,3,False,True,False,1.0,61.0
78,2.0,Финансовая деятельность,23825658.0,28790484.7,28667263.5,9348268.4,21752008.7,9212270.287,11671581.5,2459311.2129999995,98.54520530240659,32.13515753605154,2,False,True,False,1.0,60.0
79,124.0,"Аппарат акима города районного значения, села, поселка, сельского округа",280447.0,525343.0,525343.0,136224.3,469669.3,119657.575,199293.437,79635.86200000001,87.83864185758343,22.777038049426753,3,False,True,False,2.0,78.0
80,257.0,Управление финансов области,4703454.0,5647952.4,5647952.4,1920195.1,4345728.5,1875822.051,2424790.931,548968.8799999999,97.68913851514358,33.21242670175478,3,False,True,False,2.0,78.0
81,299.0,Управление экономики и финансов области,1717.0,1717.0,1717.0,548.0,548.0,35.0,500.0,465.0,6.386861313868613,2.03843913803145,3,False,True,False,2.0,78.0
82,318.0,"Управление государственных активов города республиканского значения, столицы",1809198.0,3192679.0,3192679.0,217146.0,3070251.0,216757.603,318580.801,101823.19799999997,99.82113554935388,6.78920752759673,3,False,True,False,2.0,78.0
83,332.0,"Управление активов и государственных закупок города республиканского значения, столицы
",4465012.0,5707642.0,5707642.0,1921765.0,3390130.0,1887952.942,2603018.912,715065.97,98.24057270269778,33.07763419639844,3,False,True,False,2.0,78.0
84,356.0,"Управление финансов города республиканского значения, столицы",1008967.0,1100699.0,1100699.0,362132.0,621601.0,345434.992,571045.902,225610.90999999997,95.38924811947027,31.38323846937265,3,False,True,False,2.0,78.0
85,366.0,"Управление государственного архитектурно-строительного контроля города республиканского значения, столицы",104162.0,104162.0,104162.0,36923.0,40214.0,36900.221,36900.221,0.0,99.93830674647238,35.42579923580576,3,False,True,False,2.0,78.0
86,452.0,Отдел финансов района (города областного значения),5442137.0,5164794.3,5098254.0,2772562.9,4232543.4,2763700.704,3133420.875,369720.1710000001,99.68036086755687,54.208768413656905,3,False,True,False,2.0,78.0
87,459.0,Отдел экономики и финансов района (города областного значения),952345.0,1416067.6,1417478.6,307030.6,1138865.1,304264.81,365748.534,61483.72399999999,99.09918099368598,21.465213654724664,3,False,True,False,2.0,78.0
88,489.0,Отдел государственных активов и закупок района (города областного значения),2605590.0,3304453.1,3304453.1,634190.5,2530614.1,634120.337,877504.441,243384.10399999993,99.98893660501065,19.18987250870651,3,False,True,False,2.0,78.0
89,718.0,Управление государственных закупок области,1432032.0,1620400.9,1620400.9,641211.9,1221941.8,635429.116,715583.989,80154.8729999999,99.09814774179956,39.21431517348577,3,False,True,False,2.0,78.0
90,727.0,Управление экономики области,56171.0,56171.0,56171.0,0.0,56171.0,0.0,0.0,0.0,0.0,0.0,3,False,True,False,2.0,78.0
91,733.0,Управление по государственным закупкам и коммунальной собственности области,361807.0,398800.3,398800.3,194102.3,307886.3,193161.168,210992.368,17831.199999999983,99.5151360906079,48.43556236040946,3,False,True,False,2.0,78.0
92,751.0,Управление финансов и государственных активов области,253773.0,271434.0,271434.0,94481.0,134538.0,94477.395,104868.795,10391.399999999994,99.99618441803115,34.80676518048587,3,False,True,False,2.0,78.0
93,805.0,Отдел государственных закупок района (города областного значения),348846.0,278169.1,220077.2,109755.8,191307.2,104556.373,109332.294,4775.9209999999875,95.26273144562748,47.50895276748341,3,False,True,False,2.0,78.0
94,5.0,Планирование и статистическая деятельность,11484667.0,10391580.3,10369122.3,3835832.9,7636759.8,3734732.593,4278991.882,544259.2890000003,97.36431931119836,36.017827593758824,2,False,True,False,1.0,60.0
95,257.0,Управление финансов области,20174.0,20174.0,20174.0,4250.0,10634.0,4250.0,4250.0,0.0,100.0,21.066719540001984,3,False,True,False,5.0,94.0
96,258.0,Управление экономики и бюджетного планирования области,4497674.0,5040778.3,5082238.3,1698945.8,3889536.0,1655096.616,1812833.94,157737.32400000002,97.41903573380621,32.566293005190246,3,False,True,False,5.0,94.0
97,299.0,Управление экономики и финансов области,526840.0,530536.0,530536.0,241587.0,252229.0,239506.037,240715.837,1209.7999999999884,99.13862790630291,45.14416307281693,3,False,True,False,5.0,94.0
98,357.0,"Управление экономики и бюджетного планирования города республиканского значения, столицы",1058250.0,875752.0,875752.0,393986.0,471235.0,371956.883,418412.347,46455.464000000036,94.40865487606158,42.472855671468636,3,False,True,False,5.0,94.0
99,453.0,Отдел экономики и бюджетного планирования района (города областного значения),2856830.0,2545735.0,2481817.0,1093081.1,1766222.8,1089484.554,1189929.667,100445.1129999999,99.67097171472454,43.89866593709367,3,False,True,False,5.0,94.0
100,459.0,Отдел экономики и финансов района (города областного значения),953200.0,204507.0,204507.0,112.0,203191.0,112.0,112.0,0.0,100.0,0.054765851535644255,3,False,True,False,5.0,94.0
101,510.0,"Управление экономики города республиканского значения, столицы",403638.0,416286.0,416286.0,73572.0,354182.0,54457.014,268885.62,214428.606,74.0186674278258,13.081634741499833,3,False,True,False,5.0,94.0
102,727.0,Управление экономики области,542660.0,626381.0,626381.0,271370.0,626381.0,264915.802,286129.438,21213.636,97.62162435051775,42.29307753587673,3,False,True,False,5.0,94.0
103,750.0,Управление стратегии и экономического развития области,625401.0,131431.0,131431.0,58929.0,63149.0,54953.687,57723.033,2769.346000000005,93.25406336438765,41.8118153251516,3,False,True,False,5.0,94.0
104,9.0,Прочие государственные услуги общего характера,64782383.3,81735091.6,102732150.0,38348266.9,90640156.6,37857965.973,59144722.588,21286756.615000002,98.72145218901666,36.85113761660785,2,False,True,False,1.0,60.0
105,265.0,Управление предпринимательства и промышленности области,462974.0,780179.0,780179.0,304004.0,428033.0,298501.227,323662.958,25161.73099999997,98.18990111972211,38.260607757963236,3,False,True,False,9.0,104.0
106,269.0,Управление по делам религий области,3256900.0,3572165.8,3571579.8,1228855.5,2947940.7,1185018.321,1956702.555,771684.2339999999,96.43268236175857,33.17910805184866,3,False,True,False,9.0,104.0
107,271.0,Управление строительства области,3801069.0,5133523.0,5133523.0,2159278.0,5133523.0,2157893.992,3632055.742,1474161.75,99.93590413091783,42.03534282402163,3,False,True,False,9.0,104.0
108,288.0,"Управление строительства, архитектуры и градостроительства области",2646090.0,4753333.5,4753333.5,991471.9,4753333.5,989471.899,1800202.308,810730.409,99.79827960832777,20.816378631964284,3,False,True,False,9.0,104.0
