id,code,name,utv,utch,plg,plgp,plgo,sumrg,obz,obzsumrg,plgpsumrg,plgsumrg,level,isLeaf,loaded,expanded,parentCode,parent_id
374,809.0,"Отдел жилищно-коммунального хозяйства, пассажирского транспорта, автомобильных дорог, строительства, архитектуры и градостроительства района (города областного значения)",2255035.0,2255035.0,2255035.0,42300.0,1549541.0,42280.0,85505.0,43225.0,99.95271867612293,1.874915466943972,3,False,True,False,2.0,351.0
375,810.0,Отдел реального сектора экономики района (города областного значения),10170684.0,10170684.0,10189794.0,1639170.0,10137275.0,1639162.044,9106834.283,7467672.239,99.99951463240542,16.086311892075543,3,False,True,False,2.0,351.0
376,813.0,Отдел инфраструктуры и коммуникаций района (города областного значения),10684922.0,10684922.0,10684922.0,4799256.0,10684922.0,4799256.0,8459376.944,3660120.944,100.0,44.916153810013775,3,False,True,False,2.0,351.0
377,3.0,Благоустройство населенных пунктов,328435409.9,334625899.7,335449658.1,45886843.5,306643491.8,45693569.633,129244342.742,83550773.109,99.57880330774987,13.621587779164887,2,False,True,False,7.0,319.0
378,123.0,"Аппарат акима района в городе, города районного значения, поселка, села, сельского округа",139574317.0,141000849.0,141000849.0,23373059.9,123505288.0,23252632.275,60885851.89,37633219.615,99.48475883981284,16.491129266179097,3,False,True,False,3.0,377.0
379,124.0,"Аппарат акима города районного значения, села, поселка, сельского округа",55559589.9,55698314.0,56097535.8,4717740.5,53780896.5,4684676.461,18230381.96,13545705.499000002,99.29915519940107,8.350948743456215,3,False,True,False,3.0,377.0
380,279.0,Управление энергетики и жилищно-коммунального хозяйства области,917419.0,917419.0,917419.0,0.0,100856.0,0.0,100856.0,100856.0,0.0,0.0,3,False,True,False,3.0,377.0
381,303.0,"Управление развития комфортной городской среды города республиканского значения, столицы",3881807.0,3881807.0,3881807.0,370251.0,3881807.0,370250.853,383914.853,13664.0,99.9999602972038,9.538105655433153,3,False,True,False,3.0,377.0
382,309.0,"Управление энергетики и развития инфраструктуры города республиканского значения, столицы",1271776.0,1271776.0,1271776.0,300000.0,1271776.0,300000.0,300000.0,0.0,100.0,23.589059708627936,3,False,True,False,3.0,377.0
383,336.0,"Управление охраны окружающей среды и природопользования города республиканского значения, столицы",849626.0,849626.0,849626.0,0.0,800000.0,0.0,715400.0,715400.0,0.0,0.0,3,False,True,False,3.0,377.0
384,349.0,"Управление сельского хозяйства и ветеринарии города республиканского значения, столицы ",109704.0,109704.0,109704.0,0.0,109704.0,0.0,0.0,0.0,0.0,0.0,3,False,True,False,3.0,377.0
385,373.0,"Управление строительства города республиканского значения, столицы",153511.0,153511.0,153511.0,0.0,153511.0,0.0,0.0,0.0,0.0,0.0,3,False,True,False,3.0,377.0
386,458.0,"Отдел жилищно-коммунального хозяйства, пассажирского транспорта и автомобильных дорог района (города областного значения)",63311573.0,65871595.0,66754811.6,7218134.7,64407339.6,7212971.564,24731108.084,17518136.52,99.92846994113313,10.805171029798846,3,False,True,False,3.0,377.0
387,483.0,"Отдел жилищно-коммунального хозяйства, пассажирского транспорта, автомобильных дорог, строительства и жилищной инспекции района (города областного значения)",1996324.0,1996324.0,1996324.0,55909.0,1996324.0,55907.307,55907.307,0.0,99.9969718649949,2.8005126923284998,3,False,True,False,3.0,377.0
388,487.0,Отдел жилищно-коммунального хозяйства и жилищной инспекции района (города областного значения),424650.0,424650.0,424650.0,133534.0,424650.0,133534.0,204411.37,70877.37,100.0,31.445661132697516,3,False,True,False,3.0,377.0
389,490.0,"Отдел коммунального хозяйства, пассажирского транспорта и автомобильных дорог района (города областного значения)",663080.0,663080.0,3280.0,0.0,3280.0,0.0,0.0,0.0,0.0,0.0,3,False,True,False,3.0,377.0
390,492.0,"Отдел жилищно-коммунального хозяйства, пассажирского транспорта, автомобильных дорог и жилищной инспекции района (города областного значения)",21863325.0,24078536.7,24045036.7,2449771.1,23234890.7,2426187.967,7072661.285,4646473.318,99.03733320227347,10.090182008331059,3,False,True,False,3.0,377.0
391,495.0,"Отдел архитектуры, строительства, жилищно-коммунального хозяйства, пассажирского транспорта и автомобильных дорог района (города областного значения)",1010650.0,860650.0,868650.0,45526.7,868650.0,45525.083,272431.291,226906.20800000004,99.99644823806689,5.240900592874,3,False,True,False,3.0,377.0
392,496.0,Отдел жилищной инспекции и  коммунального хозяйства района (города областного значения),890000.0,890000.0,890000.0,30000.0,890000.0,30000.0,30000.0,0.0,100.0,3.3707865168539324,3,False,True,False,3.0,377.0
393,497.0,Отдел жилищно-коммунального хозяйства района (города областного значения),21781583.0,21781583.0,21781583.0,2248882.6,17164535.0,2239410.392,4439648.269,2200237.8770000003,99.57880380238612,10.281210470331747,3,False,True,False,3.0,377.0
394,511.0,"Управление развития коммунальной инфраструктуры города республиканского значения, столицы",117480.0,117480.0,117480.0,0.0,117480.0,0.0,0.0,0.0,0.0,0.0,3,False,True,False,3.0,377.0
395,513.0,"Управление экологии и окружающей среды города республиканского значения, столицы",541647.0,541647.0,541647.0,0.0,541647.0,0.0,38199.847,38199.847,0.0,0.0,3,False,True,False,3.0,377.0
396,700.0,"Управление недропользования, окружающей среды и водных ресурсов области",1262165.0,1262165.0,1262165.0,0.0,1262165.0,0.0,1262165.0,1262165.0,0.0,0.0,3,False,True,False,3.0,377.0
397,809.0,"Отдел жилищно-коммунального хозяйства, пассажирского транспорта, автомобильных дорог, строительства, архитектуры и градостроительства района (города областного значения)",130941.0,130941.0,130941.0,5512.0,130941.0,5512.0,53967.22,48455.22,100.0,4.209529482744136,3,False,True,False,3.0,377.0
398,810.0,Отдел реального сектора экономики района (города областного значения),132846.0,132846.0,132846.0,5804.0,96500.0,5804.0,81874.842,76070.842,100.0,4.3689685801604865,3,False,True,False,3.0,377.0
399,813.0,Отдел инфраструктуры и коммуникаций района (города областного значения),11991396.0,11991396.0,12218016.0,4932718.0,11901251.0,4931157.731,10385563.524,5454405.7930000005,99.96836898034714,40.35972559702,3,False,True,False,3.0,377.0
400,8.0,"Культура, спорт, туризм и информационное пространство",554081353.3,558809868.1,557590636.2,116307899.3,422624508.4,115275528.222,213249128.192,97973599.97,99.11238094384532,20.673863716149686,1,False,True,False,2.0,55.0
401,1.0,Деятельность в области культуры,210974392.8,212567926.1,211902792.4,47218135.9,136869821.9,47044156.109,55723674.279,8679518.170000002,99.63154032304777,22.20081933615897,2,False,True,False,8.0,400.0
402,123.0,"Аппарат акима района в городе, города районного значения, поселка, села, сельского округа",258500.0,258500.0,6546410.0,28352.0,1438758.0,21521.614,98278.011,76756.397,75.90862725733635,0.32875444709390345,3,False,True,False,1.0,401.0
403,124.0,"Аппарат акима города районного значения, села, поселка, сельского округа",9197490.0,9197490.0,9201601.6,2666591.0,5363052.1,2665962.238,2693426.503,27464.26500000013,99.97642075593895,28.97280662531618,3,False,True,False,1.0,401.0
404,262.0,Управление культуры области,22450632.0,22450632.0,22441403.0,3450573.5,15332917.0,3449624.759,3518405.735,68780.97599999979,99.97250483144325,15.371698280183285,3,False,True,False,1.0,401.0
405,271.0,Управление строительства области,430000.0,430000.0,430000.0,26195.0,430000.0,26194.072,118870.844,92676.772,99.99645733918688,6.091644651162791,3,False,True,False,1.0,401.0
406,273.0,"Управление культуры, архивов и документации области",33057162.0,33200974.0,33200974.0,7156590.0,23150911.0,7128136.725,7239447.555,111310.83000000007,99.60241854011477,21.46966147740123,3,False,True,False,1.0,401.0
407,288.0,"Управление строительства, архитектуры и градостроительства области",4843729.0,4843729.0,3843729.0,1136542.0,3762224.0,1136542.0,3257932.917,2121390.917,100.0,29.5687339039771,3,False,True,False,1.0,401.0
408,312.0,"Управление культуры, развития языков и  архивов  города республиканского значения, столицы",7549981.0,7549981.0,7549981.0,1580697.0,2493683.0,1579340.232,1588698.774,9358.5419999999,99.91416647213224,20.918466311372175,3,False,True,False,1.0,401.0
409,361.0,"Управление культуры города республиканского значения, столицы",29094704.0,31630594.0,25342684.0,6722041.0,16372920.0,6721993.745,7370166.947,648173.2019999996,99.99929701410628,26.524395541529856,3,False,True,False,1.0,401.0
410,373.0,"Управление строительства города республиканского значения, столицы",5013136.0,5013136.0,5013136.0,2024893.0,5013136.0,2024892.986,3171875.192,1146982.2059999998,99.99999930860545,40.39174253401463,3,False,True,False,1.0,401.0
411,455.0,Отдел культуры и развития языков района (города областного значения),22396998.0,22410998.0,20618827.0,5133119.0,14998658.0,5132575.648,5216457.494,83881.8459999999,99.98941477881186,24.892665562400808,3,False,True,False,1.0,401.0
412,457.0,"Отдел культуры, развития языков, физической культуры и спорта района (города областного значения)",26263219.2,26037860.2,26160472.2,6396449.1,17678275.2,6396401.209,6701442.656,305041.4470000006,99.99925128771837,24.450633612798473,3,False,True,False,1.0,401.0
413,466.0,"Отдел архитектуры, градостроительства и строительства района (города областного значения)",725528.6,725528.6,727028.6,19149.0,725528.6,19148.862,497411.848,478262.986,99.99927933573557,2.6338526434861023,3,False,True,False,1.0,401.0
414,467.0,Отдел строительства района (города областного значения),2866235.0,3090235.4,3090235.4,602478.3,3090235.4,602476.978,2244544.596,1642067.6179999998,99.99978057300984,19.49615158767517,3,False,True,False,1.0,401.0
415,472.0,"Отдел строительства, архитектуры и градостроительства района (города областного значения)",2904726.0,2904726.0,2937789.0,578473.0,2937789.0,565296.849,2253734.881,1688438.0320000001,97.72225306971977,19.242254940705408,3,False,True,False,1.0,401.0
416,478.0,"Отдел внутренней политики, культуры и развития языков района (города областного значения)",3768259.0,3768259.0,3760719.0,1036631.1,3073484.3,1036615.304,1039479.771,2864.466999999946,99.99847621781751,27.56428502102922,3,False,True,False,1.0,401.0
417,483.0,"Отдел жилищно-коммунального хозяйства, пассажирского транспорта, автомобильных дорог, строительства и жилищной инспекции района (города областного значения)",434844.0,434844.0,434844.0,0.0,434844.0,0.0,0.0,0.0,0.0,0.0,3,False,True,False,1.0,401.0
418,495.0,"Отдел архитектуры, строительства, жилищно-коммунального хозяйства, пассажирского транспорта и автомобильных дорог района (города областного значения)",16953.0,16953.0,16953.0,0.0,16953.0,0.0,9689.6,9689.6,0.0,0.0,3,False,True,False,1.0,401.0
419,748.0,"Управление культуры, развития языков и архивного дела  области",21746475.0,20628894.9,20628894.9,4053854.2,10250428.9,3931951.519,3948561.41,16609.891000000294,96.99291896092365,19.060407928104766,3,False,True,False,1.0,401.0
420,760.0,Управление культуры и спорта области,6061156.0,6061156.0,6061156.0,912796.0,918584.0,912795.226,913475.224,679.9980000000214,99.99991520558811,15.0597547068579,3,False,True,False,1.0,401.0
421,802.0,"Отдел культуры, физической культуры и спорта района (города областного значения)",4035675.0,4035675.0,4036087.7,1101658.7,2508816.7,1101658.7,1101658.7,0.0,100.0,27.295212143185093,3,False,True,False,1.0,401.0
422,810.0,Отдел реального сектора экономики района (города областного значения),15000.0,15000.0,15000.0,0.0,15000.0,0.0,11592.0,11592.0,0.0,0.0,3,False,True,False,1.0,401.0
423,819.0,"Отдел внутренней политики, культуры, развития языков и спорта района (города областного значения)",7843990.0,7862760.0,8049496.0,2006989.0,6279559.7,2006963.443,2144459.621,137496.17799999984,99.99872659989666,24.93278390348911,3,False,True,False,1.0,401.0
424,820.0,Отдел культуры и спорта района (города областного значения),0.0,0.0,1795371.0,584064.0,584064.0,584064.0,584064.0,0.0,100.0,32.53166058714327,3,False,True,False,1.0,401.0
425,2.0,Спорт,176105470.2,176861421.6,176434714.8,41886538.8,151763396.0,41521533.821,95574094.012,54052560.19099999,99.12858643980391,23.533653152140328,2,False,True,False,8.0,400.0
426,123.0,"Аппарат акима района в городе, города районного значения, поселка, села, сельского округа",0.0,0.0,5850737.0,0.0,1324327.0,0.0,0.0,0.0,0.0,0.0,3,False,True,False,2.0,425.0
427,124.0,"Аппарат акима города районного значения, села, поселка, сельского округа",347491.2,347491.2,347491.2,58061.0,274856.6,57991.926,71882.221,13890.295000000006,99.88103201804998,16.688746650274883,3,False,True,False,2.0,425.0
428,271.0,Управление строительства области,14344401.0,13570719.0,13570719.0,3228640.0,13540719.0,3228638.896,9544468.782,6315829.886,99.99996580603599,23.79121471751055,3,False,True,False,2.0,425.0
429,285.0,Управление физической культуры и спорта области,84720282.0,84828723.5,84828723.5,21191204.1,77704975.9,21029916.049,48901070.378,27871154.329,99.2388915219782,24.791032071819398,3,False,True,False,2.0,425.0
430,288.0,"Управление строительства, архитектуры и градостроительства области",7634864.0,7694504.9,7741363.5,918119.6,7739176.5,918119.425,3206079.722,2287960.2970000003,99.99998093930247,11.859918798542402,3,False,True,False,2.0,425.0
431,323.0,Управление Спорта города Алматы,18347034.0,18347034.0,12493655.0,1715313.0,12446109.0,1662385.077,5353385.556,3691000.479,96.91438687866297,13.305834657672236,3,False,True,False,2.0,425.0
432,373.0,"Управление строительства города республиканского значения, столицы",931229.0,931229.0,931229.0,306104.0,931229.0,225195.474,562605.394,337409.92,73.56828855552361,24.182609648110184,3,False,True,False,2.0,425.0
433,381.0,"Управление физической культуры и спорта города республиканского значения, столицы",15603117.0,16853631.0,16853631.0,6513979.0,11599273.0,6510064.081,10055579.856,3545515.7750000004,99.93989972948945,38.62707140674909,3,False,True,False,2.0,425.0
434,457.0,"Отдел культуры, развития языков, физической культуры и спорта района (города областного значения)",6699335.6,6699441.6,6699441.6,1871378.2,4262422.8,1870662.382,2615004.241,744341.8589999999,99.96174915364516,27.922661225974416,3,False,True,False,2.0,425.0
435,465.0,Отдел физической культуры и спорта района (города областного значения),11330415.0,11358672.0,9654266.3,1902968.4,6388689.2,1900095.809,3581968.763,1681872.954,99.8490468365108,19.681410787270284,3,False,True,False,2.0,425.0
436,466.0,"Отдел архитектуры, градостроительства и строительства района (города областного значения)",994623.4,994623.4,953953.4,102908.0,903637.4,97166.349,255229.558,158063.20899999997,94.4205980098729,10.185649424804188,3,False,True,False,2.0,425.0
437,467.0,Отдел строительства района (города областного значения),6900182.0,6912043.0,6812782.3,1844950.0,6812782.3,1792206.377,5461927.29,3669720.9129999997,97.1411895715331,26.30652643927871,3,False,True,False,2.0,425.0
438,472.0,"Отдел строительства, архитектуры и градостроительства района (города областного значения)",3549809.0,3549809.0,3520715.0,391193.0,3388510.0,391191.552,2748860.866,2357669.314,99.9996298502274,11.11113941344301,3,False,True,False,2.0,425.0
439,495.0,"Отдел архитектуры, строительства, жилищно-коммунального хозяйства, пассажирского транспорта и автомобильных дорог района (города областного значения)",281640.0,281640.0,281640.0,41381.0,281640.0,41380.2,215962.965,174582.765,99.99806674560789,14.692586280357903,3,False,True,False,2.0,425.0
440,760.0,Управление культуры и спорта области,2410851.0,2481664.0,2481664.0,973658.0,2037421.0,973642.589,1978737.125,1005094.536,99.99841720604155,39.23345743017588,3,False,True,False,2.0,425.0
441,802.0,"Отдел культуры, физической культуры и спорта района (города областного значения)",149226.0,149226.0,149226.0,58731.0,104039.0,56788.384,59107.563,2319.1790000000037,96.69234986633974,38.05528795250157,3,False,True,False,2.0,425.0
442,804.0,"Отдел физической культуры, спорта и туризма района (города областного значения",123280.0,123280.0,123280.0,29654.7,51915.7,29600.428,36267.645,6667.216999999997,99.81698685199984,24.01073004542505,3,False,True,False,2.0,425.0
443,809.0,"Отдел жилищно-коммунального хозяйства, пассажирского транспорта, автомобильных дорог, строительства, архитектуры и градостроительства района (города областного значения)",16888.0,16888.0,16888.0,0.0,16888.0,0.0,0.0,0.0,0.0,0.0,3,False,True,False,2.0,425.0
444,810.0,Отдел реального сектора экономики района (города областного значения),354802.0,354802.0,354802.0,65654.0,280792.0,65629.1,231304.026,165674.926,99.9620739025802,18.497387275156285,3,False,True,False,2.0,425.0
445,819.0,"Отдел внутренней политики, культуры, развития языков и спорта района (города областного значения)",1366000.0,1366000.0,1366000.0,343133.2,1005871.0,342211.496,359141.765,16930.26900000003,99.73138594574934,25.052086090775987,3,False,True,False,2.0,425.0
446,820.0,Отдел культуры и спорта района (города областного значения),0.0,0.0,1402507.0,329508.6,668121.6,328648.227,335510.296,6862.0689999999595,99.73889209568432,23.43291170739255,3,False,True,False,2.0,425.0
447,3.0,Информационное пространство,102269462.5,103094451.3,103129294.3,16790129.8,81266867.5,16505241.37,42222214.151,25716972.781000003,98.30323866823232,16.004416089561083,2,False,True,False,8.0,400.0
448,121.0,"Аппарат акима города республиканского значения, столицы",64500.0,64500.0,64500.0,0.0,64500.0,0.0,0.0,0.0,0.0,0.0,3,False,True,False,3.0,447.0
449,262.0,Управление культуры области,1865310.0,1865310.0,1865310.0,384712.9,1529223.0,384408.549,400091.54,15682.99099999998,99.92088879785419,20.608292937903084,3,False,True,False,3.0,447.0
450,263.0,Управление внутренней политики области,7305132.0,7347272.0,7347272.0,992622.0,7093623.0,988439.729,6024656.252,5036216.523,99.57866428509544,13.453152802836211,3,False,True,False,3.0,447.0
451,264.0,Управление по развитию языков области,1261747.0,1261747.0,1261747.0,250806.0,1115585.0,237142.321,438541.497,201399.17599999998,94.55209245392854,18.794760043019718,3,False,True,False,3.0,447.0
452,271.0,Управление строительства области,257239.0,257239.0,257239.0,0.0,257239.0,0.0,255281.097,255281.097,0.0,0.0,3,False,True,False,3.0,447.0
453,273.0,"Управление культуры, архивов и документации области",4467421.0,4496910.0,4496910.0,1002131.0,3796558.0,988388.205,1145567.906,157179.701,98.62864286206094,21.97927476867449,3,False,True,False,3.0,447.0
454,288.0,"Управление строительства, архитектуры и градостроительства области",10000.0,10000.0,10000.0,0.0,10000.0,0.0,100.0,100.0,0.0,0.0,3,False,True,False,3.0,447.0
455,305.0,"Управление внутренней политики и по делам молодежи города республиканского значения, столицы",1700822.0,1700822.0,1700822.0,128593.0,804830.0,128588.248,776746.985,648158.737,99.99630462000265,7.5603589323280165,3,False,True,False,3.0,447.0
456,310.0,"Управление цифровизации и государственных услуг города республиканского значения, столицы",1643793.0,2243793.0,2243793.0,389716.0,2054790.0,386554.098,1765177.626,1378623.528,99.18866507918587,17.227707636132212,3,False,True,False,3.0,447.0
457,312.0,"Управление культуры, развития языков и  архивов  города республиканского значения, столицы",1145037.0,1145037.0,1145037.0,289881.0,630304.0,289049.689,294180.831,5131.141999999993,99.7132233571707,25.243698587905893,3,False,True,False,3.0,447.0
458,313.0,"Управление цифровизации города республиканского значения, столицы",6850255.0,6850255.0,6850255.0,585710.0,6218375.0,584575.044,2610565.7,2025990.6560000002,99.80622560652883,8.533624573099834,3,False,True,False,3.0,447.0
459,325.0,"Управление общественного развития города республиканского значения, столицы",4238451.0,4238451.0,4238451.0,749971.0,4190320.0,747884.214,4010657.333,3262773.119,99.7217511077095,17.645224965441386,3,False,True,False,3.0,447.0
