id,code,name,utv,utch,plg,plgp,plgo,sumrg,obz,obzsumrg,plgpsumrg,plgsumrg,level,isLeaf,loaded,expanded,parentCode,parent_id
452,802.0,"Отдел культуры, физической культуры и спорта района (города областного значения)",226500.0,316952.6,316952.6,179628.1,225331.9,177454.679,177844.564,389.8850000000093,98.79004398532301,55.98776567852733,3,False,True,False,2.0,434.0
453,804.0,"Отдел физической культуры, спорта и туризма района (города областного значения",171911.0,1448287.2,1907519.3,1057086.6,1415219.0,1056308.235,1162405.817,106097.58199999994,99.9263669599066,55.3760182138131,3,False,True,False,2.0,434.0
454,809.0,"Отдел жилищно-коммунального хозяйства, пассажирского транспорта, автомобильных дорог, строительства, архитектуры и градостроительства района (города областного значения)",483770.0,0.0,0.0,0.0,0.0,0.0,0.0,0.0,0.0,0.0,3,False,True,False,2.0,434.0
455,810.0,Отдел реального сектора экономики района (города областного значения),2682739.0,1277110.0,1317609.0,1121812.0,1316446.0,1115477.904,1241058.163,125580.25899999985,99.43536920624847,84.65925050603025,3,False,True,False,2.0,434.0
456,819.0,"Отдел внутренней политики, культуры, развития языков и спорта района (города областного значения)",740023.0,893780.9,870251.9,578023.8,762931.4,575650.89,610912.54,35261.65000000002,99.58947884152866,66.14761656940938,3,False,True,False,2.0,434.0
457,820.0,Отдел культуры и спорта района (города областного значения),1679905.0,430532.1,0.0,0.0,0.0,0.0,0.0,0.0,0.0,0.0,3,False,True,False,2.0,434.0
458,3.0,Информационное пространство,135347864.4,144411046.3,145085797.9,67152979.1,131610213.2,65504317.941,99606398.158,34102080.21700001,97.54491731998232,45.14867677548196,2,False,True,False,8.0,405.0
459,121.0,"Аппарат акима города республиканского значения, столицы",65000.0,65000.0,65000.0,7433.0,65000.0,7433.0,55599.48,48166.48,100.0,11.435384615384615,3,False,True,False,3.0,458.0
460,262.0,Управление культуры области,1752529.0,2193603.9,2193603.9,1262716.6,2002980.9,1259940.055,1326048.987,66108.93200000003,99.78011336827281,57.43699010564305,3,False,True,False,3.0,458.0
461,263.0,Управление внутренней политики области,8151018.0,9256748.9,9256748.9,4600559.1,9167273.3,4583795.685,8565348.93,3981553.245,99.63562222252507,49.51841877227543,3,False,True,False,3.0,458.0
462,264.0,Управление по развитию языков области,948530.0,754407.0,754407.0,396998.8,658461.5,382271.392,502097.496,119826.10399999999,96.29031422765007,50.671771603391804,3,False,True,False,3.0,458.0
463,271.0,Управление строительства области,4620.0,32109.0,32109.0,3411.0,32109.0,2867.941,20068.756,17200.815000000002,84.07918498973908,8.931891370020866,3,False,True,False,3.0,458.0
464,273.0,"Управление культуры, архивов и документации области",5613549.0,5299276.9,5299276.9,2987595.4,4653201.4,2956714.655,3131784.498,175069.84300000034,98.96636790242748,55.794681251700574,3,False,True,False,3.0,458.0
465,288.0,"Управление строительства, архитектуры и градостроительства области",0.0,10000.0,10000.0,0.0,10000.0,0.0,10000.0,10000.0,0.0,0.0,3,False,True,False,3.0,458.0
466,305.0,"Управление внутренней политики и по делам молодежи города республиканского значения, столицы",1890620.0,2013068.0,2013068.0,761067.0,2013068.0,760438.731,1421104.757,660666.026,99.91744892368214,37.77511395541532,3,False,True,False,3.0,458.0
467,310.0,"Управление цифровизации и государственных услуг города республиканского значения, столицы",2800227.0,2475227.0,2475227.0,1169933.0,2436081.0,1169542.361,2311974.316,1142431.955,99.9666101392131,47.24990318059717,3,False,True,False,3.0,458.0
468,312.0,"Управление культуры, развития языков и  архивов  города республиканского значения, столицы",1558140.0,1766319.0,1766319.0,930333.0,1766319.0,929584.59,945252.345,15667.755000000005,99.91955461109086,52.628352522958764,3,False,True,False,3.0,458.0
469,313.0,"Управление цифровизации города республиканского значения, столицы",12997986.0,11918167.0,12393047.0,3899711.0,12336647.0,3458956.768,7936180.249,4477223.481,88.69777191181603,27.910462761901893,3,False,True,False,3.0,458.0
470,325.0,"Управление общественного развития города республиканского значения, столицы",4850216.0,4850216.0,4850216.0,2679979.0,4818670.0,2679300.28,4693706.021,2014405.741,99.97467442841902,55.24084453146004,3,False,True,False,3.0,458.0
471,346.0,"Управление по развитию языков и архивного дела города республиканского значения, столицы",864730.0,1558456.0,1558456.0,839085.0,1085772.0,749122.215,793907.759,44785.543999999994,89.27846582884928,48.06823003023505,3,False,True,False,3.0,458.0
472,361.0,"Управление культуры города республиканского значения, столицы",3282517.0,4169033.0,4169033.0,2605155.0,3102634.0,2142232.91,2462852.276,320619.3659999999,82.23053561112486,51.38440760723171,3,False,True,False,3.0,458.0
473,362.0,"Управление внутренней политики города республиканского значения, столицы",1412767.0,1660508.0,1660508.0,743007.0,1504618.0,740361.9,1369151.32,628789.42,99.64400066217411,44.586469923661916,3,False,True,False,3.0,458.0
474,455.0,Отдел культуры и развития языков района (города областного значения),10912136.4,12755267.9,13192021.6,7464304.0,11006223.1,7427986.462,7723102.524,295116.0619999999,99.51345044360465,56.306657821118186,3,False,True,False,3.0,458.0
475,456.0,Отдел внутренней политики района (города областного значения),4822799.0,4940924.2,5004940.2,2263645.2,4993989.2,2259882.278,4348392.853,2088510.5750000002,99.83376714690093,45.153032557711676,3,False,True,False,3.0,458.0
476,457.0,"Отдел культуры, развития языков, физической культуры и спорта района (города областного значения)",14596430.0,15230765.7,15391692.7,8546903.0,11695336.6,8531738.834,8770200.442,238461.60799999908,99.82257706680421,55.43080283820896,3,False,True,False,3.0,458.0
477,458.0,"Отдел жилищно-коммунального хозяйства, пассажирского транспорта и автомобильных дорог района (города областного значения)",0.0,31995.0,31995.0,0.0,31995.0,0.0,12617.414,12617.414,0.0,0.0,3,False,True,False,3.0,458.0
478,466.0,"Отдел архитектуры, градостроительства и строительства района (города областного значения)",72799.0,491395.7,525091.5,164980.4,525091.5,164606.55,469324.722,304718.172,99.77339732477311,31.348165034094055,3,False,True,False,3.0,458.0
479,467.0,Отдел строительства района (города областного значения),107900.0,289199.0,350604.5,3471.4,350604.5,3470.575,161207.988,157737.413,99.97623437229936,0.9898831874662191,3,False,True,False,3.0,458.0
480,470.0,Отдел внутренней политики и развития языков района (города областного значения),315516.0,325369.2,325369.2,153661.1,319113.2,153650.583,290485.056,136834.47299999997,99.99315571735463,47.22345661482402,3,False,True,False,3.0,458.0
481,472.0,"Отдел строительства, архитектуры и градостроительства района (города областного значения)",38449.0,464508.8,415657.5,147139.0,415657.5,144931.612,361787.581,216855.969,98.4997940722718,34.86803726625888,3,False,True,False,3.0,458.0
482,478.0,"Отдел внутренней политики, культуры и развития языков района (города областного значения)",2229440.0,2161959.3,2183959.3,1237243.8,1993598.9,1233175.196,1348676.672,115501.47600000002,99.6711558384855,56.46511800838048,3,False,True,False,3.0,458.0
483,487.0,Отдел жилищно-коммунального хозяйства и жилищной инспекции района (города областного значения),1000.0,0.0,0.0,0.0,0.0,0.0,0.0,0.0,0.0,0.0,3,False,True,False,3.0,458.0
484,490.0,"Отдел коммунального хозяйства, пассажирского транспорта и автомобильных дорог района (города областного значения)",0.0,20000.0,20000.0,0.0,20000.0,0.0,18444.086,18444.086,0.0,0.0,3,False,True,False,3.0,458.0
485,492.0,"Отдел жилищно-коммунального хозяйства, пассажирского транспорта, автомобильных дорог и жилищной инспекции района (города областного значения)",0.0,59473.0,59473.0,0.0,59473.0,0.0,43128.832,43128.832,0.0,0.0,3,False,True,False,3.0,458.0
486,495.0,"Отдел архитектуры, строительства, жилищно-коммунального хозяйства, пассажирского транспорта и автомобильных дорог района (города областного значения)",35920.0,73190.3,124639.3,29510.3,124639.3,29508.542,99985.323,70476.781,99.99404275795231,23.67515061461353,3,False,True,False,3.0,458.0
487,739.0,"Управление информатизации, оказания государственных услуг и архивов области",6423430.0,6809318.0,6809318.0,2576599.5,6809318.0,2529691.342,5161978.879,2632287.5369999995,98.17945482020004,37.150436240457566,3,False,True,False,3.0,458.0
488,740.0,Управление культуры и развития языков области,427847.0,977743.0,977743.0,530513.8,834714.2,490572.499,525221.361,34648.86200000002,92.4712041420977,50.173971994685715,3,False,True,False,3.0,458.0
489,743.0,Управление цифровых технологий области,15110439.0,15520243.8,15520243.8,4778791.1,15011629.2,4756707.216,11321847.739,6565140.523,99.53787718404348,30.64840525249996,3,False,True,False,3.0,458.0
490,747.0,Управление информации и общественного развития области,862318.0,2122774.0,2122774.0,1095315.0,2122774.0,989908.559,1501284.499,511375.94000000006,90.37660937721112,46.632781398302406,3,False,True,False,3.0,458.0
491,748.0,"Управление культуры, развития языков и архивного дела  области",4167195.0,4937448.0,4937448.0,2646813.0,3983948.0,2639728.437,2846774.28,207045.84299999988,99.7323360962788,53.463417478016986,3,False,True,False,3.0,458.0
492,752.0,Управление общественного развития области,8289552.0,7330293.8,7330293.8,3883990.0,7054086.8,3840003.185,6360793.563,2520790.378,98.86748382462365,52.38539258822068,3,False,True,False,3.0,458.0
493,755.0,"Управление цифровизации, государственных услуг и архивов области",6067245.0,7115142.0,7115142.0,2466071.0,5859717.0,2453365.759,4817331.485,2363965.7260000003,99.48479824790122,34.480910697214476,3,False,True,False,3.0,458.0
494,759.0,Управление цифровизации и архивов области,5733965.0,8606946.6,8656171.2,3186806.1,8243676.2,2947285.303,4420471.206,1473185.9030000004,92.48398586283614,34.048371212898374,3,False,True,False,3.0,458.0
495,760.0,Управление культуры и спорта области,960905.0,0.0,0.0,0.0,0.0,0.0,0.0,0.0,0.0,0.0,3,False,True,False,3.0,458.0
496,766.0,Управление культуры и туризма области,488400.0,0.0,0.0,0.0,0.0,0.0,0.0,0.0,0.0,0.0,3,False,True,False,3.0,458.0
497,802.0,"Отдел культуры, физической культуры и спорта района (города областного значения)",1713052.0,1785246.0,1785246.0,1015973.0,1362894.2,1014635.485,1030138.851,15503.366000000038,99.868351324297,56.83449143703445,3,False,True,False,3.0,458.0
498,803.0,Отдел внутренней политики и по делам религии района (города областного значения),9551.0,9551.0,9551.0,5571.0,9551.0,5571.0,9551.0,3980.0,100.0,58.328970788399126,3,False,True,False,3.0,458.0
499,810.0,Отдел реального сектора экономики района (города областного значения),0.0,12080.0,12080.0,0.0,12080.0,0.0,10592.058,10592.058,0.0,0.0,3,False,True,False,3.0,458.0
500,819.0,"Отдел внутренней политики, культуры, развития языков и спорта района (города областного значения)",3512259.0,3582070.6,3395529.6,1912651.7,2825473.7,1909295.399,2131520.365,222224.96600000025,99.82452105629059,56.2296791345892,3,False,True,False,3.0,458.0
501,820.0,Отдел культуры и спорта района (города областного значения),1997936.0,444207.7,0.0,0.0,0.0,0.0,0.0,0.0,0.0,0.0,3,False,True,False,3.0,458.0
502,821.0,Отдел общественного развития района (города областного значения),258932.0,291794.0,291794.0,156041.8,291794.0,156040.642,276462.189,120421.54700000002,99.99925789115481,53.476302459954624,3,False,True,False,3.0,458.0
503,4.0,Туризм,11470416.0,11304791.8,11304791.8,4449271.9,10008748.0,4381579.258,8189042.291,3807463.033,98.47856810009745,38.75860197619915,2,False,True,False,8.0,405.0
504,265.0,Управление предпринимательства и промышленности области,42300.0,16907.0,16907.0,4105.0,16907.0,4102.715,4102.715,0.0,99.94433617539586,24.266368959602534,3,False,True,False,4.0,503.0
505,266.0,Управление предпринимательства и индустриально-инновационного развития области,681505.0,1024440.8,1024440.8,555543.3,1003177.5,527143.044,571853.75,44710.706000000006,94.88784114577567,51.45666240548014,3,False,True,False,4.0,503.0
506,275.0,Управление предпринимательства области,295739.0,252629.0,252629.0,114917.0,252629.0,112247.503,130969.636,18722.133,97.67702167651436,44.43175684501779,3,False,True,False,4.0,503.0
507,284.0,Управление туризма области,2196602.0,2249244.0,2249244.0,700356.1,1206651.0,699172.967,967511.051,268338.08400000003,99.83106693866162,31.084798581212176,3,False,True,False,4.0,503.0
508,285.0,Управление физической культуры и спорта области,44872.0,54868.0,54868.0,9454.0,54868.0,9448.652,11504.952,2056.2999999999993,99.94343135180875,17.220696945396224,3,False,True,False,4.0,503.0
509,288.0,"Управление строительства, архитектуры и градостроительства области",984822.0,0.0,0.0,0.0,0.0,0.0,0.0,0.0,0.0,0.0,3,False,True,False,4.0,503.0
510,334.0,"Управление по инвестициям и развитию предпринимательства города республиканского значения, столицы
",2045090.0,2369310.0,2369310.0,1416085.0,2327327.0,1396084.2,2323007.0,926922.8,98.58759890825762,58.923661319118224,3,False,True,False,4.0,503.0
511,380.0,"Управление туризма города республиканского значения, столицы",4652170.0,4781387.0,4781387.0,1484984.0,4735859.0,1472055.278,3997463.079,2525407.801,99.12936960936952,30.78720208173904,3,False,True,False,4.0,503.0
512,514.0,"Управление туризма, внешних связей и креативной индустрии города республиканского значения, столицы",320856.0,366135.0,366135.0,127619.0,366135.0,125131.404,145700.613,20569.209000000017,98.05076360103119,34.17630218362079,3,False,True,False,4.0,503.0
513,766.0,Управление культуры и туризма области,44982.0,0.0,0.0,0.0,0.0,0.0,0.0,0.0,0.0,0.0,3,False,True,False,4.0,503.0
514,768.0,"Управление физической культуры, спорта и туризма области",109142.0,133535.0,133535.0,7486.5,8723.5,7485.291,7485.291,0.0,99.98385093167703,5.605489946455985,3,False,True,False,4.0,503.0
515,804.0,"Отдел физической культуры, спорта и туризма района (города областного значения",10345.0,14345.0,14345.0,3191.0,10102.0,3180.664,3916.664,736.0,99.67608900031338,22.172631578947367,3,False,True,False,4.0,503.0
516,815.0,Отдел поддержки бизнеса и туризма района (города областного значения),41991.0,41991.0,41991.0,25531.0,26369.0,25527.54,25527.54,0.0,99.98644784771454,60.79288418946918,3,False,True,False,4.0,503.0
517,9.0,"Прочие услуги по организации культуры, спорта, туризма  и информационного пространства",63976447.5,76610543.6,76551312.1,35217752.5,66510859.2,34187750.035,46280291.986,12092541.951000005,97.07533163849679,44.65991385012459,2,False,True,False,8.0,405.0
518,263.0,Управление внутренней политики области,3950983.0,4574043.7,4574043.7,2055072.4,4216679.2,1995235.278,2770301.286,775066.0079999999,97.0883204893414,43.620818008363145,3,False,True,False,9.0,517.0
519,273.0,"Управление культуры, архивов и документации области",2698958.0,2947273.0,2947273.0,1090674.2,2718416.3,1008220.802,1384938.511,376717.7089999999,92.44014408702435,34.20859899982119,3,False,True,False,9.0,517.0
520,283.0,Управление по вопросам молодежной политики области,1766099.0,2122816.0,2122816.0,1042988.7,1991153.2,992944.595,1434681.592,441736.997,95.2018554946952,46.77487803935904,3,False,True,False,9.0,517.0
521,302.0,"Управление молодежной политики города республиканского значения, столицы",2559689.0,2559689.0,2559689.0,1073077.0,2526462.0,1067495.694,2224850.228,1157354.5340000002,99.4798783311915,41.704116945457045,3,False,True,False,9.0,517.0
522,325.0,"Управление общественного развития города республиканского значения, столицы",898568.0,995182.0,995182.0,428043.0,881437.0,425616.05,756516.188,330900.138,99.43301257116691,42.76765958387511,3,False,True,False,9.0,517.0
523,343.0,"Управление топливно-энергетического комплекса и коммунального хозяйства города республиканского значения, столицы",53340.0,0.0,0.0,0.0,0.0,0.0,0.0,0.0,0.0,0.0,3,False,True,False,9.0,517.0
524,361.0,"Управление культуры города республиканского значения, столицы",604993.0,4301563.0,4301563.0,1001372.0,1468755.0,764060.737,918623.919,154563.18200000003,76.30138819539592,17.76239792373144,3,False,True,False,9.0,517.0
525,362.0,"Управление внутренней политики города республиканского значения, столицы",874350.0,1038681.0,1038681.0,541199.0,871630.0,537118.965,835105.806,297986.841,99.2461118738209,51.711638607041046,3,False,True,False,9.0,517.0
526,377.0,"Управление по вопросам молодежной политики города республиканского значения, столицы",1797719.0,2097435.0,2097435.0,1120667.0,1990804.0,1052759.562,1612436.42,559676.858,93.9404445745257,50.19271452989008,3,False,True,False,9.0,517.0
527,455.0,Отдел культуры и развития языков района (города областного значения),4240244.8,4865731.9,5023041.9,2841671.7,4707902.9,2784704.547,3499516.362,714811.8150000004,97.99529435437597,55.438608764143495,3,False,True,False,9.0,517.0
528,456.0,Отдел внутренней политики района (города областного значения),14671745.7,16834364.3,16894264.3,8422709.2,14938581.3,8402343.696,10627696.713,2225353.016999999,99.7582072048742,49.73488958616564,3,False,True,False,9.0,517.0
529,457.0,"Отдел культуры, развития языков, физической культуры и спорта района (города областного значения)",8515034.0,10842942.2,10878243.2,4958507.3,10167255.0,4769558.363,6813301.521,2043743.1579999998,96.18939883379824,43.844932268107414,3,False,True,False,9.0,517.0
530,470.0,Отдел внутренней политики и развития языков района (города областного значения),1137749.0,1664044.8,1664044.8,795481.6,1383312.8,790711.495,1104699.411,313987.9160000001,99.40035005209424,47.51744033574096,3,False,True,False,9.0,517.0
531,478.0,"Отдел внутренней политики, культуры и развития языков района (города областного значения)",1493340.0,2876802.4,2901802.4,1616662.7,2789635.2,1614483.801,1823391.68,208907.87899999996,99.86522241157664,55.63727568079756,3,False,True,False,9.0,517.0
532,517.0,"Управление коммунального хозяйства города республиканского значения, столицы",0.0,53340.0,53340.0,0.0,53340.0,0.0,0.0,0.0,0.0,0.0,3,False,True,False,9.0,517.0
533,740.0,Управление культуры и развития языков области,444907.0,801852.0,801852.0,275267.3,373544.2,246086.872,251632.02,5545.1479999999865,89.399239212213,30.68981208502317,3,False,True,False,9.0,517.0
534,747.0,Управление информации и общественного развития области,549503.0,1109582.0,1109582.0,528752.0,982556.0,482873.747,614327.229,131453.48200000008,91.32329466366083,43.51852742744565,3,False,True,False,9.0,517.0
535,748.0,"Управление культуры, развития языков и архивного дела  области",1475350.0,3379503.0,3379503.0,1132628.0,2772479.9,1131057.104,1359218.844,228161.74,99.86130521230272,33.46814913317136,3,False,True,False,9.0,517.0
536,752.0,Управление общественного развития области,6048903.0,4986488.0,4986488.0,2289953.9,4498572.3,2237624.628,3332927.755,1095303.1269999999,97.71483294925719,44.87375940742262,3,False,True,False,9.0,517.0
537,760.0,Управление культуры и спорта области,545415.0,0.0,0.0,0.0,0.0,0.0,0.0,0.0,0.0,0.0,3,False,True,False,9.0,517.0
538,766.0,Управление культуры и туризма области,951896.0,0.0,0.0,0.0,0.0,0.0,0.0,0.0,0.0,0.0,3,False,True,False,9.0,517.0
539,802.0,"Отдел культуры, физической культуры и спорта района (города областного значения)",1995255.0,2078603.6,2088650.6,1502957.1,1704647.6,1391048.781,1440446.717,49397.93599999999,92.55412419955299,66.60035819298832,3,False,True,False,9.0,517.0
540,803.0,Отдел внутренней политики и по делам религии района (города областного значения),46044.0,78304.9,78304.9,31742.4,78304.9,31715.57,47065.576,15350.006000000001,99.915475830435,40.50266330714936,3,False,True,False,9.0,517.0
541,804.0,"Отдел физической культуры, спорта и туризма района (города областного значения",132874.0,332555.2,421837.7,193225.2,276191.1,193029.235,204030.138,11000.90300000002,99.89858206900549,45.75912371037486,3,False,True,False,9.0,517.0
542,819.0,"Отдел внутренней политики, культуры, развития языков и спорта района (города областного значения)",4578791.0,4609692.3,4406331.3,1601171.7,4158621.7,1596707.978,2378990.011,782282.033,99.7212215279598,36.236675576346244,3,False,True,False,9.0,517.0
543,820.0,Отдел культуры и спорта района (города областного значения),758890.0,258097.0,26578.0,26578.0,26578.0,25130.107,25130.107,0.0,94.55228760629092,94.55228760629092,3,False,True,False,9.0,517.0
