id,code,name,utv,utch,plg,plgp,plgo,sumrg,obz,obzsumrg,plgpsumrg,plgsumrg,level,isLeaf,loaded,expanded
1,0,Итого,20173032001.0,20173032001.0,20265107708.0,11834215114.4,15890462019.0,11233069291.257,12197652961.405,964583670.1480007,94.92027297685742,55.43059258857308,0,True,True,False
2,101,Администрация Президента Республики Казахстан,18409928.0,18409928.0,18409928.0,9197746.0,12062878.0,8981348.007,11831210.11,2849862.103,97.6472714836874,48.78535107252999,0,True,True,False
3,106,Национальный центр по правам человека,1300889.0,1300889.0,1303191.9,864690.9,898277.9,765207.665,797873.978,32666.312999999966,88.4949367456047,58.717957424382405,0,True,True,False
4,107,Аппарат Высшего Судебного Совета Республики Казахстан      ,823560.0,823560.0,750323.0,441526.8,487273.7,435596.356,468641.374,33045.01799999998,98.6568326090285,58.054511990169566,0,True,True,False
5,109,Аппарат Правительства Республики Казахстан,6150082.0,6150082.0,6457190.0,3878763.0,4472259.0,3455348.891,4135402.397,680053.506,89.08378498505837,53.511649664947136,0,True,True,False
6,201,Министерство внутренних дел Республики Казахстан,598149910.0,598149910.0,599476126.5,344881166.6,422086515.3,307183380.125,400486511.865,93303131.74000001,89.06934036246675,51.24197053825462,0,True,True,False
7,202,Министерство по чрезвычайным ситуациям Республики Казахстан,237734294.0,237734294.0,225578533.8,135480971.5,165333951.4,108325358.173,152976499.204,44651141.031,79.95614216052473,48.021128760878575,0,True,True,False
8,204,Министерство иностранных дел Республики Казахстан,112112109.0,112112109.0,109953624.8,71642835.5,74468288.3,69537979.302,72947981.353,3410002.050999999,97.06201438942209,63.2430076120601,0,True,True,False
9,207,Министерство экологии и природных ресурсов Республики Казахстан,88857893.0,88857893.0,86673894.6,52412079.9,72796072.9,43680696.285,60682853.755,17002157.470000006,83.34089463410133,50.39660036806515,0,True,True,False
10,208,Министерство обороны Республики Казахстан,575039724.0,575039724.0,566559952.9,315244112.6,382906728.4,310295860.623,361281699.816,50985839.19299996,98.43034277906449,54.76840695052946,0,True,True,False
11,211,Министерство торговли и интеграции Республики Казахстан,20755203.0,20755203.0,19166199.0,12068667.1,17636911.0,11729056.737,14691693.42,2962636.683,97.18601598514553,61.19657182417859,0,True,True,False
12,212,Министерство сельского хозяйства Республики Казахстан,499556079.0,499556079.0,569476420.5,306190282.9,503837900.6,301978546.207,335748480.477,33769934.26999998,98.624470818241,53.02740119456799,0,True,True,False
13,213,Министерство труда и социальной защиты населения Республики  Казахстан,46454788.0,46454788.0,45938301.4,12855648.7,31857019.7,9036067.496,10884497.879,1848430.3830000013,70.288693374143,19.670007859715945,0,True,True,False
14,217,Министерство финансов Республики Казахстан,10932084632.0,10932084632.0,10711875257.1,6766931541.8,8712890970.2,6766624550.081,6782520974.467,15896424.38599968,99.99546335414946,63.16937406077404,0,True,True,False
15,221,Министерство юстиции Республики Казахстан,46094819.0,46094819.0,44318349.3,21311443.4,38319891.1,19588108.406,33276627.788,13688519.382,91.91356980541262,44.19864168090755,0,True,True,False
16,223,"Министерство цифрового развития, инноваций и аэрокосмической промышленности Республики Казахстан",208642336.0,208642336.0,221148710.2,101483942.3,192228606.2,67420102.819,161660255.735,94240152.91600001,66.43425678093706,30.486319706783444,0,True,True,False
17,224,Министерство просвещения Республики Казахстан ,177020342.0,177020342.0,182086471.7,90989490.7,159869694.8,89840645.47,99259337.691,9418692.221,98.7373868991224,49.33954984751347,0,True,True,False
18,226,Министерство здравоохранения Республики Казахстан,2249329142.0,2249329142.0,2300480981.3,1328173528.1,1381101228.5,973421722.095,986470420.931,13048698.835999966,73.2902517254289,42.31383480270809,0,True,True,False
19,227,Министерство науки и высшего образования Республики Казахстан,713054201.0,713054201.0,666572452.5,339247675.0,520133817.7,336574627.461,491343940.149,154769312.68799996,99.21206606972326,50.49332989964809,0,True,True,False
20,228,Министерство транспорта Республики Казахстан,697161262.0,697161262.0,732305273.4,408406365.0,651910504.3,406460738.13,550487893.477,144027155.347,99.52360515488049,55.50427572955397,0,True,True,False
21,229,Министерство промышленности и строительства Республики Казахстан,1045048167.0,1045048167.0,1086413884.5,387387622.4,847031221.5,341362517.716,349798038.604,8435520.887999952,88.1191080915651,31.421037837076724,0,True,True,False
22,241,Министерство энергетики Республики Казахстан,103481496.0,103481496.0,130419928.5,54801287.6,127256798.5,54704750.769,56560148.096,1855397.3269999996,99.82384203870421,41.94508569217626,0,True,True,False
23,243,Министерство национальной экономики Республики Казахстан  ,215043254.0,215043254.0,227112158.6,109279260.3,202103263.6,101993984.582,103893841.579,1899856.996999994,93.3333409303833,44.90908157921933,0,True,True,False
24,406,Высшая аудиторская палата Республики Казахстан,5773816.0,5773816.0,5783763.7,3755312.7,4336714.7,3312734.953,3983872.013,671137.0599999996,88.21462332550895,57.27645742166126,0,True,True,False
25,410,Комитет национальной безопасности Республики Казахстан,586881147.0,586881147.0,578074610.0,301379676.4,377394125.7,297431278.047,297431278.047,0.0,98.68989229792669,51.452057035855624,0,True,True,False
26,501,Верховный Суд Республики Казахстан,94839916.0,94839916.0,95854117.4,63099746.0,68054701.4,53014542.077,58876682.914,5862140.8369999975,84.01704513517376,55.30752722469906,0,True,True,False
27,502,Генеральная прокуратура Республики Казахстан,62905191.0,62905191.0,62814424.2,33366941.9,39916765.2,29128850.073,36555888.61,7427038.5370000005,87.2985308641665,46.372868085607635,0,True,True,False
28,608,Агентство Республики Казахстан по делам государственной службы,8448555.0,8448555.0,7826231.6,4622643.1,6412773.6,4583668.611,6001066.243,1417397.6320000002,99.15687869132704,58.56801645123817,0,True,True,False
29,624,Агентство Республики Казахстан по противодействию коррупции (Антикоррупционная служба),29688770.0,29688770.0,30635688.5,19632944.9,20551000.5,17129463.973,18184221.324,1054757.3509999998,87.24857152224781,55.91342911389114,0,True,True,False
30,625,Агентство Республики Казахстан по регулированию и развитию финансового рынка,10722453.0,10722453.0,10722453.0,7479109.0,7832573.0,4801598.849,4801598.849,0.0,64.20014535153854,44.78078709228196,0,True,True,False
31,626,ГУ Агентство по стратегическому планированию и реформам Республики Казахстан,22218006.0,22218006.0,22465877.9,12482462.3,15532122.9,12470914.272,14636531.949,2165617.676999999,99.90748597734598,55.51046937720605,0,True,True,False
32,627,ГУ Агентство по защите и развитию конкуренции Республики Казахстан,3669550.0,3669550.0,3924184.3,2351612.0,2588450.3,2235811.445,2430396.993,194585.54799999995,95.07569467242044,56.97518959545299,0,True,True,False
33,628,Агентство Республики Казахстан по финансовому мониторингу,23594670.0,23594670.0,24159346.1,14144795.7,15407557.1,12904827.695,13944100.129,1039272.4340000004,91.23375104668355,53.41546762724675,0,True,True,False
34,637,Аппарат Конституционного Суда Республики Казахстан,1641424.0,1641424.0,1641424.0,1037054.0,1136817.0,900827.84,1027691.279,126863.43900000001,86.86412086545155,54.88087416779577,0,True,True,False
35,650,Министерство туризма и спорта Республики Казахстан,210380758.0,210380758.0,223694120.7,86786396.1,219072836.3,86738447.228,140306876.72,53568429.492,99.94475070500134,38.77547025222286,0,True,True,False
36,651,Министерство культуры и информации Республики Казахстан,105975523.0,105975523.0,105981014.3,59264383.2,93480714.4,55736980.122,91057201.655,35320221.533,94.04802195258483,52.59147639805142,0,True,True,False
37,652,Министерство водных ресурсов и ирригации Республики Казахстан,110478277.0,110478277.0,120865057.7,66437184.6,109846456.5,62107957.886,96228973.38,34121015.493999995,93.48372942040653,51.38619801941318,0,True,True,False
38,681,Служба государственной охраны Республики Казахстан,47586666.0,47586666.0,50404242.9,25693259.7,34792664.2,25670485.051,25670485.051,0.0,99.91135944109108,50.92921463363553,0,True,True,False
39,690,Центральная избирательная комиссия Республики Казахстан,12847286.0,12847286.0,12246767.9,5677319.9,9080393.9,4920517.692,8475185.387,3554667.6950000003,86.66972759452923,40.17809214788826,0,True,True,False
40,693,Управление материально-технического обеспечения ,27894336.0,27894336.0,34777288.3,24541734.3,30616342.8,20288883.376,29804936.932,9516053.556000002,82.67094382160268,58.339463390536984,0,True,True,False
41,694,Управление Делами Президента Республики Казахстан,215181547.0,215181547.0,320759942.0,229291890.5,312718936.9,206295308.671,306031149.785,99735841.11400002,89.97060830243362,64.31454856386026,0,True,True,False
