id,code,name,utv,utch,plg,plgp,plgo,sumrg,obz,obzsumrg,plgpsumrg,plgsumrg,level,isLeaf,loaded,expanded,parentCode,parent_id
314,213.0,Министерство труда и социальной защиты населения Республики Казахстан,28980000.0,28980000.0,28980000.0,0.0,16215000.0,0.0,0.0,0.0,0.0,0.0,4,False,True,False,9.0,313.0
315,7.0,Жилищно-коммунальное хозяйство,13824497.0,13824497.0,13824497.0,12799345.0,13824497.0,7000000.0,7000000.0,0.0,54.690298605123935,50.63475365505161,2,False,True,False,1.0,311.0
316,1.0,Жилищное хозяйство,13824497.0,13824497.0,13824497.0,12799345.0,13824497.0,7000000.0,7000000.0,0.0,54.690298605123935,50.63475365505161,3,False,True,False,7.0,315.0
317,229.0,Министерство промышленности и строительства Республики Казахстан,13824497.0,13824497.0,13824497.0,12799345.0,13824497.0,7000000.0,7000000.0,0.0,54.690298605123935,50.63475365505161,4,False,True,False,1.0,316.0
318,8.0,"Культура, спорт, туризм и информационное пространство",85000000.0,85000000.0,85000000.0,15000000.0,85000000.0,15000000.0,15000000.0,0.0,100.0,17.647058823529413,2,False,True,False,1.0,311.0
319,4.0,Туризм,85000000.0,85000000.0,85000000.0,15000000.0,85000000.0,15000000.0,15000000.0,0.0,100.0,17.647058823529413,3,False,True,False,8.0,318.0
320,650.0,Министерство туризма и спорта Республики Казахстан,85000000.0,85000000.0,85000000.0,15000000.0,85000000.0,15000000.0,15000000.0,0.0,100.0,17.647058823529413,4,False,True,False,4.0,319.0
321,10.0,"Сельское, водное, лесное, рыбное хозяйство, особо охраняемые природные территории, охрана окружающей среды и животного мира, земельные отношения",370000000.0,370000000.0,370000000.0,200896833.0,337500833.0,200896833.0,200896833.0,0.0,100.0,54.296441351351355,2,False,True,False,1.0,311.0
322,1.0,Сельское хозяйство,340000000.0,340000000.0,340000000.0,188000000.0,324604000.0,188000000.0,188000000.0,0.0,100.0,55.294117647058826,3,False,True,False,10.0,321.0
323,212.0,Министерство сельского хозяйства Республики Казахстан,340000000.0,340000000.0,340000000.0,188000000.0,324604000.0,188000000.0,188000000.0,0.0,100.0,55.294117647058826,4,False,True,False,1.0,322.0
324,9.0,"Прочие услуги в области сельского, водного, лесного, рыбного  хозяйства, охраны окружающей среды и земельных отношений",30000000.0,30000000.0,30000000.0,12896833.0,12896833.0,12896833.0,12896833.0,0.0,100.0,42.989443333333334,3,False,True,False,10.0,321.0
325,243.0,Министерство национальной экономики Республики Казахстан  ,30000000.0,30000000.0,30000000.0,12896833.0,12896833.0,12896833.0,12896833.0,0.0,100.0,42.989443333333334,4,False,True,False,9.0,324.0
326,11.0,"Промышленность, архитектурная, градостроительная и строительная деятельность",120000000.0,120000000.0,120000000.0,0.0,0.0,0.0,0.0,0.0,0.0,0.0,2,False,True,False,1.0,311.0
327,1.0,Промышленность,120000000.0,120000000.0,120000000.0,0.0,0.0,0.0,0.0,0.0,0.0,0.0,3,False,True,False,11.0,326.0
328,229.0,Министерство промышленности и строительства Республики Казахстан,120000000.0,120000000.0,120000000.0,0.0,0.0,0.0,0.0,0.0,0.0,0.0,4,False,True,False,1.0,327.0
329,2.0,ПОГАШЕНИЕ БЮДЖЕТНЫХ КРЕДИТОВ,254326922.0,254326922.0,254326922.0,70567179.0,0.0,123530516.121,0.0,0.0,175.05378261046823,48.57154529672639,1,False,True,False,3.0,306.0
330,5.0,Погашение бюджетных кредитов,254326922.0,254326922.0,254326922.0,70567179.0,0.0,123530516.121,0.0,0.0,175.05378261046823,48.57154529672639,2,False,True,False,2.0,329.0
331,1.0,Погашение бюджетных кредитов,254326922.0,254326922.0,254326922.0,70567179.0,0.0,123529781.181,0.0,0.0,175.05274113479865,48.571256322207205,3,False,True,False,5.0,330.0
332,1.0,"Погашение бюджетных кредитов, выданных из государственного бюджета",254326922.0,254326922.0,254326922.0,70567179.0,0.0,112402459.901,0.0,0.0,159.28433231120093,44.196052473359465,4,False,True,False,1.0,331.0
333,2.0,Возврат сумм неиспользованных бюджетных кредитов,0.0,0.0,0.0,0.0,0.0,11127321.28,0.0,0.0,0.0,0.0,4,False,True,False,1.0,331.0
334,2.0,Возврат требований по оплаченным государственным гарантиям,0.0,0.0,0.0,0.0,0.0,734.94,0.0,0.0,0.0,0.0,3,False,True,False,5.0,330.0
335,1.0,Возврат юридическими лицами требований по оплаченным государственным гарантиям,0.0,0.0,0.0,0.0,0.0,734.94,0.0,0.0,0.0,0.0,4,False,True,False,2.0,334.0
336,4.0,IV. САЛЬДО ПО ОПЕРАЦИЯМ С ФИНАНСОВЫМИ АКТИВАМИ,49929694.0,49929694.0,49929694.0,49926037.0,0.0,49612136.413,0.0,0.0,99.37126876903929,99.36399052035047,0,False,True,False,,
341,1.0,ПРИОБРЕТЕНИЕ ФИНАНСОВЫХ АКТИВОВ,49929694.0,49929694.0,49929694.0,49926037.0,49929694.0,49612136.412,49612136.412,0.0,99.37126876703633,99.36399051834766,1,False,True,False,4.0,336.0
342,1.0,Государственные услуги общего характера,9929694.0,9929694.0,9929694.0,9926037.0,9929694.0,9612136.412,9612136.412,0.0,96.8376040911393,96.80193983822663,2,False,True,False,1.0,341.0
343,2.0,Финансовая деятельность,9929694.0,9929694.0,9929694.0,9926037.0,9929694.0,9612136.412,9612136.412,0.0,96.8376040911393,96.80193983822663,3,False,True,False,1.0,342.0
344,217.0,Министерство финансов Республики Казахстан,7629694.0,7629694.0,7629694.0,7626037.0,7629694.0,7312136.606,7312136.606,0.0,95.88383331997996,95.83787509695671,4,False,True,False,2.0,343.0
345,243.0,Министерство национальной экономики Республики Казахстан  ,2300000.0,2300000.0,2300000.0,2300000.0,2300000.0,2299999.806,2299999.806,0.0,99.99999156521739,99.99999156521739,4,False,True,False,2.0,343.0
346,10.0,"Сельское, водное, лесное, рыбное хозяйство, особо охраняемые природные территории, охрана окружающей среды и животного мира, земельные отношения",40000000.0,40000000.0,40000000.0,40000000.0,40000000.0,40000000.0,40000000.0,0.0,100.0,100.0,2,False,True,False,1.0,341.0
347,1.0,Сельское хозяйство,40000000.0,40000000.0,40000000.0,40000000.0,40000000.0,40000000.0,40000000.0,0.0,100.0,100.0,3,False,True,False,10.0,346.0
348,212.0,Министерство сельского хозяйства Республики Казахстан,40000000.0,40000000.0,40000000.0,40000000.0,40000000.0,40000000.0,40000000.0,0.0,100.0,100.0,4,False,True,False,1.0,347.0
349,5.0,V. ДЕФИЦИТ (ПРОФИЦИТ) БЮДЖЕТА,-3534767762.0,-3534767762.0,-3598753336.0,-2118670068.4,0.0,-2804991532.354,0.0,0.0,132.39397555053506,77.94342291521811,0,False,True,False,,
354,6.0,VI. НЕНЕФТЯНОЙ ДЕФИЦИТ (ПРОФИЦИТ) БЮДЖЕТА,-8768687762.0,-8768687762.0,-8832673336.0,-6484611762.4,0.0,-7111054993.141,0.0,0.0,109.66045853929656,80.50852468592868,0,False,True,False,,
359,7.0,VII. ФИНАНСИРОВАНИЕ ДЕФИЦИТА (ИСПОЛЬЗОВАНИЕ ПРОФИЦИТА) БЮДЖЕТА,3534767762.0,3534767762.0,3598753336.0,2118670068.4,0.0,2804991532.354,0.0,0.0,132.39397555053506,77.94342291521811,0,False,True,False,,
364,1.0,ПОСТУПЛЕНИЕ ЗАЙМОВ,6551342292.0,6551342292.0,6551342292.0,4705000000.0,0.0,4854364088.155,0.0,0.0,103.17458210743888,74.09724407290975,1,False,True,False,7.0,359.0
365,7.0,Поступления займов,6551342292.0,6551342292.0,6551342292.0,4705000000.0,0.0,4854364088.155,0.0,0.0,103.17458210743888,74.09724407290975,2,False,True,False,1.0,364.0
366,1.0,Внутренние государственные займы,5168422509.0,5168422509.0,5168422509.0,4638404265.0,0.0,4793562215.355,0.0,0.0,103.34507174214578,92.74710430518712,3,False,True,False,7.0,365.0
367,1.0,Государственные эмиссионные ценные бумаги,5168422509.0,5168422509.0,5168422509.0,4638404265.0,0.0,4793562215.355,0.0,0.0,103.34507174214578,92.74710430518712,4,False,True,False,1.0,366.0
368,2.0,Внешние государственные займы,1382919783.0,1382919783.0,1382919783.0,66595735.0,0.0,60801872.8,0.0,0.0,91.29995006436972,4.396630487713545,3,False,True,False,7.0,365.0
369,1.0,Договоры займа,692919783.0,692919783.0,692919783.0,66595735.0,0.0,60801872.8,0.0,0.0,91.29995006436972,8.77473472279258,4,False,True,False,2.0,368.0
370,2.0,Государственные эмиссионные ценные бумаги,690000000.0,690000000.0,690000000.0,0.0,0.0,0.0,0.0,0.0,0.0,0.0,4,False,True,False,2.0,368.0
371,2.0,ПОГАШЕНИЕ ЗАЙМОВ,3016574530.0,3016574530.0,3016574530.0,2080115991.1,2080115991.1,2080115990.451,2080115990.451,0.0,99.99999996879983,68.95622732885039,1,False,True,False,7.0,359.0
372,16.0,Погашение займов,3016574530.0,3016574530.0,3016574530.0,2080115991.1,2080115991.1,2080115990.451,2080115990.451,0.0,99.99999996879983,68.95622732885039,2,False,True,False,2.0,371.0
373,1.0,Погашение займов,3016574530.0,3016574530.0,3016574530.0,2080115991.1,2080115991.1,2080115990.451,2080115990.451,0.0,99.99999996879983,68.95622732885039,3,False,True,False,16.0,372.0
374,217.0,Министерство финансов Республики Казахстан,3016574530.0,3016574530.0,3016574530.0,2080115991.1,2080115991.1,2080115990.451,2080115990.451,0.0,99.99999996879983,68.95622732885039,4,False,True,False,1.0,373.0
375,,ИСПОЛЬЗУЕМЫЕ ОСТАТКИ БЮДЖЕТНЫХ СРЕДСТВ,0.0,0.0,63985574.0,-506213940.5,0.0,30743434.65,0.0,0.0,-6.073209801301392,48.047446835438244,0,True,True,False,,
376,,Остатки бюджетных средств на начало финансового года,0.0,0.0,0.0,0.0,0.0,61307366.416,0.0,0.0,0.0,0.0,0,True,True,False,,
377,,Остатки бюджетных средств на конец отчетного периода,0.0,0.0,0.0,0.0,0.0,30563931.765,0.0,0.0,0.0,0.0,0,True,True,False,,
378,,Справочно: Остатки бюджетных средств,0.0,0.0,0.0,0.0,0.0,0.0,0.0,0.0,0.0,0.0,0,True,True,False,,
379,,в том числе за счет внешних займов,0.0,0.0,0.0,0.0,0.0,1273483.3,0.0,0.0,0.0,0.0,0,True,True,False,,
