id,code,name,utv,utch,plg,plgp,plgo,sumrg,obz,obzsumrg,plgpsumrg,plgsumrg,level,isLeaf,loaded,expanded,parentCode,parent_id
305,1.0,Жилищное хозяйство,3522357.0,3522357.0,3522357.0,3053078.1,3135454.0,3053078.1,3053078.1,0.0,100.0,86.67713408947475,3,False,True,False,7.0,304.0
306,249.0,Министерство индустрии и инфраструктурного развития Республики Казахстан,3522357.0,3522357.0,3522357.0,3053078.1,3135454.0,3053078.1,3053078.1,0.0,100.0,86.67713408947475,4,False,True,False,1.0,305.0
307,10.0,"Сельское, водное, лесное, рыбное хозяйство, особо охраняемые природные территории, охрана окружающей среды и животного мира, земельные отношения",212396965.0,360000000.0,360000000.0,214423341.0,239379076.0,214423341.0,214423341.0,0.0,100.0,59.56203916666667,2,False,True,False,1.0,300.0
308,1.0,Сельское хозяйство,192396965.0,340000000.0,340000000.0,211183712.0,223715726.0,211183712.0,211183712.0,0.0,100.0,62.11285647058824,3,False,True,False,10.0,307.0
309,212.0,Министерство сельского хозяйства Республики Казахстан,192396965.0,340000000.0,340000000.0,211183712.0,223715726.0,211183712.0,211183712.0,0.0,100.0,62.11285647058824,4,False,True,False,1.0,308.0
310,9.0,"Прочие услуги в области сельского, водного, лесного, рыбного  хозяйства, охраны окружающей среды и земельных отношений",20000000.0,20000000.0,20000000.0,3239629.0,15663350.0,3239629.0,3239629.0,0.0,100.0,16.198145,3,False,True,False,10.0,307.0
311,243.0,Министерство национальной экономики Республики Казахстан  ,20000000.0,20000000.0,20000000.0,3239629.0,15663350.0,3239629.0,3239629.0,0.0,100.0,16.198145,4,False,True,False,9.0,310.0
312,11.0,"Промышленность, архитектурная, градостроительная и строительная деятельность",14400000.0,34400000.0,34400000.0,0.0,14400000.0,0.0,0.0,0.0,0.0,0.0,2,False,True,False,1.0,300.0
313,1.0,Промышленность,14400000.0,34400000.0,34400000.0,0.0,14400000.0,0.0,0.0,0.0,0.0,0.0,3,False,True,False,11.0,312.0
314,249.0,Министерство индустрии и инфраструктурного развития Республики Казахстан,14400000.0,34400000.0,34400000.0,0.0,14400000.0,0.0,0.0,0.0,0.0,0.0,4,False,True,False,1.0,313.0
315,13.0,Прочие,20000000.0,234497670.0,234497670.0,182600000.0,222300000.0,182600000.0,182600000.0,0.0,100.0,77.86857754279606,2,False,True,False,1.0,300.0
316,3.0,Поддержка предпринимательской деятельности и защита конкуренции,0.0,162600000.0,162600000.0,162600000.0,162600000.0,162600000.0,162600000.0,0.0,100.0,100.0,3,False,True,False,13.0,315.0
317,243.0,Министерство национальной экономики Республики Казахстан  ,0.0,162600000.0,162600000.0,162600000.0,162600000.0,162600000.0,162600000.0,0.0,100.0,100.0,4,False,True,False,3.0,316.0
318,9.0,Прочие,20000000.0,71897670.0,71897670.0,20000000.0,59700000.0,20000000.0,20000000.0,0.0,100.0,27.817313134069575,3,False,True,False,13.0,315.0
319,249.0,Министерство индустрии и инфраструктурного развития Республики Казахстан,20000000.0,71897670.0,71897670.0,20000000.0,59700000.0,20000000.0,20000000.0,0.0,100.0,27.817313134069575,4,False,True,False,9.0,318.0
320,2.0,ПОГАШЕНИЕ БЮДЖЕТНЫХ КРЕДИТОВ,253421177.0,244488049.0,244488049.0,56071235.0,0.0,82244368.758,0.0,0.0,146.67836147714598,33.63942290610696,1,False,True,False,3.0,295.0
321,5.0,Погашение бюджетных кредитов,253421177.0,244488049.0,244488049.0,56071235.0,0.0,82244368.758,0.0,0.0,146.67836147714598,33.63942290610696,2,False,True,False,2.0,320.0
322,1.0,Погашение бюджетных кредитов,253421177.0,244488049.0,244488049.0,56071235.0,0.0,82179074.856,0.0,0.0,146.56191335182825,33.61271652832405,3,False,True,False,5.0,321.0
323,1.0,"Погашение бюджетных кредитов, выданных из государственного бюджета",253421177.0,244487877.0,244487877.0,56071063.0,0.0,81359451.421,0.0,0.0,145.10060460419666,33.27749924426723,4,False,True,False,1.0,322.0
324,2.0,Возврат сумм неиспользованных бюджетных кредитов,0.0,172.0,172.0,172.0,0.0,819623.435,0.0,0.0,476525.2529069768,476525.2529069768,4,False,True,False,1.0,322.0
325,2.0,Возврат требований по оплаченным государственным гарантиям,0.0,0.0,0.0,0.0,0.0,65293.902,0.0,0.0,0.0,0.0,3,False,True,False,5.0,321.0
326,1.0,Возврат юридическими лицами требований по оплаченным государственным гарантиям,0.0,0.0,0.0,0.0,0.0,65293.902,0.0,0.0,0.0,0.0,4,False,True,False,2.0,325.0
327,4.0,IV. САЛЬДО ПО ОПЕРАЦИЯМ С ФИНАНСОВЫМИ АКТИВАМИ,138734638.0,208212300.0,208212300.0,155553278.6,0.0,155135372.558,0.0,0.0,99.73134218335916,74.5082651495613,0,False,True,False,,
332,1.0,ПРИОБРЕТЕНИЕ ФИНАНСОВЫХ АКТИВОВ,138734638.0,208212300.0,208212300.0,155553278.6,155553278.6,155135372.558,155135372.558,0.0,99.73134218335916,74.5082651495613,1,False,True,False,4.0,327.0
333,1.0,Государственные услуги общего характера,142220.0,142220.0,142220.0,135372.6,135372.6,135372.558,135372.558,0.0,99.9999689745192,95.1853171143299,2,False,True,False,1.0,332.0
334,2.0,Финансовая деятельность,142220.0,142220.0,142220.0,135372.6,135372.6,135372.558,135372.558,0.0,99.9999689745192,95.1853171143299,3,False,True,False,1.0,333.0
335,217.0,Министерство финансов Республики Казахстан,142220.0,142220.0,142220.0,135372.6,135372.6,135372.558,135372.558,0.0,99.9999689745192,95.1853171143299,4,False,True,False,2.0,334.0
336,4.0,Образование,2917807.0,2917807.0,2917807.0,0.0,0.0,0.0,0.0,0.0,0.0,0.0,2,False,True,False,1.0,332.0
337,6.0,Высшее и послевузовское образование,2917807.0,2917807.0,2917807.0,0.0,0.0,0.0,0.0,0.0,0.0,0.0,3,False,True,False,4.0,336.0
338,227.0,Министерство науки и высшего образования Республики Казахстан,2917807.0,2917807.0,2917807.0,0.0,0.0,0.0,0.0,0.0,0.0,0.0,4,False,True,False,6.0,337.0
339,8.0,"Культура, спорт, туризм и информационное пространство",674611.0,674611.0,674611.0,417906.0,417906.0,0.0,0.0,0.0,0.0,0.0,2,False,True,False,1.0,332.0
340,1.0,Деятельность в области культуры,674611.0,674611.0,674611.0,417906.0,417906.0,0.0,0.0,0.0,0.0,0.0,3,False,True,False,8.0,339.0
341,240.0,Министерство культуры и спорта Республики Казахстан  ,674611.0,674611.0,674611.0,417906.0,417906.0,0.0,0.0,0.0,0.0,0.0,4,False,True,False,1.0,340.0
342,10.0,"Сельское, водное, лесное, рыбное хозяйство, особо охраняемые природные территории, охрана окружающей среды и животного мира, земельные отношения",0.0,20000000.0,20000000.0,20000000.0,20000000.0,20000000.0,20000000.0,0.0,100.0,100.0,2,False,True,False,1.0,332.0
343,1.0,Сельское хозяйство,0.0,20000000.0,20000000.0,20000000.0,20000000.0,20000000.0,20000000.0,0.0,100.0,100.0,3,False,True,False,10.0,342.0
344,212.0,Министерство сельского хозяйства Республики Казахстан,0.0,20000000.0,20000000.0,20000000.0,20000000.0,20000000.0,20000000.0,0.0,100.0,100.0,4,False,True,False,1.0,343.0
345,11.0,"Промышленность, архитектурная, градостроительная и строительная деятельность",135000000.0,135000000.0,135000000.0,135000000.0,135000000.0,135000000.0,135000000.0,0.0,100.0,100.0,2,False,True,False,1.0,332.0
346,1.0,Промышленность,135000000.0,135000000.0,135000000.0,135000000.0,135000000.0,135000000.0,135000000.0,0.0,100.0,100.0,3,False,True,False,11.0,345.0
347,249.0,Министерство индустрии и инфраструктурного развития Республики Казахстан,135000000.0,135000000.0,135000000.0,135000000.0,135000000.0,135000000.0,135000000.0,0.0,100.0,100.0,4,False,True,False,1.0,346.0
348,13.0,Прочие,0.0,49477662.0,49477662.0,0.0,0.0,0.0,0.0,0.0,0.0,0.0,2,False,True,False,1.0,332.0
349,3.0,Поддержка предпринимательской деятельности и защита конкуренции,0.0,49477662.0,49477662.0,0.0,0.0,0.0,0.0,0.0,0.0,0.0,3,False,True,False,13.0,348.0
350,243.0,Министерство национальной экономики Республики Казахстан  ,0.0,49477662.0,49477662.0,0.0,0.0,0.0,0.0,0.0,0.0,0.0,4,False,True,False,3.0,349.0
351,5.0,V. ДЕФИЦИТ (ПРОФИЦИТ) БЮДЖЕТА,-3200000000.0,-3208592837.0,-3208592837.0,-2603489819.1,0.0,-3148429961.937,0.0,0.0,120.931141686791,98.124945166952,0,False,True,False,,
356,6.0,VI. ФИНАНСИРОВАНИЕ ДЕФИЦИТА (ИСПОЛЬЗОВАНИЕ ПРОФИЦИТА) БЮДЖЕТА,-8161315600.0,-8969908437.0,-8969908437.0,-6034694917.1,0.0,-6408970547.763,0.0,0.0,106.20206382931548,71.44967635708096,0,False,True,False,,
361,7.0,VII. ФИНАНСИРОВАНИЕ ДЕФИЦИТА (ИСПОЛЬЗОВАНИЕ ПРОФИЦИТА) БЮДЖЕТА,3200000000.0,3208592837.0,3208592837.0,2603489819.1,0.0,3148429961.937,0.0,0.0,120.931141686791,98.124945166952,0,False,True,False,,
366,1.0,ПОСТУПЛЕНИЕ ЗАЙМОВ,5751756176.0,5476711591.0,5476711591.0,4458598035.0,0.0,4626674925.359,0.0,0.0,103.76972512524331,84.47906829642292,1,False,True,False,7.0,361.0
367,7.0,Поступления займов,5751756176.0,5476711591.0,5476711591.0,4458598035.0,0.0,4626674925.359,0.0,0.0,103.76972512524331,84.47906829642292,2,False,True,False,1.0,366.0
368,1.0,Внутренние государственные займы,3959802156.0,3741298673.0,3741298673.0,3494496517.0,0.0,4411512375.775,0.0,0.0,126.241716204721,117.91393206887655,3,False,True,False,7.0,367.0
369,1.0,Государственные эмиссионные ценные бумаги,3959802156.0,3741298673.0,3741298673.0,3494496517.0,0.0,4411512375.775,0.0,0.0,126.241716204721,117.91393206887655,4,False,True,False,1.0,368.0
370,2.0,Внешние государственные займы,1791954020.0,1735412918.0,1735412918.0,964101518.0,0.0,215162549.584,0.0,0.0,22.317416326690193,12.39834896653685,3,False,True,False,7.0,367.0
371,1.0,Договоры займа,851954020.0,1030412918.0,1030412918.0,259101518.0,0.0,215162549.584,0.0,0.0,83.04179429161044,20.881196831424038,4,False,True,False,2.0,370.0
372,2.0,Государственные эмиссионные ценные бумаги,940000000.0,705000000.0,705000000.0,705000000.0,0.0,0.0,0.0,0.0,0.0,0.0,4,False,True,False,2.0,370.0
373,2.0,ПОГАШЕНИЕ ЗАЙМОВ,2551756176.0,2551756176.0,2551756176.0,1562644331.5,1562644331.5,1562644330.662,1562644330.662,0.0,99.99999994637295,61.23799543855791,1,False,True,False,7.0,361.0
374,16.0,Погашение займов,2551756176.0,2551756176.0,2551756176.0,1562644331.5,1562644331.5,1562644330.662,1562644330.662,0.0,99.99999994637295,61.23799543855791,2,False,True,False,2.0,373.0
375,1.0,Погашение займов,2551756176.0,2551756176.0,2551756176.0,1562644331.5,1562644331.5,1562644330.662,1562644330.662,0.0,99.99999994637295,61.23799543855791,3,False,True,False,16.0,374.0
376,217.0,Министерство финансов Республики Казахстан,2551756176.0,2551756176.0,2551756176.0,1562644331.5,1562644331.5,1562644330.662,1562644330.662,0.0,99.99999994637295,61.23799543855791,4,False,True,False,1.0,375.0
377,,ИСПОЛЬЗУЕМЫЕ ОСТАТКИ БЮДЖЕТНЫХ СРЕДСТВ,0.0,283637422.0,283637422.0,-292463884.4,0.0,84399367.241,0.0,0.0,-28.858047691648594,29.756076136173597,0,True,True,False,,
378,,Остатки бюджетных средств на начало финансового года,0.0,0.0,0.0,0.0,0.0,283637422.466,0.0,0.0,0.0,0.0,0,True,True,False,,
379,,Остатки бюджетных средств на конец отчетного периода,0.0,0.0,0.0,0.0,0.0,199238055.225,0.0,0.0,0.0,0.0,0,True,True,False,,
