id,code,name,utv,utch,plg,plgp,plgo,sumrg,obz,obzsumrg,plgpsumrg,plgsumrg,level,isLeaf,loaded,expanded,parentCode,parent_id
318,8.0,"Культура, спорт, туризм и информационное пространство",85000000.0,85000000.0,85000000.0,5000000.0,85000000.0,5000000.0,5000000.0,0.0,100.0,5.88235294117647,2,False,True,False,1.0,311.0
319,4.0,Туризм,85000000.0,85000000.0,85000000.0,5000000.0,85000000.0,5000000.0,5000000.0,0.0,100.0,5.88235294117647,3,False,True,False,8.0,318.0
320,650.0,Министерство туризма и спорта Республики Казахстан,85000000.0,85000000.0,85000000.0,5000000.0,85000000.0,5000000.0,5000000.0,0.0,100.0,5.88235294117647,4,False,True,False,4.0,319.0
321,10.0,"Сельское, водное, лесное, рыбное хозяйство, особо охраняемые природные территории, охрана окружающей среды и животного мира, земельные отношения",370000000.0,370000000.0,370000000.0,171666288.0,311223088.0,171666288.0,171666288.0,0.0,100.0,46.39629405405405,2,False,True,False,1.0,311.0
322,1.0,Сельское хозяйство,340000000.0,340000000.0,340000000.0,168000000.0,307556800.0,168000000.0,168000000.0,0.0,100.0,49.411764705882355,3,False,True,False,10.0,321.0
323,212.0,Министерство сельского хозяйства Республики Казахстан,340000000.0,340000000.0,340000000.0,168000000.0,307556800.0,168000000.0,168000000.0,0.0,100.0,49.411764705882355,4,False,True,False,1.0,322.0
324,9.0,"Прочие услуги в области сельского, водного, лесного, рыбного  хозяйства, охраны окружающей среды и земельных отношений",30000000.0,30000000.0,30000000.0,3666288.0,3666288.0,3666288.0,3666288.0,0.0,100.0,12.22096,3,False,True,False,10.0,321.0
325,243.0,Министерство национальной экономики Республики Казахстан  ,30000000.0,30000000.0,30000000.0,3666288.0,3666288.0,3666288.0,3666288.0,0.0,100.0,12.22096,4,False,True,False,9.0,324.0
326,11.0,"Промышленность, архитектурная, градостроительная и строительная деятельность",120000000.0,120000000.0,120000000.0,0.0,0.0,0.0,0.0,0.0,0.0,0.0,2,False,True,False,1.0,311.0
327,1.0,Промышленность,120000000.0,120000000.0,120000000.0,0.0,0.0,0.0,0.0,0.0,0.0,0.0,3,False,True,False,11.0,326.0
328,229.0,Министерство промышленности и строительства Республики Казахстан,120000000.0,120000000.0,120000000.0,0.0,0.0,0.0,0.0,0.0,0.0,0.0,4,False,True,False,1.0,327.0
329,2.0,ПОГАШЕНИЕ БЮДЖЕТНЫХ КРЕДИТОВ,254326922.0,254326922.0,254326922.0,62235946.0,0.0,117013699.639,0.0,0.0,188.01626256151067,46.009167538700446,1,False,True,False,3.0,306.0
330,5.0,Погашение бюджетных кредитов,254326922.0,254326922.0,254326922.0,62235946.0,0.0,117013699.639,0.0,0.0,188.01626256151067,46.009167538700446,2,False,True,False,2.0,329.0
331,1.0,Погашение бюджетных кредитов,254326922.0,254326922.0,254326922.0,62235946.0,0.0,117013699.539,0.0,0.0,188.01626240083183,46.00916749938098,3,False,True,False,5.0,330.0
332,1.0,"Погашение бюджетных кредитов, выданных из государственного бюджета",254326922.0,254326922.0,254326922.0,62235946.0,0.0,105886894.959,0.0,0.0,170.13784117461637,41.6341668142392,4,False,True,False,1.0,331.0
333,2.0,Возврат сумм неиспользованных бюджетных кредитов,0.0,0.0,0.0,0.0,0.0,11126804.58,0.0,0.0,0.0,0.0,4,False,True,False,1.0,331.0
334,2.0,Возврат требований по оплаченным государственным гарантиям,0.0,0.0,0.0,0.0,0.0,0.1,0.0,0.0,0.0,0.0,3,False,True,False,5.0,330.0
335,1.0,Возврат юридическими лицами требований по оплаченным государственным гарантиям,0.0,0.0,0.0,0.0,0.0,0.1,0.0,0.0,0.0,0.0,4,False,True,False,2.0,334.0
336,4.0,IV. САЛЬДО ПО ОПЕРАЦИЯМ С ФИНАНСОВЫМИ АКТИВАМИ,49929694.0,49929694.0,49929694.0,35092672.0,0.0,35092671.761,0.0,0.0,99.99999931894614,70.28417150123131,0,False,True,False,,
341,1.0,ПРИОБРЕТЕНИЕ ФИНАНСОВЫХ АКТИВОВ,49929694.0,49929694.0,49929694.0,35092672.0,40137329.0,35092671.761,35092671.761,0.0,99.99999931894614,70.28417150123131,1,False,True,False,4.0,336.0
342,1.0,Государственные услуги общего характера,9929694.0,9929694.0,9929694.0,133672.0,137329.0,133671.761,133671.761,0.0,99.99982120414148,1.3461820777155873,2,False,True,False,1.0,341.0
343,2.0,Финансовая деятельность,9929694.0,9929694.0,9929694.0,133672.0,137329.0,133671.761,133671.761,0.0,99.99982120414148,1.3461820777155873,3,False,True,False,1.0,342.0
344,217.0,Министерство финансов Республики Казахстан,7629694.0,7629694.0,7629694.0,133672.0,137329.0,133671.761,133671.761,0.0,99.99982120414148,1.7519937365771157,4,False,True,False,2.0,343.0
345,243.0,Министерство национальной экономики Республики Казахстан  ,2300000.0,2300000.0,2300000.0,0.0,0.0,0.0,0.0,0.0,0.0,0.0,4,False,True,False,2.0,343.0
346,10.0,"Сельское, водное, лесное, рыбное хозяйство, особо охраняемые природные территории, охрана окружающей среды и животного мира, земельные отношения",40000000.0,40000000.0,40000000.0,34959000.0,40000000.0,34959000.0,34959000.0,0.0,100.0,87.3975,2,False,True,False,1.0,341.0
347,1.0,Сельское хозяйство,40000000.0,40000000.0,40000000.0,34959000.0,40000000.0,34959000.0,34959000.0,0.0,100.0,87.3975,3,False,True,False,10.0,346.0
348,212.0,Министерство сельского хозяйства Республики Казахстан,40000000.0,40000000.0,40000000.0,34959000.0,40000000.0,34959000.0,34959000.0,0.0,100.0,87.3975,4,False,True,False,1.0,347.0
349,5.0,V. ДЕФИЦИТ (ПРОФИЦИТ) БЮДЖЕТА,-3534767762.0,-3534767762.0,-3598753336.0,-788421641.7,0.0,-1898591429.238,0.0,0.0,240.80914688544627,52.756920299191066,0,False,True,False,,
354,6.0,VI. НЕНЕФТЯНОЙ ДЕФИЦИТ (ПРОФИЦИТ) БЮДЖЕТА,-8768687762.0,-8768687762.0,-8832673336.0,-4697094979.7,0.0,-5261280520.364,0.0,0.0,112.01137177558276,59.56611685071832,0,False,True,False,,
359,7.0,VII. ФИНАНСИРОВАНИЕ ДЕФИЦИТА (ИСПОЛЬЗОВАНИЕ ПРОФИЦИТА) БЮДЖЕТА,3534767762.0,3534767762.0,3598753336.0,788421641.7,0.0,1898591429.238,0.0,0.0,240.80914688544627,52.756920299191066,0,False,True,False,,
364,1.0,ПОСТУПЛЕНИЕ ЗАЙМОВ,6551342292.0,6551342292.0,6551342292.0,3620000000.0,0.0,3660353753.374,0.0,0.0,101.11474456834256,55.871813595264975,1,False,True,False,7.0,359.0
365,7.0,Поступления займов,6551342292.0,6551342292.0,6551342292.0,3620000000.0,0.0,3660353753.374,0.0,0.0,101.11474456834256,55.871813595264975,2,False,True,False,1.0,364.0
366,1.0,Внутренние государственные займы,5168422509.0,5168422509.0,5168422509.0,3567932225.0,0.0,3612710646.974,0.0,0.0,101.25502445534822,69.8996771390696,3,False,True,False,7.0,365.0
367,1.0,Государственные эмиссионные ценные бумаги,5168422509.0,5168422509.0,5168422509.0,3567932225.0,0.0,3612710646.974,0.0,0.0,101.25502445534822,69.8996771390696,4,False,True,False,1.0,366.0
368,2.0,Внешние государственные займы,1382919783.0,1382919783.0,1382919783.0,52067775.0,0.0,47643106.4,0.0,0.0,91.50209779465321,3.4451099033847576,3,False,True,False,7.0,365.0
369,1.0,Договоры займа,692919783.0,692919783.0,692919783.0,52067775.0,0.0,47643106.4,0.0,0.0,91.50209779465321,6.875703013374637,4,False,True,False,2.0,368.0
370,2.0,Государственные эмиссионные ценные бумаги,690000000.0,690000000.0,690000000.0,0.0,0.0,0.0,0.0,0.0,0.0,0.0,4,False,True,False,2.0,368.0
371,2.0,ПОГАШЕНИЕ ЗАЙМОВ,3016574530.0,3016574530.0,3016574530.0,1822599270.1,1822599270.1,1822599267.397,1822599267.397,0.0,99.99999985169534,60.41950063793053,1,False,True,False,7.0,359.0
372,16.0,Погашение займов,3016574530.0,3016574530.0,3016574530.0,1822599270.1,1822599270.1,1822599267.397,1822599267.397,0.0,99.99999985169534,60.41950063793053,2,False,True,False,2.0,371.0
373,1.0,Погашение займов,3016574530.0,3016574530.0,3016574530.0,1822599270.1,1822599270.1,1822599267.397,1822599267.397,0.0,99.99999985169534,60.41950063793053,3,False,True,False,16.0,372.0
374,217.0,Министерство финансов Республики Казахстан,3016574530.0,3016574530.0,3016574530.0,1822599270.1,1822599270.1,1822599267.397,1822599267.397,0.0,99.99999985169534,60.41950063793053,4,False,True,False,1.0,373.0
375,,ИСПОЛЬЗУЕМЫЕ ОСТАТКИ БЮДЖЕТНЫХ СРЕДСТВ,0.0,0.0,63985574.0,-1008979088.2,0.0,60836943.261,0.0,0.0,-6.029554425110235,95.0791552811576,0,True,True,False,,
376,,Остатки бюджетных средств на начало финансового года,0.0,0.0,0.0,0.0,0.0,61307366.416,0.0,0.0,0.0,0.0,0,True,True,False,,
377,,Остатки бюджетных средств на конец отчетного периода,0.0,0.0,0.0,0.0,0.0,470423.155,0.0,0.0,0.0,0.0,0,True,True,False,,
378,,Справочно: Остатки бюджетных средств,0.0,0.0,0.0,0.0,0.0,0.0,0.0,0.0,0.0,0.0,0,True,True,False,,
379,,в том числе за счет внешних займов,0.0,0.0,0.0,0.0,0.0,209681.4,0.0,0.0,0.0,0.0,0,True,True,False,,
