id,code,name,utv,utch,plg,plgp,plgo,sumrg,obz,obzsumrg,plgpsumrg,plgsumrg,level,isLeaf,loaded,expanded,parentCode,parent_id
1,1.0,I. ДОХОДЫ,21392054673.0,21392054673.0,21392054673.0,2150366255.0,0.0,1472348455.387,0.0,0.0,68.46965962023991,6.882688352724369,0,False,True,False,,
6,1.0,НАЛОГОВЫЕ ПОСТУПЛЕНИЯ,15193343932.0,15193343932.0,15193343932.0,771869070.0,0.0,777978905.837,0.0,0.0,100.79156376054814,5.120524548900866,1,False,True,False,1.0,1.0
7,1.0,Налоговые поступления,15193343932.0,15193343932.0,15193343932.0,771869070.0,0.0,777978905.837,0.0,0.0,100.79156376054814,5.120524548900866,2,False,True,False,1.0,6.0
8,1.0,Подоходный налог,5087546655.0,5087546655.0,5087546655.0,380375261.0,0.0,359335633.784,0.0,0.0,94.46871829658764,7.063043509013285,3,False,True,False,1.0,7.0
9,1.0,Корпоративный подоходный налог,5087546655.0,5087546655.0,5087546655.0,380375261.0,0.0,359335633.784,0.0,0.0,94.46871829658764,7.063043509013285,4,False,True,False,1.0,8.0
10,5.0,"Внутренние налоги на товары, работы и услуги",7795818765.0,7795818765.0,7795818765.0,325691608.0,0.0,312441320.681,0.0,0.0,95.93164607452826,4.007806365172729,3,False,True,False,1.0,7.0
11,1.0,Hалог на добавленную стоимость,6510033023.0,6510033023.0,6510033023.0,306939327.0,0.0,292183598.332,0.0,0.0,95.19262363274812,4.488204549803557,4,False,True,False,5.0,10.0
12,2.0,Акцизы,149702349.0,149702349.0,149702349.0,11660303.0,0.0,8728791.991,0.0,0.0,74.85904946895462,5.8307648806499355,4,False,True,False,5.0,10.0
13,3.0,Поступления за использование природных и других ресурсов,1104017514.0,1104017514.0,1104017514.0,5815489.0,0.0,10105247.505,0.0,0.0,173.76436452721347,0.9153158692553134,4,False,True,False,5.0,10.0
14,4.0,Сборы за ведение предпринимательской и профессиональной деятельности,15444143.0,15444143.0,15444143.0,960687.0,0.0,1374857.453,0.0,0.0,143.11190356484474,8.902128483270324,4,False,True,False,5.0,10.0
15,5.0,Налог на игорный бизнес,16621736.0,16621736.0,16621736.0,315802.0,0.0,48825.4,0.0,0.0,15.460763389718876,0.29374428760028437,4,False,True,False,5.0,10.0
16,6.0,Hалоги на международную торговлю и внешние операции,2305622997.0,2305622997.0,2305622997.0,65477119.0,0.0,105332305.498,0.0,0.0,160.86887619169684,4.568496481647472,3,False,True,False,1.0,7.0
17,1.0,Таможенные платежи,2226108451.0,2226108451.0,2226108451.0,59732135.0,0.0,99443822.248,0.0,0.0,166.4829530168309,4.467159818890602,4,False,True,False,6.0,16.0
18,2.0,Прочие налоги на международную торговлю и операции,79514546.0,79514546.0,79514546.0,5744984.0,0.0,5888483.25,0.0,0.0,102.49781809662133,7.405542188469516,4,False,True,False,6.0,16.0
19,7.0,Прочие налоги,0.0,0.0,0.0,0.0,0.0,547189.534,0.0,0.0,0.0,0.0,3,False,True,False,1.0,7.0
20,1.0,Прочие налоги,0.0,0.0,0.0,0.0,0.0,547189.534,0.0,0.0,0.0,0.0,4,False,True,False,7.0,19.0
21,8.0,"Обязательные платежи, взимаемые за совершение юридически значимых действий и (или) выдачу документов уполномоченными на то государственными органами или должностными лицами",4355515.0,4355515.0,4355515.0,325082.0,0.0,322456.34,0.0,0.0,99.19230840218776,7.403403271484543,3,False,True,False,1.0,7.0
22,1.0,Государственная пошлина,4355515.0,4355515.0,4355515.0,325082.0,0.0,322456.34,0.0,0.0,99.19230840218776,7.403403271484543,4,False,True,False,8.0,21.0
23,2.0,НЕНАЛОГОВЫЕ ПОСТУПЛЕНИЯ,435325855.0,435325855.0,435325855.0,215209851.0,0.0,30532704.672,0.0,0.0,14.187410348608994,7.0137586181275635,1,False,True,False,1.0,1.0
24,2.0,Неналоговые поступления,435325855.0,435325855.0,435325855.0,215209851.0,0.0,30532704.672,0.0,0.0,14.187410348608994,7.0137586181275635,2,False,True,False,2.0,23.0
25,1.0,Доходы от государственной собственности,344471687.0,344471687.0,344471687.0,164289993.0,0.0,22632836.5,0.0,0.0,13.776150383060761,6.570303846190993,3,False,True,False,2.0,24.0
26,1.0,Поступления части чистого дохода государственных предприятий,17700648.0,17700648.0,17700648.0,0.0,0.0,6802.695,0.0,0.0,0.0,0.038431898086442935,4,False,True,False,1.0,25.0
27,3.0,"Дивиденды на государственные пакеты акций, находящиеся в государственной собственности",231168083.0,231168083.0,231168083.0,150000000.0,0.0,7.907,0.0,0.0,5.271333333333333e-06,3.4204548903924598e-06,4,False,True,False,1.0,25.0
28,4.0,"Доходы на доли участия в юридических лицах, находящиеся в государственной собственности",10440605.0,10440605.0,10440605.0,0.0,0.0,12.49,0.0,0.0,0.0,0.00011962908279740495,4,False,True,False,1.0,25.0
29,5.0,"Доходы от аренды  имущества, находящегося в государственной собственности",65347382.0,65347382.0,65347382.0,13657275.0,0.0,16149048.102,0.0,0.0,118.24502400369035,24.71261679924683,4,False,True,False,1.0,25.0
30,6.0,Вознаграждения за размещение бюджетных средств на банковских счетах,4558200.0,4558200.0,4558200.0,350000.0,0.0,400782.5,0.0,0.0,114.50928571428571,8.792560659909613,4,False,True,False,1.0,25.0
31,7.0,"Вознаграждения по кредитам, выданным из государственного бюджета",1488998.0,1488998.0,1488998.0,26916.0,0.0,27416.667,0.0,0.0,101.86010922871156,1.8412829970221585,4,False,True,False,1.0,25.0
32,9.0,Прочие доходы от государственной собственности,13767771.0,13767771.0,13767771.0,255802.0,0.0,6048766.139,0.0,0.0,2364.6281651433533,43.93424425057622,4,False,True,False,1.0,25.0
33,2.0,"Поступления от реализации товаров (работ, услуг) государственными учреждениями, финансируемыми из государственного бюджета",6393334.0,6393334.0,6393334.0,374718.0,0.0,388182.291,0.0,0.0,103.59317967111268,6.0716723230790075,3,False,True,False,2.0,24.0
34,1.0,"Поступления от реализации товаров (работ, услуг) государственными учреждениями, финансируемыми из государственного бюджета",6393334.0,6393334.0,6393334.0,374718.0,0.0,388182.291,0.0,0.0,103.59317967111268,6.0716723230790075,4,False,True,False,2.0,33.0
35,3.0,"Поступления денег от проведения государственных закупок, организуемых государственными учреждениями, финансируемыми из государственного бюджета",681986.0,681986.0,681986.0,72103.0,0.0,13586.594,0.0,0.0,18.843313038292443,1.9922101040197304,3,False,True,False,2.0,24.0
36,1.0,"Поступления денег от проведения государственных закупок, организуемых государственными учреждениями, финансируемыми из государственного бюджета",681986.0,681986.0,681986.0,72103.0,0.0,13586.594,0.0,0.0,18.843313038292443,1.9922101040197304,4,False,True,False,3.0,35.0
37,4.0,"Штрафы, пени, санкции, взыскания, налагаемые государственными учреждениями, финансируемыми из государственного бюджета, а также содержащимися и финансируемыми из бюджета (сметы расходов) Национального Банка Республики Казахстан",1970740.0,1970740.0,1970740.0,77134.0,0.0,2370916.759,0.0,0.0,3073.7635271086683,120.30591346397802,3,False,True,False,2.0,24.0
38,1.0,"Штрафы, пени, санкции, взыскания, налагаемые государственными учреждениями, финансируемыми из государственного бюджета, а также содержащимися и финансируемыми из бюджета (сметы расходов) Национального Банка Республики Казахстан, за исключением поступлений от организаций нефтяного сектора, в Фонд компенсации потерпевшим, Фонд поддержки инфраструктуры образования и Специальный государственный фонд",1970740.0,1970740.0,1970740.0,77134.0,0.0,2370916.759,0.0,0.0,3073.7635271086683,120.30591346397802,4,False,True,False,4.0,37.0
39,5.0,Гранты,400649.0,400649.0,400649.0,0.0,0.0,0.0,0.0,0.0,0.0,0.0,3,False,True,False,2.0,24.0
40,2.0,Финансовая помощь,400649.0,400649.0,400649.0,0.0,0.0,0.0,0.0,0.0,0.0,0.0,4,False,True,False,5.0,39.0
41,6.0,Прочие неналоговые поступления,81407459.0,81407459.0,81407459.0,50395903.0,0.0,5127182.528,0.0,0.0,10.173808231990604,6.2981729082098,3,False,True,False,2.0,24.0
42,1.0,Прочие неналоговые поступления,81407459.0,81407459.0,81407459.0,50395903.0,0.0,5127182.528,0.0,0.0,10.173808231990604,6.2981729082098,4,False,True,False,6.0,41.0
43,3.0,ПОСТУПЛЕНИЯ ОТ ПРОДАЖИ ОСНОВНОГО КАПИТАЛА,5200000.0,5200000.0,5200000.0,0.0,0.0,549510.879,0.0,0.0,0.0,10.567516903846153,1,False,True,False,1.0,1.0
44,3.0,Поступления от продажи основного капитала,5200000.0,5200000.0,5200000.0,0.0,0.0,549510.879,0.0,0.0,0.0,10.567516903846153,2,False,True,False,3.0,43.0
45,2.0,Продажа товаров из государственного материального резерва,5200000.0,5200000.0,5200000.0,0.0,0.0,549510.879,0.0,0.0,0.0,10.567516903846153,3,False,True,False,3.0,44.0
46,1.0,Продажа товаров из государственного материального резерва,5200000.0,5200000.0,5200000.0,0.0,0.0,549510.879,0.0,0.0,0.0,10.567516903846153,4,False,True,False,2.0,45.0
47,4.0,ПОСТУПЛЕНИЯ ТРАНСФЕРТОВ,5758184886.0,5758184886.0,5758184886.0,1163287334.0,0.0,663287334.0,0.0,0.0,57.01835777058327,11.519035028080896,1,False,True,False,1.0,1.0
48,4.0,Поступления трансфертов,5758184886.0,5758184886.0,5758184886.0,1163287334.0,0.0,663287334.0,0.0,0.0,57.01835777058327,11.519035028080896,2,False,True,False,4.0,47.0
49,1.0,Трансферты из нижестоящих органов государственного управления,508184886.0,508184886.0,508184886.0,113287334.0,0.0,113287334.0,0.0,0.0,100.0,22.29254295453407,3,False,True,False,4.0,48.0
50,1.0,"Трансферты из областных бюджетов, бюджетов городов республиканского значения",508184886.0,508184886.0,508184886.0,113287334.0,0.0,113287334.0,0.0,0.0,100.0,22.29254295453407,4,False,True,False,1.0,49.0
51,4.0,Трансферты из Национального фонда,5250000000.0,5250000000.0,5250000000.0,1050000000.0,0.0,550000000.0,0.0,0.0,52.38095238095239,10.476190476190476,3,False,True,False,4.0,48.0
52,1.0,Трансферты из Национального фонда в республиканский бюджет,5250000000.0,5250000000.0,5250000000.0,1050000000.0,0.0,550000000.0,0.0,0.0,52.38095238095239,10.476190476190476,4,False,True,False,4.0,51.0
53,2.0,II. ЗАТРАТЫ,25193022392.0,25193022392.0,25193022392.0,1881808974.8,10488625872.7,1417772629.87,2330292023.615,912519393.7449999,75.34094314863611,5.6276400973636695,0,False,True,False,,
58,1.0,Государственные услуги общего характера,1018277044.0,1018277044.0,1038782088.1,66083098.4,374756658.7,41957983.273,183385565.952,141427582.679,63.49276031070602,4.039151594319833,1,False,True,False,2.0,53.0
59,1.0,"Представительные, исполнительные и другие органы, выполняющие общие функции государственного управления",181089423.0,181089423.0,201587855.3,16067508.3,123013244.6,10166606.171,117199885.432,107033279.26099999,63.274317219428475,5.0432632243,2,False,True,False,1.0,58.0
60,101.0,Администрация Президента Республики Казахстан,19336313.0,19336313.0,19336313.0,1345280.0,4368297.0,875757.119,3673055.192,2797298.073,65.0985013528782,4.529080176763791,3,False,True,False,1.0,59.0
61,106.0,Национальный центр по правам человека,1294638.0,1294638.0,1294638.0,291361.0,336136.0,142720.08,185038.267,42318.187000000005,48.98393401999581,11.02393719325402,3,False,True,False,1.0,59.0
62,107.0,Аппарат Высшего Судебного Совета Республики Казахстан      ,1137629.0,1137629.0,1137629.0,83487.0,157257.0,68151.289,110432.102,42280.812999999995,81.63101920059411,5.990642731505614,3,False,True,False,1.0,59.0
63,109.0,Аппарат Правительства Республики Казахстан,4421243.0,4421243.0,4421243.0,468376.0,1301742.0,235717.946,1115613.946,879896.0,50.32664910243052,5.331485873995163,3,False,True,False,1.0,59.0
64,626.0,Агентство по стратегическому планированию и реформам Республики Казахстан,19008476.0,19008476.0,19008476.0,1124782.3,4001743.3,1110034.07,1322280.85,212246.78000000003,98.68879248899988,5.839679467201895,3,False,True,False,1.0,59.0
65,637.0,Аппарат Конституционного Суда Республики Казахстан,1672035.0,1672035.0,1672035.0,129579.0,379990.0,106555.475,148138.415,41582.94,82.23205534847467,6.372801705705921,3,False,True,False,1.0,59.0
66,690.0,Центральная избирательная комиссия Республики Казахстан,20289842.0,20289842.0,20289842.0,684267.0,7117024.0,46563.114,7054571.918,7008008.804,6.804816540911663,0.22948978114270185,3,False,True,False,1.0,59.0
67,693.0,Управление материально-технического обеспечения ,26367302.0,26367302.0,26367302.0,1345275.0,12152250.0,547418.82,10891136.688,10343717.867999999,40.69196409656018,2.076127546155462,3,False,True,False,1.0,59.0
68,694.0,Управление Делами Президента Республики Казахстан,87561945.0,87561945.0,108060377.3,10595101.0,93198805.3,7033688.258,92699618.054,85665929.796,66.3862313157751,6.509035442725593,3,False,True,False,1.0,59.0
69,2.0,Финансовая деятельность,41154742.0,41154742.0,41154742.0,7696447.0,8869651.0,2156867.742,2599411.296,442543.554,28.024200543445566,5.240872952137569,2,False,True,False,1.0,58.0
70,217.0,Министерство финансов Республики Казахстан,35593966.0,35593966.0,35593966.0,7041241.0,7978507.0,1958376.3,2320792.341,362416.04099999997,27.81294234922509,5.501989578795462,3,False,True,False,2.0,69.0
71,406.0,Высшая аудиторская палата Республики Казахстан,5560776.0,5560776.0,5560776.0,655206.0,891144.0,198491.442,278618.955,80127.513,30.294509207791137,3.569491775967958,3,False,True,False,2.0,69.0
72,3.0,Внешнеполитическая деятельность,113453240.0,113453240.0,113456048.3,9161762.3,10800588.3,8460758.391,8508574.594,47816.20299999975,92.34859095831376,7.457300441690072,2,False,True,False,1.0,58.0
73,204.0,Министерство иностранных дел Республики Казахстан,113126661.0,113126661.0,113129469.3,9161762.3,10800588.3,8460758.391,8508574.594,47816.20299999975,92.34859095831376,7.478827968832345,3,False,True,False,3.0,72.0
74,243.0,Министерство национальной экономики Республики Казахстан  ,326579.0,326579.0,326579.0,0.0,0.0,0.0,0.0,0.0,0.0,0.0,3,False,True,False,3.0,72.0
75,4.0,Фундаментальные научные исследования,237087507.0,237087507.0,237087507.0,2169342.0,154272362.0,17952.042,17865672.942,17847720.900000002,0.8275339711304166,0.007571905507446244,2,False,True,False,1.0,58.0
76,202.0,Министерство по чрезвычайным ситуациям Республики Казахстан,0.0,0.0,178549.0,0.0,178549.0,0.0,0.0,0.0,0.0,0.0,3,False,True,False,4.0,75.0
77,207.0,Министерство экологии и природных ресурсов Республики Казахстан,0.0,0.0,1121009.0,560505.0,1121009.0,0.0,1121009.0,1121009.0,0.0,0.0,3,False,True,False,4.0,75.0
78,208.0,Министерство обороны Республики Казахстан,0.0,0.0,27517.0,0.0,27517.0,0.0,0.0,0.0,0.0,0.0,3,False,True,False,4.0,75.0
79,212.0,Министерство сельского хозяйства Республики Казахстан,0.0,0.0,2516284.0,0.0,0.0,0.0,0.0,0.0,0.0,0.0,3,False,True,False,4.0,75.0
80,213.0,Министерство труда и социальной защиты населения Республики  Казахстан,0.0,0.0,188884.0,0.0,188884.0,0.0,188884.0,188884.0,0.0,0.0,3,False,True,False,4.0,75.0
81,223.0,"Министерство цифрового развития, инноваций и аэрокосмической промышленности Республики Казахстан",0.0,0.0,204658.0,0.0,0.0,0.0,0.0,0.0,0.0,0.0,3,False,True,False,4.0,75.0
82,224.0,Министерство просвещения Республики Казахстан ,0.0,0.0,160200.0,0.0,160200.0,0.0,0.0,0.0,0.0,0.0,3,False,True,False,4.0,75.0
83,226.0,Министерство здравоохранения Республики Казахстан,0.0,0.0,2089775.0,0.0,2089775.0,0.0,2053965.0,2053965.0,0.0,0.0,3,False,True,False,4.0,75.0
84,227.0,Министерство науки и высшего образования Республики Казахстан,237087507.0,237087507.0,229506203.0,1529220.0,150426811.0,17952.042,14501814.942,14483862.9,1.1739345548711109,0.00782202910655099,3,False,True,False,4.0,75.0
85,228.0,Министерство транспорта Республики Казахстан,0.0,0.0,79617.0,79617.0,79617.0,0.0,0.0,0.0,0.0,0.0,3,False,True,False,4.0,75.0
86,229.0,Министерство промышленности и строительства Республики Казахстан,0.0,0.0,831586.0,0.0,0.0,0.0,0.0,0.0,0.0,0.0,3,False,True,False,4.0,75.0
87,241.0,Министерство энергетики Республики Казахстан,0.0,0.0,71762.0,0.0,0.0,0.0,0.0,0.0,0.0,0.0,3,False,True,False,4.0,75.0
88,652.0,Министерство водных ресурсов и ирригации Республики Казахстан,0.0,0.0,111463.0,0.0,0.0,0.0,0.0,0.0,0.0,0.0,3,False,True,False,4.0,75.0
89,5.0,Планирование и статистическая деятельность,7903806.0,7903806.0,7903806.0,18247.0,3021060.0,9555.687,11379.675,1823.9879999999994,52.36853729380172,0.12089981712607824,2,False,True,False,1.0,58.0
90,243.0,Министерство национальной экономики Республики Казахстан  ,620459.0,620459.0,620459.0,0.0,0.0,0.0,0.0,0.0,0.0,0.0,3,False,True,False,5.0,89.0
91,626.0,Агентство по стратегическому планированию и реформам Республики Казахстан,7283347.0,7283347.0,7283347.0,18247.0,3021060.0,9555.687,11379.675,1823.9879999999994,52.36853729380172,0.13119911765840622,3,False,True,False,5.0,89.0
92,6.0,Общие кадровые вопросы,423565.0,423565.0,423565.0,0.0,0.0,0.0,0.0,0.0,0.0,0.0,2,False,True,False,1.0,58.0
93,608.0,Агентство Республики Казахстан по делам государственной службы,423565.0,423565.0,423565.0,0.0,0.0,0.0,0.0,0.0,0.0,0.0,3,False,True,False,6.0,92.0
94,9.0,Прочие государственные услуги общего характера,437164761.0,437164761.0,437168564.5,30969791.8,74779752.8,21146243.24,37200642.013,16054398.772999998,68.28022408597528,4.837091446450515,2,False,True,False,1.0,58.0
95,201.0,Министерство внутренних дел Республики Казахстан,179740053.0,179740053.0,179740053.0,11795441.0,16492467.0,10406344.904,12194480.801,1788135.8970000017,88.22344924619604,5.789663867518721,3,False,True,False,9.0,94.0
96,204.0,Министерство иностранных дел Республики Казахстан,1349708.0,1349708.0,1349708.0,172500.0,575000.0,0.0,575000.0,575000.0,0.0,0.0,3,False,True,False,9.0,94.0
97,207.0,Министерство экологии и природных ресурсов Республики Казахстан,11545706.0,11545706.0,11545706.0,610853.0,2349227.0,449906.77,726855.881,276949.11100000003,73.6522158358885,3.8967454220642725,3,False,True,False,9.0,94.0
98,211.0,Министерство торговли и интеграции Республики Казахстан,5857993.0,5857993.0,5857993.0,495695.0,1545551.0,249815.666,1080499.452,830683.7860000001,50.39705181613694,4.264526536648303,3,False,True,False,9.0,94.0
99,217.0,Министерство финансов Республики Казахстан,147774776.0,147774776.0,147777526.0,11834960.0,32281065.0,6292517.626,10212671.677,3920154.050999999,53.16889643902473,4.2581018889164515,3,False,True,False,9.0,94.0
100,223.0,"Министерство цифрового развития, инноваций и аэрокосмической промышленности Республики Казахстан",9816894.0,9816894.0,9816894.0,826419.0,1992672.0,266739.318,513810.231,247070.913,32.27652292602179,2.7171457489507373,3,False,True,False,9.0,94.0
101,228.0,Министерство транспорта Республики Казахстан,13051817.0,13051817.0,13051817.0,1243222.0,4198342.0,519480.326,1599496.336,1080016.0099999998,41.785001069800884,3.9801379838531292,3,False,True,False,9.0,94.0
102,229.0,Министерство промышленности и строительства Республики Казахстан,6903105.0,6903105.0,6903105.0,432228.0,1909782.0,334603.976,549568.542,214964.566,77.41376680825861,4.847151767212001,3,False,True,False,9.0,94.0
103,241.0,Министерство энергетики Республики Казахстан,6278296.0,6278296.0,6278296.0,377091.0,841007.0,255112.113,662931.735,407819.622,67.65266553696588,4.063397345394355,3,False,True,False,9.0,94.0
104,243.0,Министерство национальной экономики Республики Казахстан  ,11295626.0,11295626.0,11295626.0,463093.8,961457.8,399737.779,728025.408,328287.6290000001,86.31896583370366,3.5388722944615902,3,False,True,False,9.0,94.0
105,406.0,Высшая аудиторская палата Республики Казахстан,749697.0,749697.0,749697.0,0.0,0.0,0.0,0.0,0.0,0.0,0.0,3,False,True,False,9.0,94.0
106,608.0,Агентство Республики Казахстан по делам государственной службы,4952566.0,4952566.0,4952566.0,313378.0,1031933.0,254489.459,281837.452,27347.992999999988,81.2084635807236,5.138537457148476,3,False,True,False,9.0,94.0
107,627.0,Агентство по защите и развитию конкуренции Республики Казахстан,3625846.0,3625846.0,3625846.0,249265.0,438825.0,218355.133,339401.031,121045.89800000002,87.5995960122761,6.02218442261475,3,False,True,False,9.0,94.0
108,628.0,Агентство Республики Казахстан по финансовому мониторингу,18416580.0,18416580.0,18416580.0,1756491.0,4015349.0,1205142.217,2191209.206,986066.9889999998,68.6107823495822,6.543789438647132,3,False,True,False,9.0,94.0
109,651.0,Министерство культуры и информации Республики Казахстан,6362112.0,6362112.0,6362112.0,54905.0,5480762.0,47073.492,5092030.017,5044956.525,85.736257171478,0.7399035414654755,3,False,True,False,9.0,94.0
110,652.0,Министерство водных ресурсов и ирригации Республики Казахстан,9443986.0,9443986.0,9445039.5,344250.0,666313.0,246924.461,452824.244,205899.783,71.72823848946986,2.6143295747995547,3,False,True,False,9.0,94.0
111,2.0,Оборона,1213563312.0,1213563312.0,1213563312.0,36813909.0,189018589.0,23678560.987,94588912.386,70910351.399,64.31960536165829,1.9511599232492287,1,False,True,False,2.0,53.0
112,1.0,Военные нужды,1017741469.0,1017741469.0,1017741469.0,35327828.0,156459079.0,22709186.452,92774403.085,70065216.63299999,64.28129816528771,2.231331545752313,2,False,True,False,2.0,111.0
113,208.0,Министерство обороны Республики Казахстан,644933910.0,644933910.0,644933910.0,35327828.0,156459079.0,22709186.452,92774403.085,70065216.63299999,64.28129816528771,3.521164897655947,3,False,True,False,1.0,112.0
