id,code,name,utv,utch,plg,plgp,plgo,sumrg,obz,obzsumrg,plgpsumrg,plgsumrg,level,isLeaf,loaded,expanded,parentCode,parent_id
1,1.0,I. ДОХОДЫ,17543276102.0,17543276102.0,17543276102.0,1055495534.0,0.0,1365328310.377,0.0,0.0,129.35424797136093,7.782630236443394,0,False,True,False,,
2,1.0,НАЛОГОВЫЕ ПОСТУПЛЕНИЯ,13559036264.0,13559036264.0,13559036264.0,778876755.0,0.0,1081215072.986,0.0,0.0,138.8172218576481,7.974129222271397,1,False,True,False,1.0,1.0
3,1.0,Налоговые поступления,13559036264.0,13559036264.0,13559036264.0,778876755.0,0.0,1081215072.986,0.0,0.0,138.8172218576481,7.974129222271397,2,False,True,False,1.0,2.0
4,1.0,Подоходный налог,4765770732.0,4765770732.0,4765770732.0,379923105.0,0.0,568940457.063,0.0,0.0,149.75147591063197,11.938057641816915,3,False,True,False,1.0,3.0
5,1.0,Корпоративный подоходный налог,4765770732.0,4765770732.0,4765770732.0,379923105.0,0.0,568940457.063,0.0,0.0,149.75147591063197,11.938057641816915,4,False,True,False,1.0,4.0
6,5.0,"Внутренние налоги на товары, работы и услуги",6620093635.0,6620093635.0,6620093635.0,243799244.0,0.0,326958300.097,0.0,0.0,134.10964477683123,4.9388772746112375,3,False,True,False,1.0,3.0
7,1.0,Hалог на добавленную стоимость,5509701023.0,5509701023.0,5509701023.0,228234531.0,0.0,298221271.121,0.0,0.0,130.66439588013085,5.412657962312087,4,False,True,False,5.0,6.0
8,2.0,Акцизы,168870629.0,168870629.0,168870629.0,13112466.0,0.0,7203707.481,0.0,0.0,54.93785441273975,4.265814324052764,4,False,True,False,5.0,6.0
9,3.0,Поступления за использование природных и других ресурсов,922435946.0,922435946.0,922435946.0,2083115.0,0.0,20382319.876,0.0,0.0,978.4538960163025,2.209618994617974,4,False,True,False,5.0,6.0
10,4.0,Сборы за ведение предпринимательской и профессиональной деятельности,6496440.0,6496440.0,6496440.0,357363.0,0.0,740833.166,0.0,0.0,207.3055033677241,11.403679030361245,4,False,True,False,5.0,6.0
11,5.0,Налог на игорный бизнес,12589597.0,12589597.0,12589597.0,11769.0,0.0,410168.453,0.0,0.0,3485.159767184977,3.257995097063075,4,False,True,False,5.0,6.0
12,6.0,Hалоги на международную торговлю и внешние операции,2167624788.0,2167624788.0,2167624788.0,154726114.0,0.0,181205629.697,0.0,0.0,117.11379870692026,8.359640040110115,3,False,True,False,1.0,3.0
13,1.0,Таможенные платежи,2123791357.0,2123791357.0,2123791357.0,151862964.0,0.0,178377853.782,0.0,0.0,117.45974731666638,8.399029085134375,4,False,True,False,6.0,12.0
14,2.0,Прочие налоги на международную торговлю и операции,43833431.0,43833431.0,43833431.0,2863150.0,0.0,2827775.915,0.0,0.0,98.76450465396503,6.4511854319594555,4,False,True,False,6.0,12.0
15,7.0,Прочие налоги,0.0,0.0,0.0,0.0,0.0,-150055.333,0.0,0.0,0.0,0.0,3,False,True,False,1.0,3.0
16,1.0,Прочие налоги,0.0,0.0,0.0,0.0,0.0,-150055.333,0.0,0.0,0.0,0.0,4,False,True,False,7.0,15.0
17,8.0,"Обязательные платежи, взимаемые за совершение юридически значимых действий и (или) выдачу документов уполномоченными на то государственными органами или должностными лицами",5547109.0,5547109.0,5547109.0,428292.0,0.0,4260741.462,0.0,0.0,994.8216315037405,76.81012689673126,3,False,True,False,1.0,3.0
18,1.0,Государственная пошлина,5547109.0,5547109.0,5547109.0,428292.0,0.0,4260741.462,0.0,0.0,994.8216315037405,76.81012689673126,4,False,True,False,8.0,17.0
19,2.0,НЕНАЛОГОВЫЕ ПОСТУПЛЕНИЯ,351081214.0,351081214.0,351081214.0,14926866.0,0.0,22599058.699,0.0,0.0,151.39855009752213,6.436988878305519,1,False,True,False,1.0,1.0
20,2.0,Неналоговые поступления,351081214.0,351081214.0,351081214.0,14926866.0,0.0,22599058.699,0.0,0.0,151.39855009752213,6.436988878305519,2,False,True,False,2.0,19.0
21,1.0,Доходы от государственной собственности,300650556.0,300650556.0,300650556.0,14059659.0,0.0,14768607.813,0.0,0.0,105.04243248716061,4.912217030125831,3,False,True,False,2.0,20.0
22,1.0,Поступления части чистого дохода государственных предприятий,600255.0,600255.0,600255.0,0.0,0.0,4625.573,0.0,0.0,0.0,0.7706013277690316,4,False,True,False,1.0,21.0
23,3.0,"Дивиденды на государственные пакеты акций, находящиеся в государственной собственности",211993590.0,211993590.0,211993590.0,0.0,0.0,0.0,0.0,0.0,0.0,0.0,4,False,True,False,1.0,21.0
24,4.0,"Доходы на доли участия в юридических лицах, находящиеся в государственной собственности",8018720.0,8018720.0,8018720.0,0.0,0.0,139.299,0.0,0.0,0.0,0.0017371725163118305,4,False,True,False,1.0,21.0
25,5.0,"Доходы от аренды  имущества, находящегося в государственной собственности",64798951.0,64798951.0,64798951.0,13621354.0,0.0,14115975.321,0.0,0.0,103.63121992865028,21.784265182008888,4,False,True,False,1.0,21.0
26,6.0,Вознаграждения за размещение бюджетных средств на банковских счетах,2200000.0,2200000.0,2200000.0,150000.0,0.0,388356.098,0.0,0.0,258.90406533333334,17.652549909090908,4,False,True,False,1.0,21.0
27,7.0,"Вознаграждения по кредитам, выданным из государственного бюджета",2824078.0,2824078.0,2824078.0,29000.0,0.0,33247.058,0.0,0.0,114.6450275862069,1.1772712368426084,4,False,True,False,1.0,21.0
28,9.0,Прочие доходы от государственной собственности,10214962.0,10214962.0,10214962.0,259305.0,0.0,226264.464,0.0,0.0,87.25804130271302,2.2150299139634586,4,False,True,False,1.0,21.0
29,2.0,"Поступления от реализации товаров (работ, услуг) государственными учреждениями, финансируемыми из государственного бюджета",2849306.0,2849306.0,2849306.0,176181.0,0.0,471744.578,0.0,0.0,267.76132386579707,16.556472979736117,3,False,True,False,2.0,20.0
30,1.0,"Поступления от реализации товаров (работ, услуг) государственными учреждениями, финансируемыми из государственного бюджета",2849306.0,2849306.0,2849306.0,176181.0,0.0,471744.578,0.0,0.0,267.76132386579707,16.556472979736117,4,False,True,False,2.0,29.0
31,3.0,"Поступления денег от проведения государственных закупок, организуемых государственными учреждениями, финансируемыми из государственного бюджета",156488.0,156488.0,156488.0,16455.0,0.0,19842.104,0.0,0.0,120.58404132482528,12.679632943101069,3,False,True,False,2.0,20.0
32,1.0,"Поступления денег от проведения государственных закупок, организуемых государственными учреждениями, финансируемыми из государственного бюджета",156488.0,156488.0,156488.0,16455.0,0.0,19842.104,0.0,0.0,120.58404132482528,12.679632943101069,4,False,True,False,3.0,31.0
33,4.0,"Штрафы, пени, санкции, взыскания, налагаемые государственными учреждениями, финансируемыми из государственного бюджета, а также содержащимися и финансируемыми из бюджета (сметы расходов) Национального Банка Республики Казахстан",1043774.0,1043774.0,1043774.0,38397.0,0.0,3295950.514,0.0,0.0,8583.875078782197,315.7724290890557,3,False,True,False,2.0,20.0
34,1.0,"Штрафы, пени, санкции, взыскания, налагаемые государственными учреждениями, финансируемыми из государственного бюджета, а также содержащимися и финансируемыми из бюджета (сметы расходов) Национального Банка Республики Казахстан, за исключением поступлений от организаций нефтяного сектора, в Фонд компенсации потерпевшим и  Фонд поддержки инфраструктуры образования",1043774.0,1043774.0,1043774.0,38397.0,0.0,3295950.514,0.0,0.0,8583.875078782197,315.7724290890557,4,False,True,False,4.0,33.0
35,5.0,Гранты,669820.0,669820.0,669820.0,0.0,0.0,0.0,0.0,0.0,0.0,0.0,3,False,True,False,2.0,20.0
36,2.0,Финансовая помощь,669820.0,669820.0,669820.0,0.0,0.0,0.0,0.0,0.0,0.0,0.0,4,False,True,False,5.0,35.0
37,6.0,Прочие неналоговые поступления,45711270.0,45711270.0,45711270.0,636174.0,0.0,4042913.69,0.0,0.0,635.5043887364149,8.84445715465792,3,False,True,False,2.0,20.0
38,1.0,Прочие неналоговые поступления,45711270.0,45711270.0,45711270.0,636174.0,0.0,4042913.69,0.0,0.0,635.5043887364149,8.84445715465792,4,False,True,False,6.0,37.0
39,3.0,ПОСТУПЛЕНИЯ ОТ ПРОДАЖИ ОСНОВНОГО КАПИТАЛА,1248374.0,1248374.0,1248374.0,0.0,0.0,-306349.212,0.0,0.0,0.0,-24.53985840781689,1,False,True,False,1.0,1.0
40,3.0,Поступления от продажи основного капитала,1248374.0,1248374.0,1248374.0,0.0,0.0,-306349.212,0.0,0.0,0.0,-24.53985840781689,2,False,True,False,3.0,39.0
41,2.0,Продажа товаров из государственного материального резерва,1248374.0,1248374.0,1248374.0,0.0,0.0,-306349.212,0.0,0.0,0.0,-24.53985840781689,3,False,True,False,3.0,40.0
42,1.0,Продажа товаров из государственного материального резерва,1248374.0,1248374.0,1248374.0,0.0,0.0,-306349.212,0.0,0.0,0.0,-24.53985840781689,4,False,True,False,2.0,41.0
43,4.0,ПОСТУПЛЕНИЯ ТРАНСФЕРТОВ,3631910250.0,3631910250.0,3631910250.0,261691913.0,0.0,261820527.904,0.0,0.0,100.04914745072769,7.208893113589468,1,False,True,False,1.0,1.0
44,4.0,Поступления трансфертов,3631910250.0,3631910250.0,3631910250.0,261691913.0,0.0,261820527.904,0.0,0.0,100.04914745072769,7.208893113589468,2,False,True,False,4.0,43.0
45,1.0,Трансферты из нижестоящих органов государственного управления,431910250.0,431910250.0,431910250.0,26471913.0,0.0,26600527.904,0.0,0.0,100.48585421083848,6.158809128516862,3,False,True,False,4.0,44.0
46,1.0,"Трансферты из областных бюджетов, бюджетов городов республиканского значения, столицы",431910250.0,431910250.0,431910250.0,26471913.0,0.0,26600527.904,0.0,0.0,100.48585421083848,6.158809128516862,4,False,True,False,1.0,45.0
47,4.0,Трансферты из Национального фонда,3200000000.0,3200000000.0,3200000000.0,235220000.0,0.0,235220000.0,0.0,0.0,100.0,7.350624999999999,3,False,True,False,4.0,44.0
48,1.0,Трансферты из Национального фонда в республиканский бюджет,3200000000.0,3200000000.0,3200000000.0,235220000.0,0.0,235220000.0,0.0,0.0,100.0,7.350624999999999,4,False,True,False,4.0,47.0
49,2.0,II. ЗАТРАТЫ,20578663319.0,20578663319.0,20578663319.0,1522469687.1,8091082971.5,1438497515.219,2034440729.535,595943214.316,94.48447659795775,6.990237863947437,0,False,True,False,,
51,1.0,Государственные услуги общего характера,907700668.0,907700668.0,908797842.7,63037270.7,254811175.7,52199786.996,142070475.004,89870688.00800002,82.8078157831792,5.7438282248686505,1,False,True,False,2.0,49.0
52,1.0,"Представительные, исполнительные и другие органы, выполняющие общие функции государственного управления",169539516.0,169539516.0,169539516.0,6916938.0,113138163.0,5056364.404,66830641.471,61774277.067,73.10119599163676,2.9824105455155365,2,False,True,False,1.0,51.0
53,101.0,Администрация Президента Республики Казахстан,12553558.0,12553558.0,12553558.0,952913.0,2110331.0,706888.468,1544721.166,837832.698,74.18184745092155,5.630981017493208,3,False,True,False,1.0,52.0
54,104.0,Канцелярия Премьер-Министра Республики Казахстан,4109378.0,4109378.0,0.0,0.0,0.0,0.0,0.0,0.0,0.0,0.0,3,False,True,False,1.0,52.0
55,106.0,Национальный центр по правам человека,970419.0,970419.0,970419.0,157751.0,208430.0,60454.657,81559.603,21104.946000000004,38.322835988361405,6.229747871795585,3,False,True,False,1.0,52.0
56,107.0,Аппарат Высшего Судебного Совета Республики Казахстан      ,638857.0,638857.0,638857.0,36303.0,47280.0,32366.655,44048.54,11681.885000000002,89.15697049830592,5.066338006783991,3,False,True,False,1.0,52.0
57,108.0,Канцелярия Первого Президента Республики Казахстан – Елбасы,1678654.0,1678654.0,1678654.0,148389.0,276640.0,119631.752,143134.875,23503.123000000007,80.62036404315684,7.126647421088562,3,False,True,False,1.0,52.0
58,109.0,Аппарат Правительства Республики Казахстан,0.0,0.0,4109378.0,615482.0,1345707.0,189778.027,189778.027,0.0,30.834049899103466,4.618169148713017,3,False,True,False,1.0,52.0
59,608.0,Агентство Республики Казахстан по делам государственной службы,181610.0,181610.0,181610.0,0.0,0.0,0.0,0.0,0.0,0.0,0.0,3,False,True,False,1.0,52.0
60,626.0,ГУ Агентство по стратегическому планированию и реформам Республики Казахстан,19171235.0,19171235.0,19171235.0,1165329.0,3385749.0,1018480.452,1456802.983,438322.53099999996,87.39853311811514,5.312544820404111,3,False,True,False,1.0,52.0
61,637.0, Аппарат Конституционного  Совета Республики Казахстан,1542889.0,1542889.0,1542889.0,157285.0,193107.0,30047.957,75003.157,44955.20000000001,19.10414661283657,1.9475125559907418,3,False,True,False,1.0,52.0
62,690.0,Центральная избирательная комиссия Республики Казахстан,41751953.0,41751953.0,41751953.0,594412.0,41164318.0,121921.89,7313818.086,7191896.196,20.511343983634248,0.29201481904331517,3,False,True,False,1.0,52.0
63,693.0,Управление материально-технического обеспечения ,22221458.0,22221458.0,22221458.0,1010948.0,9152902.0,779069.175,8660163.201,7881094.026,77.06322926599589,3.5059318564965447,3,False,True,False,1.0,52.0
64,694.0,Управление Делами Президента Республики Казахстан,64719505.0,64719505.0,64719505.0,2078126.0,55253699.0,1997725.371,47321611.833,45323886.462,96.13109941360631,3.0867438973768415,3,False,True,False,1.0,52.0
65,2.0,Финансовая деятельность,92337534.0,92337534.0,92337534.0,12696221.0,15041667.0,11179504.867,11514044.805,334539.93799999915,88.0537985830587,12.107216191196962,2,False,True,False,1.0,51.0
66,217.0,Министерство финансов Республики Казахстан,45680854.0,45680854.0,45680854.0,10477676.0,11479649.0,10474675.9,10673164.145,198488.24499999918,99.97136674201417,22.930122759964163,3,False,True,False,2.0,65.0
67,249.0,Министерство индустрии и инфраструктурного развития Республики Казахстан,35000000.0,35000000.0,35000000.0,0.0,0.0,0.0,0.0,0.0,0.0,0.0,3,False,True,False,2.0,65.0
68,406.0,Высшая аудиторская палата Республики Казахстан,2458590.0,2458590.0,2458590.0,177467.0,218930.0,112249.222,159611.14,47361.91800000002,63.25075760563935,4.565593368556774,3,False,True,False,2.0,65.0
69,625.0,Агентство Республики Казахстан по регулированию и развитию финансового рынка,9198090.0,9198090.0,9198090.0,2041078.0,3343088.0,592579.745,681269.52,88689.77500000002,29.03268493413774,6.442421687546002,3,False,True,False,2.0,65.0
70,3.0,Внешнеполитическая деятельность,93161597.0,93161597.0,93397966.7,9136246.7,9999005.7,8696449.657,9059336.53,362886.8729999997,95.18623941054481,9.311176639351828,2,False,True,False,1.0,51.0
71,204.0,Министерство иностранных дел Республики Казахстан,90963256.0,90963256.0,91199625.7,9136246.7,9999005.7,8696449.657,9059336.53,362886.8729999997,95.18623941054481,9.535619900027726,3,False,True,False,3.0,70.0
72,243.0,Министерство национальной экономики Республики Казахстан  ,2198341.0,2198341.0,2198341.0,0.0,0.0,0.0,0.0,0.0,0.0,0.0,3,False,True,False,3.0,70.0
73,4.0,Фундаментальные научные исследования,156768897.0,156768897.0,156768897.0,9561424.0,39424995.0,8144673.773,27227366.51,19082692.737000003,85.18264406013162,5.195337805432158,2,False,True,False,1.0,51.0
74,227.0,Министерство науки и высшего образования Республики Казахстан,156768897.0,156768897.0,156768897.0,9561424.0,39424995.0,8144673.773,27227366.51,19082692.737000003,85.18264406013162,5.195337805432158,3,False,True,False,4.0,73.0
75,5.0,Планирование и статистическая деятельность,3382833.0,3382833.0,3382833.0,46013.0,1511005.0,36024.285,36153.285,129.0,78.29153717427684,1.0649146735886756,2,False,True,False,1.0,51.0
76,243.0,Министерство национальной экономики Республики Казахстан  ,682237.0,682237.0,682237.0,0.0,0.0,0.0,0.0,0.0,0.0,0.0,3,False,True,False,5.0,75.0
77,626.0,ГУ Агентство по стратегическому планированию и реформам Республики Казахстан,2700596.0,2700596.0,2700596.0,46013.0,1511005.0,36024.285,36153.285,129.0,78.29153717427684,1.3339383232442026,3,False,True,False,5.0,75.0
78,6.0,Общие кадровые вопросы,589926.0,589926.0,589926.0,0.0,267926.0,0.0,0.0,0.0,0.0,0.0,2,False,True,False,1.0,51.0
79,608.0,Агентство Республики Казахстан по делам государственной службы,589926.0,589926.0,589926.0,0.0,267926.0,0.0,0.0,0.0,0.0,0.0,3,False,True,False,6.0,78.0
80,9.0,Прочие государственные услуги общего характера,391920365.0,391920365.0,392781170.0,24680428.0,75428414.0,19086770.01,27402932.403,8316162.392999999,77.33565240440726,4.85939028339877,2,False,True,False,1.0,51.0
81,201.0,Министерство внутренних дел Республики Казахстан,156635522.0,156635522.0,156635522.0,9795930.0,13492228.0,8390809.325,9925123.917,1534314.5920000002,85.65607680945044,5.356900668419262,3,False,True,False,9.0,80.0
82,204.0,Министерство иностранных дел Республики Казахстан,60200.0,60200.0,60200.0,0.0,0.0,0.0,0.0,0.0,0.0,0.0,3,False,True,False,9.0,80.0
83,207.0,Министерство экологии и природных ресурсов Республики Казахстан,14826657.0,14826657.0,14826657.0,985790.0,1849519.0,608589.706,949930.703,341340.997,61.7362426074519,4.104699434268966,3,False,True,False,9.0,80.0
84,209.0,Министерство информации и общественного развития Республики Казахстан,7185593.0,7185593.0,7185593.0,647855.0,2834290.0,309399.11,1419642.767,1110243.6570000001,47.75746270384577,4.305825698727996,3,False,True,False,9.0,80.0
85,211.0,Министерство торговли и интеграции Республики Казахстан,7430904.0,7430904.0,7430904.0,903618.0,3509655.0,377721.853,456779.219,79057.36599999998,41.80105453853288,5.083121151881386,3,False,True,False,9.0,80.0
86,217.0,Министерство финансов Республики Казахстан,127419723.0,127419723.0,127419723.0,7759708.0,27756741.0,6024467.76,8257821.378,2233353.618,77.63781523737748,4.72804964424542,3,False,True,False,9.0,80.0
87,223.0,"Министерство цифрового развития, инноваций и аэрокосмической промышленности Республики Казахстан",21476773.0,21476773.0,21476773.0,1014378.0,16373176.0,539451.26,1639972.183,1100520.923,53.18049681676851,2.511789178011054,3,False,True,False,9.0,80.0
88,241.0,Министерство энергетики Республики Казахстан,5142562.0,5142562.0,6003367.0,282089.0,1169858.0,205867.863,325360.828,119492.96499999997,72.97975567994499,3.429206693510492,3,False,True,False,9.0,80.0
89,243.0,Министерство национальной экономики Республики Казахстан  ,9775823.0,9775823.0,9775823.0,512080.0,868727.0,391246.95,528844.211,137597.261,76.4034818778316,4.00218938088384,3,False,True,False,9.0,80.0
90,249.0,Министерство индустрии и инфраструктурного развития Республики Казахстан,16277999.0,16277999.0,16277999.0,1205492.0,4488032.0,890190.249,1694824.979,804634.7300000001,73.84455881913775,5.4686712353281255,3,False,True,False,9.0,80.0
91,406.0,Высшая аудиторская палата Республики Казахстан,670375.0,670375.0,670375.0,0.0,0.0,0.0,0.0,0.0,0.0,0.0,3,False,True,False,9.0,80.0
92,608.0,Агентство Республики Казахстан по делам государственной службы,4972985.0,4972985.0,4972985.0,278599.0,458819.0,218606.815,240833.918,22227.103000000003,78.466475112976,4.3958872789682655,3,False,True,False,9.0,80.0
93,627.0,ГУ Агентство по защите и развитию конкуренции Республики Казахстан,3452774.0,3452774.0,3452774.0,261647.0,335147.0,210451.355,269600.152,59148.79699999999,80.43331473320924,6.09513843072266,3,False,True,False,9.0,80.0
94,628.0,Агентство Республики Казахстан по финансовому мониторингу,16592475.0,16592475.0,16592475.0,1033242.0,2292222.0,919967.764,1694198.148,774230.3840000001,89.03700817427088,5.544487871761144,3,False,True,False,9.0,80.0
95,2.0,Оборона,1030363707.0,1030363707.0,1030363707.0,114742946.0,243625475.7,108783139.92,146164035.709,37380895.78899999,94.80594991869914,10.557741813008171,1,False,True,False,2.0,49.0
96,1.0,Военные нужды,843951496.0,843951496.0,843951496.0,112351221.0,181070319.7,106851437.0,139832902.24,32981465.24000001,95.10482934582438,12.66085047617476,2,False,True,False,2.0,95.0
97,208.0,Министерство обороны Республики Казахстан,517340575.0,517340575.0,517340575.0,25061725.0,93780823.7,19561941.0,52543406.24,32981465.240000002,78.05504609120084,3.7812500981582584,3,False,True,False,1.0,96.0
98,249.0,Министерство индустрии и инфраструктурного развития Республики Казахстан,326610921.0,326610921.0,326610921.0,87289496.0,87289496.0,87289496.0,87289496.0,0.0,100.0,26.72583504946548,3,False,True,False,1.0,96.0
99,2.0,Организация работы по чрезвычайным ситуациям,186412211.0,186412211.0,186412211.0,2391725.0,62555156.0,1931702.92,6331133.469,4399430.549,80.76609643667227,1.0362534244068378,2,False,True,False,2.0,95.0
100,202.0,Министерство по чрезвычайным ситуациям Республики Казахстан,186412211.0,186412211.0,186412211.0,2391725.0,62555156.0,1931702.92,6331133.469,4399430.549,80.76609643667227,1.0362534244068378,3,False,True,False,2.0,99.0
101,3.0,"Общественный порядок, безопасность, правовая, судебная, уголовно-исполнительная деятельность",1071897410.0,1071897410.0,1071897410.0,69424349.0,257478665.0,52141464.742,112039858.592,59898393.849999994,75.10544282093305,4.864408128572677,1,False,True,False,2.0,49.0
102,1.0,Правоохранительная деятельность,347766682.0,347766682.0,347766682.0,19561843.0,64436212.0,16194111.393,44836489.703,28642378.310000002,82.78418037093948,4.656602323105812,2,False,True,False,3.0,101.0
103,201.0,Министерство внутренних дел Республики Казахстан,308774717.0,308774717.0,308774717.0,16126082.0,58519637.0,13773478.192,42127439.961,28353961.769,85.41118786323919,4.460688467572946,3,False,True,False,1.0,102.0
