id,code,name,utv,utch,plg,plgp,plgo,sumrg,obz,obzsumrg,plgpsumrg,plgsumrg,level,isLeaf,loaded,expanded,parentCode,parent_id
1,1.0,I. ДОХОДЫ,17543276102.0,19063995118.0,19063995118.0,10274112901.0,0.0,9607576766.633,0.0,0.0,93.51247021723769,50.39644999468993,0,False,True,False,,
2,1.0,НАЛОГОВЫЕ ПОСТУПЛЕНИЯ,13559036264.0,14279036264.0,14279036264.0,7472424055.0,0.0,6676201445.214,0.0,0.0,89.34452054747581,46.75526640439941,1,False,True,False,1.0,1.0
3,1.0,Налоговые поступления,13559036264.0,14279036264.0,14279036264.0,7472424055.0,0.0,6676201445.214,0.0,0.0,89.34452054747581,46.75526640439941,2,False,True,False,1.0,2.0
4,1.0,Подоходный налог,4765770732.0,4965770732.0,4965770732.0,2553913175.0,0.0,1979846892.093,0.0,0.0,77.52209086328864,39.869881211684586,3,False,True,False,1.0,3.0
5,1.0,Корпоративный подоходный налог,4765770732.0,4965770732.0,4965770732.0,2553913175.0,0.0,1979846892.093,0.0,0.0,77.52209086328864,39.869881211684586,4,False,True,False,1.0,4.0
6,5.0,"Внутренние налоги на товары, работы и услуги",6620093635.0,7140093635.0,7140093635.0,3679449007.0,0.0,3544733587.578,0.0,0.0,96.33870671489917,49.64547761953825,3,False,True,False,1.0,3.0
7,1.0,Hалог на добавленную стоимость,5509701023.0,5823701023.0,5823701023.0,3026160909.0,0.0,2930893559.66,0.0,0.0,96.8518742986644,50.32699220108985,4,False,True,False,5.0,6.0
8,2.0,Акцизы,168870629.0,168870629.0,168870629.0,76755584.0,0.0,88835766.349,0.0,0.0,115.73850620301451,52.60581243467743,4,False,True,False,5.0,6.0
9,3.0,Поступления за использование природных и других ресурсов,922435946.0,1128435946.0,1128435946.0,565185352.0,0.0,509854680.686,0.0,0.0,90.21017244728593,45.18242107523221,4,False,True,False,5.0,6.0
10,4.0,Сборы за ведение предпринимательской и профессиональной деятельности,6496440.0,6496440.0,6496440.0,3908449.0,0.0,7148018.476,0.0,0.0,182.8863182300703,110.02977747812648,4,False,True,False,5.0,6.0
11,5.0,Налог на игорный бизнес,12589597.0,12589597.0,12589597.0,7438713.0,0.0,8001562.407,0.0,0.0,107.56648908218398,63.5569383753904,4,False,True,False,5.0,6.0
12,6.0,Hалоги на международную торговлю и внешние операции,2167624788.0,2167624788.0,2167624788.0,1236205461.0,0.0,1140779728.909,0.0,0.0,92.28075468831794,52.628099439735685,3,False,True,False,1.0,3.0
13,1.0,Таможенные платежи,2123791357.0,2123791357.0,2123791357.0,1212846272.0,0.0,1114298251.832,0.0,0.0,91.87464871327073,52.46740684574694,4,False,True,False,6.0,12.0
14,2.0,Прочие налоги на международную торговлю и операции,43833431.0,43833431.0,43833431.0,23359189.0,0.0,26481477.077,0.0,0.0,113.36642328207543,60.41388153484951,4,False,True,False,6.0,12.0
15,7.0,Прочие налоги,0.0,0.0,0.0,0.0,0.0,871625.754,0.0,0.0,0.0,0.0,3,False,True,False,1.0,3.0
16,1.0,Прочие налоги,0.0,0.0,0.0,0.0,0.0,871625.754,0.0,0.0,0.0,0.0,4,False,True,False,7.0,15.0
17,8.0,"Обязательные платежи, взимаемые за совершение юридически значимых действий и (или) выдачу документов уполномоченными на то государственными органами или должностными лицами",5547109.0,5547109.0,5547109.0,2856412.0,0.0,9969610.88,0.0,0.0,349.0256615642282,179.72624803298442,3,False,True,False,1.0,3.0
18,1.0,Государственная пошлина,5547109.0,5547109.0,5547109.0,2856412.0,0.0,9969610.88,0.0,0.0,349.0256615642282,179.72624803298442,4,False,True,False,8.0,17.0
19,2.0,НЕНАЛОГОВЫЕ ПОСТУПЛЕНИЯ,351081214.0,351800230.0,351800230.0,88257842.0,0.0,152369440.593,0.0,0.0,172.64124880030488,43.311353319183446,1,False,True,False,1.0,1.0
20,2.0,Неналоговые поступления,351081214.0,351800230.0,351800230.0,88257842.0,0.0,152369440.593,0.0,0.0,172.64124880030488,43.311353319183446,2,False,True,False,2.0,19.0
21,1.0,Доходы от государственной собственности,300650556.0,300650556.0,300650556.0,58253289.0,0.0,78746900.819,0.0,0.0,135.18017981611305,26.192168698001677,3,False,True,False,2.0,20.0
22,1.0,Поступления части чистого дохода государственных предприятий,600255.0,600255.0,600255.0,600255.0,0.0,2741668.691,0.0,0.0,456.75066280164265,456.75066280164265,4,False,True,False,1.0,21.0
23,3.0,"Дивиденды на государственные пакеты акций, находящиеся в государственной собственности",211993590.0,211993590.0,211993590.0,3245757.0,0.0,11874057.727,0.0,0.0,365.83323172375503,5.601139981166411,4,False,True,False,1.0,21.0
24,4.0,"Доходы на доли участия в юридических лицах, находящиеся в государственной собственности",8018720.0,8018720.0,8018720.0,206351.0,0.0,4425246.519,0.0,0.0,2144.523902961459,55.18644520571863,4,False,True,False,1.0,21.0
25,5.0,"Доходы от аренды  имущества, находящегося в государственной собственности",64798951.0,64798951.0,64798951.0,45950667.0,0.0,45524734.936,0.0,0.0,99.07306663470195,70.25535789306218,4,False,True,False,1.0,21.0
26,6.0,Вознаграждения за размещение бюджетных средств на банковских счетах,2200000.0,2200000.0,2200000.0,1250000.0,0.0,3029361.899,0.0,0.0,242.34895192000005,137.69826813636365,4,False,True,False,1.0,21.0
27,7.0,"Вознаграждения по кредитам, выданным из государственного бюджета",2824078.0,2824078.0,2824078.0,1481059.0,0.0,853421.58,0.0,0.0,57.62238911481582,30.219476232596975,4,False,True,False,1.0,21.0
28,9.0,Прочие доходы от государственной собственности,10214962.0,10214962.0,10214962.0,5519200.0,0.0,10298409.467,0.0,0.0,186.59243127627192,100.81691412067906,4,False,True,False,1.0,21.0
29,2.0,"Поступления от реализации товаров (работ, услуг) государственными учреждениями, финансируемыми из государственного бюджета",2849306.0,2849306.0,2849306.0,1516160.0,0.0,3669123.623,0.0,0.0,242.00108319702406,128.77253699672832,3,False,True,False,2.0,20.0
30,1.0,"Поступления от реализации товаров (работ, услуг) государственными учреждениями, финансируемыми из государственного бюджета",2849306.0,2849306.0,2849306.0,1516160.0,0.0,3669123.623,0.0,0.0,242.00108319702406,128.77253699672832,4,False,True,False,2.0,29.0
31,3.0,"Поступления денег от проведения государственных закупок, организуемых государственными учреждениями, финансируемыми из государственного бюджета",156488.0,156488.0,156488.0,62803.0,0.0,128238.37,0.0,0.0,204.19147174498033,81.94773401155359,3,False,True,False,2.0,20.0
32,1.0,"Поступления денег от проведения государственных закупок, организуемых государственными учреждениями, финансируемыми из государственного бюджета",156488.0,156488.0,156488.0,62803.0,0.0,128238.37,0.0,0.0,204.19147174498033,81.94773401155359,4,False,True,False,3.0,31.0
33,4.0,"Штрафы, пени, санкции, взыскания, налагаемые государственными учреждениями, финансируемыми из государственного бюджета, а также содержащимися и финансируемыми из бюджета (сметы расходов) Национального Банка Республики Казахстан",1043774.0,1043774.0,1043774.0,665897.0,0.0,19319675.571,0.0,0.0,2901.300887524647,1850.9443204180216,3,False,True,False,2.0,20.0
34,1.0,"Штрафы, пени, санкции, взыскания, налагаемые государственными учреждениями, финансируемыми из государственного бюджета, а также содержащимися и финансируемыми из бюджета (сметы расходов) Национального Банка Республики Казахстан, за исключением поступлений от организаций нефтяного сектора, в Фонд компенсации потерпевшим и  Фонд поддержки инфраструктуры образования",1043774.0,1043774.0,1043774.0,665897.0,0.0,19319675.571,0.0,0.0,2901.300887524647,1850.9443204180216,4,False,True,False,4.0,33.0
35,5.0,Гранты,669820.0,1388836.0,1388836.0,0.0,0.0,0.0,0.0,0.0,0.0,0.0,3,False,True,False,2.0,20.0
36,2.0,Финансовая помощь,669820.0,1388836.0,1388836.0,0.0,0.0,0.0,0.0,0.0,0.0,0.0,4,False,True,False,5.0,35.0
37,6.0,Прочие неналоговые поступления,45711270.0,45711270.0,45711270.0,27759693.0,0.0,50505502.21,0.0,0.0,181.938259223544,110.4880748445624,3,False,True,False,2.0,20.0
38,1.0,Прочие неналоговые поступления,45711270.0,45711270.0,45711270.0,27759693.0,0.0,50505502.21,0.0,0.0,181.938259223544,110.4880748445624,4,False,True,False,6.0,37.0
39,3.0,ПОСТУПЛЕНИЯ ОТ ПРОДАЖИ ОСНОВНОГО КАПИТАЛА,1248374.0,1248374.0,1248374.0,465944.0,0.0,399904.43,0.0,0.0,85.82671522758099,32.03402425875579,1,False,True,False,1.0,1.0
40,3.0,Поступления от продажи основного капитала,1248374.0,1248374.0,1248374.0,465944.0,0.0,399904.43,0.0,0.0,85.82671522758099,32.03402425875579,2,False,True,False,3.0,39.0
41,2.0,Продажа товаров из государственного материального резерва,1248374.0,1248374.0,1248374.0,465944.0,0.0,399904.43,0.0,0.0,85.82671522758099,32.03402425875579,3,False,True,False,3.0,40.0
42,1.0,Продажа товаров из государственного материального резерва,1248374.0,1248374.0,1248374.0,465944.0,0.0,399904.43,0.0,0.0,85.82671522758099,32.03402425875579,4,False,True,False,2.0,41.0
43,4.0,ПОСТУПЛЕНИЯ ТРАНСФЕРТОВ,3631910250.0,4431910250.0,4431910250.0,2712965060.0,0.0,2778605976.396,0.0,0.0,102.4195267887453,62.695447778889466,1,False,True,False,1.0,1.0
44,4.0,Поступления трансфертов,3631910250.0,4431910250.0,4431910250.0,2712965060.0,0.0,2778605976.396,0.0,0.0,102.4195267887453,62.695447778889466,2,False,True,False,4.0,43.0
45,1.0,Трансферты из нижестоящих органов государственного управления,431910250.0,431910250.0,431910250.0,284445060.0,0.0,350085976.396,0.0,0.0,123.0768347307561,81.05526006757191,3,False,True,False,4.0,44.0
46,1.0,"Трансферты из областных бюджетов, бюджетов городов республиканского значения, столицы",431910250.0,431910250.0,431910250.0,284445060.0,0.0,350085976.396,0.0,0.0,123.0768347307561,81.05526006757191,4,False,True,False,1.0,45.0
47,4.0,Трансферты из Национального фонда,3200000000.0,4000000000.0,4000000000.0,2428520000.0,0.0,2428520000.0,0.0,0.0,100.0,60.712999999999994,3,False,True,False,4.0,44.0
48,1.0,Трансферты из Национального фонда в республиканский бюджет,3200000000.0,4000000000.0,4000000000.0,2428520000.0,0.0,2428520000.0,0.0,0.0,100.0,60.712999999999994,4,False,True,False,4.0,47.0
49,2.0,II. ЗАТРАТЫ,20578663319.0,21647463677.0,21647463677.0,12350814257.4,16728972446.9,12255809305.673,13173371051.037,917561745.3640003,99.23077985186218,56.61545153067772,0,False,True,False,,
51,1.0,Государственные услуги общего характера,907700668.0,1010251132.0,1098762318.2,590320739.3,847556294.0,573153535.65,669138138.678,95984603.028,97.09188539261609,52.16355950292726,1,False,True,False,2.0,49.0
52,1.0,"Представительные, исполнительные и другие органы, выполняющие общие функции государственного управления",169539516.0,200582111.0,204815906.0,111400136.4,175945674.8,104999430.22,144386029.953,39386599.73300001,94.25431028466855,51.26527146773454,2,False,True,False,1.0,51.0
53,101.0,Администрация Президента Республики Казахстан,12553558.0,14769262.0,15889862.0,8712298.2,9814898.0,8263359.667,9164984.556,901624.8889999995,94.8470710862491,52.00397377271118,3,False,True,False,1.0,52.0
54,104.0,Канцелярия Премьер-Министра Республики Казахстан,4109378.0,0.0,0.0,0.0,0.0,0.0,0.0,0.0,0.0,0.0,3,False,True,False,1.0,52.0
55,106.0,Национальный центр по правам человека,970419.0,1057300.0,1057300.0,707544.0,745418.0,477894.457,509139.645,31245.188000000024,67.54271918071527,45.19951357230682,3,False,True,False,1.0,52.0
56,107.0,Аппарат Высшего Судебного Совета Республики Казахстан      ,638857.0,679284.0,737941.0,319273.9,416693.7,308590.96,390144.707,81553.74699999997,96.65398894178323,41.817836385293674,3,False,True,False,1.0,52.0
57,108.0,Канцелярия Первого Президента Республики Казахстан – Елбасы,1678654.0,1549428.0,1549428.0,972111.0,1025299.0,821449.536,875361.178,53911.64199999999,84.50161925952901,53.01630898628397,3,False,True,False,1.0,52.0
58,109.0,Аппарат Правительства Республики Казахстан,0.0,4176806.0,4274087.0,2513743.0,3131937.1,2084559.875,2707117.604,622557.7289999998,82.92653127228998,48.77205061572214,3,False,True,False,1.0,52.0
59,608.0,Агентство Республики Казахстан по делам государственной службы,181610.0,181610.0,181610.0,0.0,181610.0,0.0,110195.106,110195.106,0.0,0.0,3,False,True,False,1.0,52.0
60,626.0,ГУ Агентство по стратегическому планированию и реформам Республики Казахстан,19171235.0,20699481.0,20702906.4,10948384.7,15201157.3,10556333.402,13173478.145,2617144.742999999,96.41909460854076,50.989620481499166,3,False,True,False,1.0,52.0
61,637.0, Аппарат Конституционного  Совета Республики Казахстан,1542889.0,1533580.0,1533580.0,963549.0,1050261.0,730614.748,881540.849,150926.10100000002,75.8253859430086,47.641123906154235,3,False,True,False,1.0,52.0
62,690.0,Центральная избирательная комиссия Республики Казахстан,41751953.0,41743460.0,38584995.6,35058038.6,38363982.6,33194611.946,37320274.025,4125662.079,94.68473785638423,86.02984509864761,3,False,True,False,1.0,52.0
63,693.0,Управление материально-технического обеспечения ,22221458.0,27138162.0,27184143.0,14140970.2,20196046.7,12964409.918,18948666.166,5984256.248000002,91.67977680909051,47.69107460183682,3,False,True,False,1.0,52.0
64,694.0,Управление Делами Президента Республики Казахстан,64719505.0,87053738.0,93120053.0,37064223.8,85818371.4,35597605.711,60305127.972,24707522.261,96.04303574003352,38.227647605612944,3,False,True,False,1.0,52.0
65,2.0,Финансовая деятельность,92337534.0,134025473.0,132527585.1,94583571.8,97795787.1,93680988.016,95769661.946,2088673.9299999923,99.04572880171143,70.68791598768823,2,False,True,False,1.0,51.0
66,217.0,Министерство финансов Республики Казахстан,45680854.0,46232144.0,46262144.0,13146619.5,15211860.0,12963654.926,14112865.625,1149210.698999999,98.60827664480593,28.02216630080958,3,False,True,False,2.0,65.0
67,249.0,Министерство индустрии и инфраструктурного развития Республики Казахстан,35000000.0,75193681.0,73380617.0,73380616.2,73380616.2,73380616.12,73380616.12,0.0,99.99999989097938,99.99999880077324,3,False,True,False,2.0,65.0
68,406.0,Высшая аудиторская палата Республики Казахстан,2458590.0,2967760.0,2968208.1,1606990.1,2073942.1,1490664.098,1764416.792,273752.6939999999,92.76124961815259,50.22101037996628,3,False,True,False,2.0,65.0
69,625.0,Агентство Республики Казахстан по регулированию и развитию финансового рынка,9198090.0,9631888.0,9916616.0,6449346.0,7129368.8,5846052.872,6511763.409,665710.5369999995,90.64566968495721,58.95209486784605,3,False,True,False,2.0,65.0
70,3.0,Внешнеполитическая деятельность,93161597.0,96712675.0,98257116.0,63183364.0,64604167.7,61777820.409,62830954.482,1053134.072999999,97.7754530591312,62.87363493245619,2,False,True,False,1.0,51.0
71,204.0,Министерство иностранных дел Республики Казахстан,90963256.0,94514334.0,96126225.0,62624340.1,64044487.1,61219497.457,62272631.53,1053134.072999999,97.75671465638325,63.68657195994122,3,False,True,False,3.0,70.0
72,207.0,Министерство экологии и природных ресурсов Республики Казахстан,0.0,0.0,11266.0,11266.0,11266.0,11194.252,11194.252,0.0,99.36314574826913,99.36314574826913,3,False,True,False,3.0,70.0
73,217.0,Министерство финансов Республики Казахстан,0.0,0.0,21480.0,21480.0,21480.0,21479.992,21479.992,0.0,99.99996275605213,99.99996275605213,3,False,True,False,3.0,70.0
74,224.0,Министерство просвещения Республики Казахстан ,0.0,0.0,6250.0,0.0,0.0,0.0,0.0,0.0,0.0,0.0,3,False,True,False,3.0,70.0
75,227.0,Министерство науки и высшего образования Республики Казахстан,0.0,0.0,6250.0,6250.0,6250.0,6249.998,6249.998,0.0,99.999968,99.999968,3,False,True,False,3.0,70.0
76,243.0,Министерство национальной экономики Республики Казахстан  ,2198341.0,2198341.0,1892912.0,468188.9,468188.9,467960.91,467960.91,0.0,99.95130384338458,24.721746705604907,3,False,True,False,3.0,70.0
77,249.0,Министерство индустрии и инфраструктурного развития Республики Казахстан,0.0,0.0,35233.0,34576.3,35233.0,34175.246,34175.246,0.0,98.84008988816038,96.99783157834983,3,False,True,False,3.0,70.0
78,624.0,Агентство Республики Казахстан по противодействию коррупции (Антикоррупционная служба),0.0,0.0,5000.0,4762.7,4762.7,4762.7,4762.7,0.0,100.0,95.25399999999999,3,False,True,False,3.0,70.0
79,626.0,ГУ Агентство по стратегическому планированию и реформам Республики Казахстан,0.0,0.0,146250.0,6250.0,6250.0,6249.854,6249.854,0.0,99.99766400000001,4.273404444444444,3,False,True,False,3.0,70.0
80,627.0,ГУ Агентство по защите и развитию конкуренции Республики Казахстан,0.0,0.0,6250.0,6250.0,6250.0,6250.0,6250.0,0.0,100.0,100.0,3,False,True,False,3.0,70.0
81,4.0,Фундаментальные научные исследования,156768897.0,158480145.0,157932569.0,60869596.4,150582072.5,59567546.762,77942391.936,18374845.174000002,97.86091954767751,37.717075799609134,2,False,True,False,1.0,51.0
82,202.0,Министерство по чрезвычайным ситуациям Республики Казахстан,0.0,0.0,112393.0,59942.9,112393.0,59942.9,112393.0,52450.1,100.0,53.3333036754958,3,False,True,False,4.0,81.0
83,207.0,Министерство экологии и природных ресурсов Республики Казахстан,0.0,0.0,1201882.0,1090436.0,1201882.0,709249.0,1201882.0,492633.0,65.04269851692351,59.01153357817157,3,False,True,False,4.0,81.0
84,212.0,Министерство сельского хозяйства Республики Казахстан,0.0,0.0,1057346.0,528673.0,1057346.0,528673.0,1057346.0,528673.0,100.0,50.0,3,False,True,False,4.0,81.0
85,213.0,Министерство труда и социальной защиты населения Республики Казахстан,0.0,0.0,143594.0,103594.0,143594.0,103594.0,143594.0,40000.0,100.0,72.14368288368594,3,False,True,False,4.0,81.0
86,223.0,"Министерство цифрового развития, инноваций и аэрокосмической промышленности Республики Казахстан",0.0,0.0,197114.0,128125.0,197114.0,128124.2,197114.0,68989.8,99.99937560975609,65.00005073206367,3,False,True,False,4.0,81.0
87,224.0,Министерство просвещения Республики Казахстан ,0.0,0.0,139827.0,69913.5,139827.0,69913.5,139827.0,69913.5,100.0,50.0,3,False,True,False,4.0,81.0
88,226.0,Министерство здравоохранения Республики Казахстан,0.0,0.0,2021039.0,1215158.0,1980449.0,1209366.17,1980449.0,771082.8300000001,99.52336815459388,59.838833886926466,3,False,True,False,4.0,81.0
89,227.0,Министерство науки и высшего образования Республики Казахстан,156768897.0,158480145.0,152188222.0,57145464.6,144878445.5,56230395.292,72238764.936,16008369.644000001,98.39870177903848,36.947928396193504,3,False,True,False,4.0,81.0
90,241.0,Министерство энергетики Республики Казахстан,0.0,0.0,51828.0,34454.0,51828.0,34454.0,51828.0,17374.0,100.0,66.47757968665586,3,False,True,False,4.0,81.0
91,249.0,Министерство индустрии и инфраструктурного развития Республики Казахстан,0.0,0.0,819324.0,493835.4,819194.0,493834.7,819194.0,325359.3,99.99985825236506,60.27343273235009,3,False,True,False,4.0,81.0
92,5.0,Планирование и статистическая деятельность,3382833.0,4687605.0,4644768.0,2053643.4,3422212.1,1758995.835,2833113.101,1074117.2659999998,85.65244749891828,37.87047781503834,2,False,True,False,1.0,51.0
93,243.0,Министерство национальной экономики Республики Казахстан  ,682237.0,1352948.0,1310111.0,595072.2,613976.0,363027.203,585387.203,222360.0,61.005572601106216,27.709652311903344,3,False,True,False,5.0,92.0
94,626.0,ГУ Агентство по стратегическому планированию и реформам Республики Казахстан,2700596.0,3334657.0,3334657.0,1458571.2,2808236.1,1395968.632,2247725.898,851757.2660000001,95.70795254972812,41.86243538690786,3,False,True,False,5.0,92.0
95,6.0,Общие кадровые вопросы,589926.0,589926.0,589926.0,426695.0,560653.0,426690.0,560653.0,133963.0,99.99882820281466,72.32941080745721,2,False,True,False,1.0,51.0
96,608.0,Агентство Республики Казахстан по делам государственной службы,589926.0,589926.0,589926.0,426695.0,560653.0,426690.0,560653.0,133963.0,99.99882820281466,72.32941080745721,3,False,True,False,6.0,95.0
97,9.0,Прочие государственные услуги общего характера,391920365.0,415173197.0,499994448.1,257803732.3,354645726.8,250942064.408,284815334.26,33873269.852,97.33841405988053,50.18897016988697,2,False,True,False,1.0,51.0
98,201.0,Министерство внутренних дел Республики Казахстан,156635522.0,158293173.0,158403458.1,88509488.3,94082642.1,87291750.965,89486373.681,2194622.7159999907,98.62417311591216,55.10722556946502,3,False,True,False,9.0,97.0
99,204.0,Министерство иностранных дел Республики Казахстан,60200.0,1027427.0,1027427.0,245171.6,907227.0,245171.6,650572.0,405400.4,100.0,23.862678321671517,3,False,True,False,9.0,97.0
100,207.0,Министерство экологии и природных ресурсов Республики Казахстан,14826657.0,16967264.0,21569000.2,9245234.7,15169381.2,8238893.722,13047457.842,4808564.12,89.1150304924114,38.1978471213515,3,False,True,False,9.0,97.0
101,209.0,Министерство информации и общественного развития Республики Казахстан,7185593.0,13415486.0,14647128.2,5080052.1,10965558.0,4818797.491,8457661.234,3638863.742999999,94.85724547982491,32.899264792398014,3,False,True,False,9.0,97.0
102,211.0,Министерство торговли и интеграции Республики Казахстан,7430904.0,8885225.0,8298295.3,3994483.1,6874270.3,3852581.898,5023767.986,1171186.0879999995,96.44757035021627,46.426184640597214,3,False,True,False,9.0,97.0
